"Speaker Name","Start Time","End Time","Text"
"山本2","01:51:56:18","01:52:33:16","ジャパンアズナンバーワンって本気で思えた。それってやっぱり団塊の世代の人たちが就職してからのことなんですよね。しっかり企業社会に入って、うん、別に今までの感性でええやんと。これ日本のやり方でええやんというところがあって、その辺のズレ、当時の日本にとってはまだ成長できるというんでよかったのかもしれないけど、その辺が現代への向き合い方の、もしかしたら遅れとかズレにつながっている可能性ってあるかもわからんなと思って思ってるところですね。"
"山本2","01:52:33:18","01:52:49:09","だから成長の中でしか安定できひんって思える期間が長かった。むちゃくちゃ。55年から1955年から90年までってなったらね。そう、ちょうど自民党にも重なるけどってなると。"
"吉田2","01:52:49:09","01:53:20:21","うん、なるほどになる。符合的。例えばヨーロッパでいわゆる右派ポピュリスト政党が出てきて勢いを増したのって、やはりリーマンショックの後なんですね。ユーロ危機的なんですよね。それで言うと、日本は相対的にまだリーマンショックのダメージって少なかったので、やっぱりワンテンポ遅れて右派ポピュリスト政党なものが今出てきているっていう、ちょっとこう欧米から10年ぐらいちょっとずれるっていうところに、一つパターンとして。"
"大津留2","01:53:20:23","01:53:30:08","入れて、そして誰かがクッションになって、それを生じさせてたのが、何らかの仕組みが。"
"吉田2","01:53:30:10","01:53:47:23","それを僕はこれも持論なんですけど、日本って相対的にグローバル化の程度が低いと思うんですよ。経済的グローバリズムと言っても、例えば株式でどれくらい外国人が株式を持っているかっていうシェアを見ると、やっぱり実務の中で低いわけですよ。"
"吉田2","01:53:48:01","01:54:15:10","それから、移民の問題も当然そうですけれども、他のヨーロッパで言うと10%ぐらい、だいたい移民あるいは移民系と呼ばれている人達ですけど、10%、15が当たり前になってるわけですね。日本は13%ですよね。そういった意味では、やっぱりグローバル化の波の中で相対的に出遅れて、それは明治の時からそうですよねって話だと思うんですけど、そういう世界史的な日本の地位っていうのがやっぱりそうさせてるんですよ。"
"山本2","01:54:15:12","01:54:24:18","ちょっと遅れるっていうところですよね。だからそうそう、近代化も追いつけ追い越せやけど、ちょっと沈んでいくのも追いつけ追い越せっていうところはあるかもしれません。"
"大津留2","01:54:24:22","01:54:31:17","でも、遅れたからこそ周りを見てて、ああいう風にできる余裕があったんです。"
"吉田2","01:54:31:19","01:54:57:22","そうなんですよ。だから意思遅れのトップランナーみたいなね、地位にあるのは確かなんですよ。なので、やっぱりそれは我々の代わりに何かグローバル化の実験をしてくれてる国があるので、そこからいかに学べるかっていうところが、その立ち位置はやっぱり戦後になっても日本と変わらないのかなという印象は持ちます。"
"山本2","01:54:58:00","01:55:01:18","変わらない気がするのは。"
"山本2","01:55:01:20","01:55:07:15","先に失敗してくださってるんだったら、それを活かしてということになかなかなりにくいというところがあるね。"
"大津留2","01:55:07:21","01:55:20:08","なんか逆にちょっと日本違うからそうはならないって思ってるところがあるんですか？他の国は失敗したけど、日本はちょっと違うから大丈夫じゃないかみたいな。"
"吉田2","01:55:20:10","01:55:32:12","そういう反応も一般的にはありますかね。あれはやっぱり海の向こうの話だみたいな感じで。やっぱり対岸の火事っていう風に見なしちゃうっていう。"
"大津留2","01:55:32:13","01:55:36:00","何か対岸の火事を見て。"
"吉田2","01:55:36:02","01:56:15:03","もっと深刻なのは、でもそれこそ150年前からやっぱり脱亜入欧で、モデルがやっぱりあったわけですよね。それはもう多分にデフォルメされたモデルなんだけれども、一応モデルというのがあって、それにこう日本はアダプトしようっていう風になってきたんですけど、今逆に失敗で全然のモデルになっちゃって、そうすると日本っていうのはどういう風にある種の方向性みたいな、あるいは体系性みたいなものを獲得したらいいんだろうかっていうことを考えなきゃいけないように、なんとなく21世紀にそうだ"
"吉田2","01:56:15:09","01:56:22:16","という気がしますねとか、そういった意味で、ものすごくこの国の立ち位置みたいなものが変わる可能性は出てくるでしょう。"
"大津留2","01:56:22:18","01:56:34:12","今、教育も何かあるものを学ぶのではなくて、自分で考えられるような教育が言われますね。集合知、それも関係しているんですかね。何かこう、自分たちの。"
"吉田2","01:56:34:12","01:56:35:08","世界がなっ。"
"大津留2","01:56:35:08","01:56:41:04","ていかないと、もう真似する外のモデルがない。"
"吉田2","01:56:41:06","01:56:59:08","だから民主主義ってより重要になると思います。前もさっきも言いました民主主義って正解を選びとるのが正解を作っていくプロセスのことですよね。一人で考えてても何もそれは変わらないので。そういった意味ではみんなで3人集まれじゃない。"
"吉田2","01:56:59:08","01:57:26:05","集まればじゃないですけど、やっぱり意見を出し合って、ブレインストーミングをして、協調して、共同して、みんなで何かを作り上げる。その過程で民主主義という民主的な社会と呼ばれると思うので、今こそ逆に民主的な観念じゃない、民主的な単位の民主的な社会っていうのが必要になっている時期はないんじゃないかなと思ってます。"
"山本2","01:57:26:07","01:57:27:17","本当にその通りだと思う。"
"D2","01:57:27:19","01:57:34:23","んですね。"
"山本2","01:57:35:00","01:58:03:10","やっぱり追いつけ追い越せの時に、モデルがある時とモデルがなくなって、どうしたらいいんだろうっていう21世紀とじゃあ何かね、不思議だなと思うんだけど、追いつけ追い越せがあった明治時代の方が、甲論乙駁の議論が、いろんな可能性が出てくるんだけど、本来だったら追いつけ追い越せがなくなって指針がなくなった方が、いろいろな意見が出てきても良さそうなもんだけど、意外とそうじゃないっていう逆。"
"吉田2","01:58:03:10","01:58:09:03","ですよね。"
"山本2","01:58:09:05","01:58:19:03","ほんまに論じ方が分からんというか、何をしたらいいかわからんというふうに戸惑って、もう10年、20年経ってるというところがね。"
"山本2","01:58:19:05","01:58:37:20","結局だって新自由主義にしたってアメリカの真似まねじゃないけど、アメリカ的にやっておけばうまくいくかもしれないんですよ。行かなかったけどいいかもしれないね。でやってきて、その後のこの10年、20年ってなると、本当はもっと多様に。"
"山本2","01:58:37:22","01:58:42:17","議論が出てきてもいいけど、なかなか出てこ。"
"D2","01:58:42:19","01:58:47:14","インフレートすると、日本人の。"
"吉田2","01:58:47:16","01:58:51:16","つくづく思いますけど。"
"大津留2","01:58:51:18","01:59:16:07","一つ面白いのが、大学のね、こういう勉強するんですではなくて、君たちが何をするのかっていうので、ちょっと変わったプロジェクト、プログラム、成果ではないんですけど、やっているのが山岡塾というのがありまして、山岡淳太郎が学長だった時期がちょうど坂の上の2、30っていう、そういう時期だったんですけども。"
"大津留2","01:59:16:09","01:59:36:12","やっぱりその中で学んだことで閉じるのではなくて、社会とつないでいこうという学生バージョンのものなんですけど、考えたものを実際にやってみてそれでどうだったの？考える？っていう、そういう経験をしないと何か考えなきゃって思っても、そこからどう考えているか分からないっていう、それが私が変わってないので。"
"大津留2","01:59:36:12","01:59:43:20","うまくいってるのかどうか分からないんですけど、そんな面倒くさいことを手を挙げる学生がいると思ったらいるん。"
"D2","01:59:43:22","01:59:44:16","です。"
"大津留2","01:59:44:18","01:59:56:18","ので、一生懸命お話をしていて、まさに何かを見出すための議論をしているっていう、そういう経験ってなかなか生活でない。"
"山本2","01:59:56:19","02:00:04:22","のですよ。そう思います。なかなかないと思いますね。だから、だから大学ってとこなんやっていうのを私はよく学生には言うんですけど。"
