"Speaker Name","Start Time","End Time","Text"
"D2","01:00:01:08","01:00:05:06","しまったな。責任もあるんですけども、なぜ思わせてしまったんだろう。"
"大津留2","01:00:05:06","01:00:11:17","かっていうのが、私自身としてはまだ答えが出てない。クエスチョンマーク。"
"吉田2","01:00:11:18","01:00:45:06","政治家って基本的に誰が主権者か、つまり決定する力を持つのか、持つべきなのかの闘争の歴史でもあるわけですよね。それが例えばマルクス主義はまさに労働者がそうであるべきだって言ってたわけだし、そうすると、革命が起きるので、そういうのを排除すべきだというふうに言ってたし、あるいは第1次世界大戦後、主権が制約されてた国っていうのは、ファシズムがそれによって出てくるし、そうすると、民族と血っていう話になるわけですよね。"
"吉田2","01:00:45:08","01:01:04:12","やっぱり人間がそういった意味で自己決定をしたいという本能的に持っている何かというのがずっと続いていて、それが政治、人類のかなりの歴史を作ってきたことは確かだと思うんですよね。その自己の範囲だと思うんですよ。"
"吉田2","01:01:04:14","01:01:41:12","自己決定し言った場合、そこの想像できる自己にどれぐらいの人が入ってきていいのか、来てもらいたいのかっていうのがやっぱり狭まると。やはりいわゆる排除の論理になっていって、その排除される人はその時代、時代の文脈によって変わるんですけれども、やっぱり自分に対する想像力というか、さっきの民主主義の話なんですけど、自分がどれぐらい開放的になれるかということによっても、自己決定権のあり方っていうのも変わるんだろうなというふうに感じますね。"
"山本2","01:01:41:13","01:02:10:02","いや、日本の場合は、それこそ戦争中は多民族国家だとこととむしろ押し出すんですよね。それはもちろん領土的に拡張して、帝国で多民族だからあなたたちも同じですよってことを、同じというか、その中でもグラデーションがありますけどね。それが戦後になって、いわゆる単一民族神話みたいなものが形成されていくというのは先行研究があるところですけど。"
"山本2","01:02:10:04","01:02:38:16","だから今のアメリカも排除の論理が入ってるけれど、排除の論理が前面に出てきているように見えるし、その通りなんだけど、別に同じ現象を包摂の論理で唱えることだってかつてはしてきたわけですよね。それが移民国家の強さなんだっていう形で、その時代によってその説明の論理が同じ現象だと思うんだけど、説明の論理が変わっていくための範囲が変わっていく。"
"山本2","01:02:38:21","01:02:44:14","私たちの街が変わっていくっていうのがやっぱり面白いし、面白いというか。"
"吉田2","01:02:44:16","01:03:05:10","今の話でインスパイアされたんですけど、少なくても20世紀とアメリカの世紀ですよね。ある種、巨大な帝国としてアメリカは存在していて、戦後は世界的な覇権大国としてアメリカは存在をしていて、オバマぐらいの時から徐々にその世界の警察官であることをやめますというふうにオバマ大統領行ったわけですね。"
"吉田2","01:03:05:10","01:03:29:11","その延長線上に、そういった意味ではトランプって位置づけられると思うんですけど、帝国であろうとしてやめたということをアメリカが、つまり帝国って基本的に多民族で、いろいろなものとこう共生していくというか、帝国ですけど、それを止めようとしているアメリカだからこそ、むしろ今、移民排斥みたいなものが広がっているっていう風に解釈できますかね。"
"吉田2","01:03:29:16","01:03:36:08","いかがでしょうか。"
"大津留2","01:03:36:10","01:03:40:13","でも、2050年には人口が。"
"吉田2","01:03:40:14","01:03:41:14","白人。"
"大津留2","01:03:41:16","01:03:48:04","の今でいう気になるっていうのを排斥していっても、その大きな流れも。"
"吉田2","01:03:48:06","01:03:52:15","そうです。"
"大津留2","01:03:52:17","01:03:59:04","なぜそれを恐怖だと思うのですが。"
"大津留2","01:03:59:06","01:04:30:02","トランプが出てきたときにWHITEAGILITYっていう本が訳されたんですけれども、何かこう、白人がどこかに自分たちは有色の人たちと違って優れているんだというのがどこかにあって、それをこう覆されていく。それがこう失わなければいけなくなってることに対する恐怖心というか、そういうものがマイノリティーに対する排斥みたいに出てくるんだっていう、そういう。"
"吉田2","01:04:30:04","01:04:59:19","点でも社会心理学的にはわりかしわかりやすい話だと思うんですけど。つまり、排除された側は排除される恐怖感をやっぱり排除する側は排除される恐怖に脅かされるんですよね。今、例えば弱者男性みたいな、それこそ言葉が流行ってますけど、あれも基本的に女性を抑圧してきた様々な、とりわけ日本だと経済的理由で女性の社会進出が進むと、自分の権力が奪われる。"
"吉田2","01:05:00:00","01:05:23:23","権力を0サムで行っちゃって、ゆえに排除することで自分の存在とか社会的な地位っていうものを成り立たせてきたんだけども、それが脅かされるというふうに見ちゃうんですよね。自分が抑圧してきたから、やっぱりどうしても心理的な恐怖っていうものにつながるんじゃないかなというふうには。"
"大津留2","01:05:24:01","01:05:25:20","説明をするじゃない。"
"吉田2","01:05:25:22","01:05:27:06","もちろんそうです。"
"大津留2","01:05:27:07","01:05:29:09","ね。そこでも今。"
"吉田2","01:05:29:11","01:05:32:21","自分が悪いんですよ。自分のせいなんですから。そうなんですね。"
"大津留2","01:05:32:23","01:05:37:09","でもなかなかね、自分が悪いからで。"
"D2","01:05:37:11","01:05:43:10","なかなかね、それをですね。"
"D2","01:05:43:12","01:05:50:13","ありがとうございます。これもあっという間に1時間、就労時間外として。"
"D2","01:05:50:15","01:06:03:09","非常に面白いお話が聞けてますが、2点ちょっとこれも聞いてみたいなという話を入れるとですね。"
"D2","01:06:03:11","01:06:09:12","1個は、今申し上げたのはアメリカの。"
"D2","01:06:09:14","01:06:23:18","戦後の移民排斥みたいな話がある一方で、帝国主義的なで、後半の話かもしれないんですけど、どんどん過ぎて今言ってるじゃないですか。"
"D2","01:06:23:20","01:06:40:01","それっておっきいアメリカみたいな話として考えると、なんかむしろだったらそこではアメリカの裏庭みたいな言い方だから、完全に郊外はあるんですけど。"
"D2","01:06:40:03","01:06:52:04","こっちに戻ろうとしてるのかなっていう話をしようかなというのが一つの大きな話なのかもしれませんが、1個は。"
"D2","01:06:52:06","01:07:18:17","山本さんにぜひいろいろお話をしてもらいたいなと思うのは、その社会的な役割みたいな感じで、役割というよりはどう描いてきたかみたいなこともぜひ。山本さんのゴジラの話とか好きなもので聞いてみたいだけなんですけど、もし今出てきた流れの中で。"
"D2","01:07:18:19","01:07:25:22","何かカルチャー的な話をちょっと入れていただけると嬉しいなと思った次第です。"
"山本2","01:07:26:00","01:07:29:02","なるほどな。"
"D2","01:07:29:04","01:07:34:18","ちょうどちょうど僕の干支でいうと。"
"D2","01:07:34:19","01:07:50:15","白人というのか、今年のアカデミー賞をとった2作が、どっちも人種問題というか革命みたいな。一歩は黒人の歴史の話をしていて、もう1個は。"
"D2","01:07:50:17","01:08:03:20","リベラルのまとめ。なので、その辺をそれこそ炭鉱のカナリア的にいろいろ描いたりしてるよねという。"
"D2","01:08:03:22","01:08:10:14","話をいろいろ思っていたところなので、当時をどう。"
"D2","01:08:10:14","01:08:17:19","描いてきたかみたいな話が。いや、すいませんんやなと思って聞いてみたいな話を覚えてるんだけど。"
"山本2","01:08:17:19","01:08:35:05","どうだろうね。何をテーマにするかによって引っ張ってくるポピュラーカルチャーも違うかなって思いますけど、例えば民主主義とか民っていう感じってことですかね。"
"D2","01:08:35:07","01:08:50:02","あとは東京の話だと、エリートが全部公共の港から降りようとしているみたいな話も。"
"D2","01:08:50:04","01:08:52:18","どのような立場でというわけではない。ああ。"
"山本2","01:08:52:20","01:09:16:23","なるほどなあ。いや、僕はだからサブカルチャーでぱっと思いつくのは悪役の描き方なんですけど、悪役とか殺人犯とかの描き方なんですけど、ある時期まで黒澤明でもそうだし、山崎豊子原作でもそうだけど、その凶悪っていうのは社会が生んだ悪なんだと。"
"山本2","01:09:17:01","01:09:39:10","あるいは殺人事件も社会が生んだものなんだというような捉え方っていうのはあるわけですよね。金弘の立てこもり事件もそうだし、それは確かに今でもそういう見方は有効だっていうふうに思いますけど、サブカルチャーを見ていると、どんどんどんどんサイコスリラーの方に70年代、80年代いくわけですね。"
"山本2","01:09:39:12","01:10:20:11","頭のおかしい、恐ろしい、大変怖い奴だというふうに変わっていくっていう、そういう犯人像、悪役像が変わっていくっていうのが面白いと思っていて。21世紀に入ると、このヴィランとかって言って、悪のヒーローですねが出てきたりもする。そういう悪役。私らサブカルチャーって、やっぱり多くの観客が納得する人間像っていうのを一生懸命出していくもんだから、やっぱりそこには、それはあくまで卵の方でしょうけど、そこにはやっぱり私らの共同主観的な社会像というのがどうしても現れると思うんですけど、私は性"
"山本2","01:10:20:16","01:10:39:03","犯罪とか悪の表象に社会と個人の関係っていうのが現れているのかなっていうふうに思いますね。うん。悪者であってもヒーローになりうるっていうのは、もう21世紀的っていう気が私はしてましたけどね。そういうところも思います。"
"吉田2","01:10:39:07","01:10:46:12","仮面ライダーとかでも、誰が正義の味方で誰が悪いものかわかんないですよね。確かに確か作ってますよね。"
"山本2","01:10:46:14","01:10:50:15","よくできた脚本なんですよ。ウルトラマンもそうですけどね。うん。"
"吉田2","01:10:50:17","01:10:57:20","確かにあのことでも子供に善悪の判断とかってどうやって教えたらいいんですか？"
"山本2","01:10:57:22","01:11:01:03","それは、ヒーローものはヒーローものの場合は制御発。"
"D2","01:11:01:03","01:11:02:09","で。"
"山本2","01:11:02:11","01:11:07:15","いいんだと思うんですけど、勝った方が正義という、それはそれで問題化するだろうし、それはそれで問題。"
"吉田2","01:11:07:16","01:11:09:22","ないから上。"
"山本2","01:11:10:00","01:11:17:01","に押し込めちゃうっていうところも、やっぱり子供向けのサブカルチャーの問題かなという気もしますけどね。"
"D2","01:11:17:03","01:11:21:06","でも今お話があった今。"
"D2","01:11:21:08","01:11:25:23","ウルトラマンとか仮面ライダーも終わりましたけど。"
"D2","01:11:26:00","01:11:31:03","ウルトラマンだということがよく言われたりとかするように。"
"D2","01:11:31:05","01:11:36:21","そういう善悪の中の子供であっても、それに応えるような思考がまだ。"
"D2","01:11:36:23","01:11:44:03","展開できた時代でもあったけど、もう20世紀を耐えられなくなってきたっていう、そういう語り方もでき。"
"山本2","01:11:44:05","01:12:17:17","そうです。脚本とかのレベルでは、やっぱりこう、戦後の革新運動に関わってた人たちがテレビ業界の脚本とかに行くっていうのが、まず事実ベースとしてはあると思いますけど。でも一つ言えるのは、今誘導してくださったように動いたんでしょうね。子供を馬鹿にし過ぎないって言うか、これでもわかるんだっていう、視聴者はこっちについてくるんだっていう、そういういい意味での前衛感というのは、やっぱりある時期までのサブカルチャーの作り手たちに共有されているっていうふうに思いますね。"
"山本2","01:12:17:17","01:12:36:02","これはサブカルチャーだけじゃなくて、メディアもそうだっていうふうに思いますけれども、引っ張っていけるという自負ですね。それはある時期までは強く感じますね。急にある時期から優しくなっていくっていう感じがします。私が子供の頃くらいになると、もう優しい子供向け文化に親しんできたっていう感じですね。"
"山本2","01:12:36:05","01:12:51:06","丸いのばっかりでしょう。ドラえもんもあれもアンパンマンも丸いのばかり。トゲトゲになっていないですよね。仮面ライダーみたいにね。仮面ライダーは画面内で続いてますけれども。ちょっと暴論で失礼します。"
"大津留2","01:12:51:08","01:12:58:10","それは社会が子供をどう育てるかは変わってきたということ。"
"山本2","01:12:58:12","01:13:16:15","当然育てるかっていうところまで言えるかわからないけど、やっぱり社会が子供にここまでやったら見せていい野郎の許容範囲が変わってきた。子供をある意味、ある意味じゃ温室、ある意味じゃない。それはいいことなんだと思うし、望んだことなんだけれども。"
"山本2","01:13:16:17","01:13:18:06","いろんな領域で言えると思います。"
"大津留2","01:13:18:06","01:13:29:08","中間っていうようなもんで、悪いとはかけない。いいけどがあるよみたいな。"
"吉田2","01:13:29:10","01:14:01:18","映画でいうと、アメリカのSF映画って基本的に冷戦の従属変数ですよね。冷戦がどうであるかによって宇宙人の描き方が変わるんですけど、敵対的だったり友好的だったりするんですけど、最近のプロジェクトメアリーヘイリーっていうのがあるんですけど、結構原作がもともと人気だったんですけどを映画化して、そこに出てくる宇宙人が普通は地球人と同じ境遇にあるっていう描き方だったんですね。"
"吉田2","01:14:01:18","01:14:39:10","お互い孤独で孤立をしてて、仲間がいなくてな、脅威にさらされているっていう、そういった設定だったんですけど、そう見るとだいぶやっぱりアメリカの世界認識って変わってきたんだなっていうふうに思うんですよね。今までなんとなく宇宙人と協力したり、あるいは宇宙人をやっつけたり、侵略されてるっていう強いアメリカの基本的な描き方だったんだけども、だからむしろアメリカもなんかどんどん衰弱してて、衰弱した向こう側にも衰弱している相手がいるっていうなんとなくの世界観で、ちょっと新しかったん"
"吉田2","01:14:39:10","01:14:50:18","ですね。そういった意味で、アメリカの何か今の自分の外の世界の認識の仕方って変わってきてるのか。"
"山本2","01:14:50:20","01:14:54:23","ちょうど今言うてたライアンゴズリングさんね。"
"吉田2","01:14:54:23","01:14:59:18","そうそう、原作は読んでないんですけど。"
"吉田2","01:14:59:20","01:15:04:07","ちょっとちょっと期待がそこまで面白かったから。"
"山本2","01:15:04:09","01:15:05:01","まだ見てない。"
"D2","01:15:05:01","01:15:08:23","です。"
"D2","01:15:09:01","01:15:10:13","ありがとうございます。"
"吉田2","01:15:10:15","01:15:11:15","と。"
"D2","01:15:11:17","01:15:24:17","興奮してという販売代理店の人なんです。経過して言うことがあれば。"
"D2","01:15:24:19","01:15:37:23","過去はこれから移動してそうですね。移動しようかどうしようかもちょっと迷ってるんですけど。"
"D2","01:15:38:00","01:15:42:18","一旦休憩も入れようかなと思いつつ。"
"D2","01:15:42:20","01:16:04:07","この学校はまさに政治的な方がいる。評価されてここまで空間が広くないのと、そんなにゆったり座れないんです。新宿にちょっとしたベンチがあるんですが。"
"D2","01:16:04:09","01:16:07:10","それはエンディング。"
"D2","01:16:07:12","01:16:15:10","の場所が存在しないというのがあり。"
"D2","01:16:15:12","01:16:19:16","水飲んだりトイレ行っとなるんだ。"
"D2","01:16:19:18","01:16:23:05","けども、どうも。"
"D2","01:16:23:07","01:16:23:15","大丈夫。"
"山本2","01:16:23:15","01:16:28:03","そうではないだけかと。"
"D2","01:16:28:05","01:16:30:20","マイクを止めた後。"
"吉田2","01:16:30:22","01:16:31:14","喫煙体。"
"D2","01:16:31:15","01:16:35:23","で遊んでいるのか。"
"山本2","01:16:36:01","01:16:38:02","時計というか、これ。"
"吉田2","01:16:38:04","01:16:42:18","がなくてもいいかも。"
"山本2","01:16:42:20","01:16:43:14","持っていても大丈夫か。"
"D2","01:16:43:14","01:16:44:03","な？"
"山本2","01:16:44:05","01:16:44:15","このままで。"
"D2","01:16:44:15","01:16:47:15","もらって収録してるので外して。"
"山本2","01:16:47:17","01:16:49:16","そうか、そうしましょ。"
"D2","01:16:49:18","01:16:53:13","うか。ない。"
"D2","01:16:53:15","01:16:59:10","ちょっとここに収まっ。"
"大津留2","01:16:59:12","01:17:00:13","どこに行くか。"
"D2","01:17:00:15","01:17:06:21","こっち。皆さんお手洗いと喫煙。"
"D2","01:17:06:23","01:17:18:19","公会堂の中には確実です。"
"D2","01:17:18:21","01:17:33:22","なかなか難しいかもしれ。マイクそのままの場所に置いておいてください。"
"D2","01:17:34:00","01:17:37:08","みんな離れます。"
"D2","01:17:37:10","01:17:41:10","はいはい。"
"D2","01:17:41:12","01:17:58:03","場所は？そうだ。バラ園に行くかどうしようか。バラ行ったところであんまり話が膨らむ話でもないので、公会堂の前か図書館の方考えるのがいいかな。でも図書館の前まで行っても。"
"D2","01:17:58:05","01:18:04:05","割れやすい場所にして。"
"D2","01:18:04:06","01:18:11:00","だけはちょっと行ってもらおうか。そうですね、そうですかね。それでいいと思います。"
"D2","01:18:11:02","01:18:17:16","から、そこはたまに救急車のと聞こえますけど、ここまで。"
"D2","01:18:17:18","01:18:52:10","色々したものがなければ。その場所でやりましょう、届け出て。それで後半はもう一回またの場所の話がいいのかなと思うんですけど。これ以上コミュニティ場を、同じ場には建物を、そういうちょっと市場の話を少し絡めると、民主主義だとかそういう話が出来ているかなと思う。"
"D2","01:18:52:12","01:19:12:06","申し訳ないけど。"
"D2","01:19:12:08","01:19:21:10","今の。"
"D2","01:19:21:12","01:19:28:05","同時に2重構造ができててる。"
"D2","01:19:28:07","01:19:51:07","ということで、聞いてる人に。"
"D2","01:19:51:09","01:20:02:17","アンケートで山本さんがまさにそういうテーマで書いてるだよねと思うので、ちょっと方向性。"
"D2","01:20:02:19","01:20:08:19","を。"
"D2","01:20:08:21","01:20:20:00","がたくさんありすぎて、どれって出そうかなというのであれば、ここだけガイドしてあげればいいかなと思いますけど。"
"D2","01:20:20:02","01:20:25:21","最後のさっきの話の流れがあった上で。"
"D2","01:20:25:23","01:20:29:20","だという話にしてほしい訳。"
"D2","01:20:29:22","01:20:35:21","で、こちらの話をしてみてもいいと思うんですけど。うんうん。"
"D2","01:20:35:23","01:20:47:05","そうそう。その流れで出てきてほしい話なんですけど。"
"D2","01:20:47:07","01:20:51:22","もう1。"
"D2","01:20:52:00","01:21:08:16","米さっきの。面白いと。"
"D2","01:21:08:18","01:21:12:17","近代化というか技術。"
"D2","01:21:12:19","01:21:17:18","という。"
"D2","01:21:17:20","01:21:26:15","アメリカは見える。構造的にもともと考えてたが。"
"D2","01:21:26:17","01:21:27:17","問題なのか。"
"D2","01:21:27:20","01:21:34:07","それを分かった上でやってるのか。今までは。"
"D2","01:21:34:09","01:21:40:05","やっぱりその中間のバランスが両方。"
"D2","01:21:40:07","01:21:42:13","の。"
"D2","01:21:42:15","01:21:48:17","構造的に民主主義。"
"D2","01:21:48:19","01:21:58:13","がいいのかなとのが。"
"D2","01:21:58:15","01:22:00:16","考えて言われています。"
"D2","01:22:00:18","01:22:02:21","そうですね。いやいや、そうそう、そうなんですね。"
"D2","01:22:02:23","01:22:14:02","ちょっとそこがありますので。"
"D2","01:22:14:04","01:22:17:07","でも。"
"D2","01:22:17:09","01:22:22:07","それがあって休憩に入っ。"
"D2","01:22:22:09","01:22:23:21","戻ってきたらごめん。"
"D2","01:22:23:23","01:22:31:02","ねっていう話をしている間に、ちょっともう一回少し。"
"D2","01:22:31:04","01:22:48:15","入って関係性ができてたら。そうですね、ちょっとこちらとしては期待します。かなり研究してきました。現場でははまあまあまあ。そうですね。"
"D2","01:22:48:17","01:22:49:11","吉田さん、委員会。"
"D2","01:22:49:11","01:22:57:15","はやっぱりここどういうスタンスで。"
"D2","01:22:57:17","01:23:11:00","引き出してもらったりする。"
"D2","01:23:11:02","01:23:20:19","パートはあるとは思うので、前半はいいと思いますけど、過去の話や過去の話って。"
"D2","01:23:20:21","01:23:45:09","今の現在につなげる話としては、市民の拡大みたいなのが一番格好の話かなと思って聞いてたんですけど、でも実はそろそろ、そもそもアメリカの民主主義って言ったら、そもそもフランスに行ってとか、まあそうか、そもそも日本は民主主義ってやっぱりちょっと不足してるみたいな。"
"D2","01:23:45:11","01:23:53:19","そもそもそれぞれのアメリカ。と。"
"D2","01:23:53:21","01:24:00:03","違いますよね。"
"D2","01:24:00:05","01:24:05:11","国かもしれないけど。"
"D2","01:24:05:13","01:24:18:09","そうですね。ちょっと市民権の拡大に終始しすぎて、そこはちょっと足りないの。中ではもうちょっと動いてるんじゃ。"
"D2","01:24:18:11","01:24:24:13","と聞いてるっていう。そうですね。そうですね。"
"D2","01:24:24:15","01:24:39:03","そうですね。もうちょっとお話しできるかもしれないね。そこは一つのポイントになるかもしれ。"
"D2","01:24:39:05","01:24:50:07","ない。"
"大津留2","01:24:50:09","01:24:59:14","です。"
"大津留2","01:24:59:16","01:25:05:16","たいと思うくらいの感覚です。"
"大津留2","01:25:05:18","01:25:13:09","感覚こういう。"
"吉田2","01:25:13:11","01:25:18:00","今回はちょっと長いですけど。"
"吉田2","01:25:18:02","01:25:24:23","50代で。"
"D2","01:25:25:01","01:25:47:04","いつも人ですから長い休憩なしです。"
