"Speaker Name","Start Time","End Time","Text"
"大津留2","01:25:47:06","01:26:12:21","けど、何回かありまして、レーガンが撃たれた直後から2年間ちょっと、その後開くんですけど、85年、86年、本当はそこ長くいるつもりだったんですけど、この瞬間生まれたもんですから帰ってきまして、その後はもう一人で行ったり、子供連れて行ったりっていう。"
"大津留2","01:26:12:23","01:26:16:08","最後がオバマの。"
"大津留2","01:26:16:10","01:26:24:05","選挙戦の時に最後一人で酒が入ったのは、長期で行くのが最後でした。"
"大津留2","01:26:24:07","01:26:42:13","裸で正気でいても体力なくなってくると、もうずっとやらなくて短期で行こう。効率的かな。"
"大津留2","01:26:42:15","01:26:49:05","探し出しちゃったりして結構わかりにくいんですが、そうですか。"
"大津留2","01:26:49:06","01:26:53:16","そういうことはないと私は思っていらっしゃったら申し訳ない。"
"D2","01:26:53:18","01:27:26:00","んですけど。"
"大津留2","01:27:26:02","01:27:41:03","それで大学が禁煙にしたらどうなったっていう話になって、こうブース喫煙できるブースに卒園ブースとかって。"
"大津留2","01:27:41:05","01:27:59:20","そこに入ると吸ってると肺が困難になりますっていう写真があった。"
"大津留2","01:27:59:22","01:28:00:06","んです。"
"D2","01:28:00:06","01:28:07:15","よ。"
"D2","01:28:07:17","01:28:15:14","行くという状態なので。"
"大津留2","01:28:15:16","01:28:21:19","大阪がキャンパス内禁煙っていうのを徹底。"
"大津留2","01:28:21:21","01:28:55:18","しなさいっていう目標があって、どんどんどんどん近づいてきて。で、結局喫煙場所を撤去したんですよ。そしたら大学の前のお店が吸い殻入れを置いてくれると。そこに。"
"D2","01:28:55:19","01:29:26:03","集まりますと。"
"大津留2","01:29:26:05","01:29:30:09","ずっとそこに人だかりがあるのが何だろうと思って気になってるんですけど、何な。"
"D2","01:29:30:09","01:29:31:23","んですか？"
"大津留2","01:29:32:01","01:29:53:06","あ、なるほど。私、立ってるわけじゃなくて、座ってらっしゃる。"
"D2","01:29:53:08","01:30:04:22","工夫していただければ。"
"D2","01:30:05:00","01:30:16:09","歩いて。"
"D2","01:30:16:11","01:30:26:04","市役所まで。"
"大津留2","01:30:26:06","01:30:33:21","走ろう。"
"大津留2","01:30:33:23","01:30:41:10","こちらへ帰ったところがありますね。いいですよ。ただ統計なかなか。"
"大津留2","01:30:41:12","01:31:29:12","拾います。"
"D2","01:31:29:14","01:31:31:22","ね。喫煙所探してすいません。"
"山本2","01:31:31:22","01:31:33:09","申し訳ありません。"
"大津留2","01:31:33:11","01:31:34:12","がなかった。"
"D2","01:31:34:14","01:31:37:04","安全が。"
"吉田2","01:31:37:06","01:31:39:11","島の中はダメなんですね。"
"山本2","01:31:39:15","01:31:40:17","そうそう長島から。"
"D2","01:31:40:17","01:31:41:16","出てしまうから。"
"吉田2","01:31:41:18","01:31:45:12","島から出ました。"
"山本2","01:31:45:14","01:31:48:03","で、駐車場に入って。"
"吉田2","01:31:48:05","01:31:54:13","そこも禁煙って書いてあっ。"
"D2","01:31:54:15","01:31:56:16","そうでした。"
"吉田2","01:31:56:18","01:32:07:05","映像です。お店が喫煙可能です。"
"吉田2","01:32:07:07","01:32:10:08","そこで吸ってるんですよ。"
"山本2","01:32:10:10","01:32:19:02","みんな。そうそう。いい塩梅で場所を見つけます。"
"D2","01:32:19:04","01:32:38:06","から後半に行きましょう。後半番組のちょうど切り替えででっかいニュースが挟まって後半になっています。冒頭はまた大阪で収録しているよみたいな話が出るといいなと思うんですけど。"
"D2","01:32:38:08","01:33:03:21","多分、吉田さんが最初に言っていた中島来ると思いますみたいな話をぜひ聞いてみたいので、その話からでもいいですし、あとは公会堂の話だけじゃなくて、大阪府庁というのはもう結構特徴のある建物ではあるでしょうね。大阪というのは東京から独立しているということ。"
"D2","01:33:03:23","01:33:32:06","そこは大阪出身の山本さん。ぜひいろいろと東京をどう見ているかみたいな話でもいいんですけど、そういう中之島から撮ってますよみたいなことをぜひ立ち上げて使っていただいて。大阪でいうと、そもそも民主主義って何だという話をいろいろグリーンとは何だみたいな話からしていただきましたけれども。"
"D2","01:33:32:08","01:33:57:11","民主主義という政治制度を考えるようになって、教科書的かもしれませんが、いろいろ歴史の勉強にならない程度にいろいろ振り返りつつ話をスタートしていきたいなと。番組後半は神戸会場があった場所ですので、ぜひちょっと資本主義との絡みみたいなのもいただきたいなという大枠の流れでございます。"
"D2","01:33:57:11","01:34:17:03","また、1時間ほど収録できたかなと思いますので、よろしくお願いします。"
"D2","01:34:17:05","01:34:21:17","風景の話からぜひお願いします。"
"大津留2","01:34:21:19","01:34:27:22","そうなんですよ。あそこの人だかりは何なんだろうと思ったら、上から下。"
"山本2","01:34:28:00","01:34:35:01","側を覗いて、確かにパリっぽいかも。"
"吉田2","01:34:35:03","01:34:44:09","ね、セーヌ川沿いにキリスト古本屋さんがこう並んでも有名ですよね。"
"吉田2","01:34:44:11","01:34:58:13","パリオリンピックの時はあれを撤去させて強制的に。それで問題になったんですけど、ちょうど開会式をあそこでやるのでというので、今戻ってきてますけどね。"
"山本2","01:34:58:15","01:35:19:00","その頃の話ですけれども、この辺、たしかにきれいですけど、ちょっと整然としすぎているっていうところがあってね。それはもうできることとできることがいろいろ決められてて、実は居心地いいように見えて、果たしてっていうところは感じますけれどもね。この辺ね。"
"吉田2","01:35:19:01","01:35:37:18","人工的に公共の場所を作るって基本難しいんじゃないの？歴史的な。やっぱり積み重ねの解放区みたいなものじゃないですか。そこを何か行政がお金をつけたり、デベロッパーが開発したり、何かそういった公共を作るのって、多分本来の。"
"D2","01:35:37:18","01:35:40:02","公共じゃないんだろうなと。"
"山本2","01:35:40:04","01:35:47:04","そうですね。この中之島もまさに何もなかったところに作ったわけですよね。確かにそうかもしれ。"
"大津留2","01:35:47:06","01:35:50:11","広島なので、どうしても川。"
"山本2","01:35:50:11","01:35:51:15","の獺祭。"
"大津留2","01:35:51:15","01:36:18:18","さんの通りって言ったら、原爆の後の不法住宅っていうことは、もう子供の頃から不法住宅、不法住宅はもう住むとこないので作るわけですよね。川岸だったらまだ良くて、川の中にも柱立てて作ったりして、それを全部止めるんだというのが一斉に行われて、そうならない上、何年ものだったかな、私が。"
"D2","01:36:18:18","01:36:19:12","昭和50年。"
"大津留2","01:36:19:15","01:36:22:05","だったような気がするんですけど、私が考えている。"
"山本2","01:36:22:09","01:36:29:08","のかな。いや、60年代。"
"大津留2","01:36:29:10","01:36:35:07","70年代にじゃどこに住むの？というので、高層アパート。"
"D2","01:36:35:09","01:36:36:11","とかは川沿いにです。"
"山本2","01:36:36:11","01:36:37:10","が、元町アパート。"
"大津留2","01:36:37:10","01:36:58:12","とかね、そうですね。それでもう川きれいになったでしょっていう、これでも不法な住み方しなくていいんですよということなんですけども、別にきれいになるのはいいし、いい住環境に住めるのはいいんですけども、ものすごく大事な歴史の歩みっていうものが。"
"山本2","01:36:58:14","01:37:03:16","ずっと両立されます。"
"山本2","01:37:03:18","01:37:12:21","そうなんですね。公共空間かもしれないけど、ホームレスは排除されたりとかね。そういういろんな問題がやっぱりあるんだろうというふうに思いますね。"
"吉田2","01:37:12:23","01:37:23:20","学生連れて一回、1年に一回海外に行くんですけど、去年はスラムっていうものを見てほしくて、ちょっと昔の日本だっあったんでしょうけども。"
"D2","01:37:23:22","01:37:30:08","フィリピンの有名なスラム街、いくつかありますけど。"
"吉田2","01:37:30:10","01:37:35:03","ガイド付きなんですけれども。で、人が生活するという。"
"D2","01:37:35:03","01:37:40:00","のはどういうものか見てもらいました。"
"山本2","01:37:40:02","01:37:44:16","マンションを探さなきゃないですもんね。そういうところ。"
"大津留2","01:37:44:18","01:37:47:08","で天王寺の公園もきれいに。"
"山本2","01:37:47:10","01:37:47:12","し。"
"大津留2","01:37:47:12","01:37:50:17","てきれいですけど。"
"D2","01:37:50:18","01:37:54:18","どこに行ったんだって思います。"
"山本2","01:37:54:20","01:38:21:15","だから大阪の街もJR大阪の駅前再開発して、いろんな商業施設になってるんですけどね。何かやっぱりプチ東京っぽくなっちゃって、きれいで。確かに今風な居心地もいいなと。確かにバリアフリーだし、価格が安い。居心地はいいんやろうけど、まあでも何かあっ点東京も変わらなっていうような感じはしちゃいますよね。"
"山本2","01:38:21:20","01:38:26:10","それはやっぱりデベロッパーさんの判断なんでしょうけど。"
"吉田2","01:38:26:12","01:38:47:13","1言目に安心安全がキーワードですか。確かに安心と安全は大事なんだけれども、安心安全を作り上げるために、やっぱり我々は失っているものがあるんだっていう意識があるとないとでは大分構えみたい。"
"D2","01:38:47:15","01:39:25:15","と思います。もちろん東京っぽくなってきてしまうのもそう。否定的な話で、資本主義とかも関係してくるんだと思うんですけど、そうはいっても残っているものというか、運搬とか、やっぱり東京から見ると大阪と違うとは思うんですが、そこらへんは山本さんとかは残っている部分というのは、だから商人の街みたいな、今一応ブランドがあるというか、当然あるとは思うんですけれども、商人みたいなやつって何かないですか？"
"D2","01:39:25:17","01:39:27:21","北海道もそうですけど。"
"山本2","01:39:27:23","01:39:30:23","残ってる物はですね。"
"D2","01:39:31:01","01:39:54:02","山本さん、確かとその人の名前が度忘れしましたけど、1000とか1,000万とかって何か残っている部分はないですかね。時間というか独立時間。"
"山本2","01:39:54:04","01:40:17:18","まず前段階として、私なら出身で外京都で、大学で今住んでいるの。兵庫で大阪住んだことなりっていうのをまず前提として多いんですよ。表として申し上げておくんですけど、でも大阪の文化とかっていうのは、もう関西に住んでいると避けられないんですよね。"
"山本2","01:40:17:18","01:40:22:12","つまり、在阪メディアがみんな。"
"山本2","01:40:22:14","01:40:45:16","強くて、吉本新喜劇、子どもの頃から見ててみたいな。そういう環境なんで。あと大大阪時代からの大阪の、何て言うんですか、対東京に対する矜持みたいなものって。奈良に住んでてもそのマスメディアを通して共有されるんですよね。そういう限定でお話していこうっていうふうに思いますけど。"
"山本2","01:40:45:18","01:41:03:04","確かにですね、大阪は権力としたたかに向き合ってきた町人精神の街だっていうふうに言われることもあって、そういう人を探そうと思えば確かに探せるんだけれど、どうでしょうね。私が大きくなってから。"
"大津留2","01:41:03:04","01:41:05:08","だったら。"
"山本2","01:41:05:10","01:41:25:05","そういう精神性とか県民性のレベルで、府民性のレベルでそういったものは共有されてるかどうかっていうのは甚だ怪しいと思いますね。在阪メディアなりタレントさんなりっていうのが、面白おかしく大阪性を持ち上げていくっていうことの方が目に付くっていう気がします。"
"山本2","01:41:25:09","01:41:49:12","それは政治家も含めてですけどね。で、その前提の上で、でもやっぱり大阪らしいものが残っているって、いうふうに思うところっていうのは、いくつかありますね。それはやっぱり人間関係のコミュニケーションのあり方ですけど、これはもしかしたら京都もそうなのかもしれませんけどね。"
"山本2","01:41:49:14","01:41:52:16","ものすごく。"
"山本2","01:41:52:18","01:42:25:08","曖昧な形でお前、俺とお前は違うんだって言いながら、でも共存するような形の言葉って結構あるんだろうっていうふうに思うんですよね。別にアホ一つとってもそうだっていうふうに思うんですけど。うん。バカにしたり茶化したりしながら、同じ場所で共存していく、そういう機運っていうのは、大阪の文化とまで言っていいかわからないけど、そういうところは至るところで感じますね。"
"山本2","01:42:25:10","01:42:30:14","偉人そうそうそうそうそう。SDGSっていうのが。"
"吉田2","01:42:30:16","01:42:33:11","なんで共生があるんですけども。"
"山本2","01:42:33:13","01:43:12:14","例えばめっちゃ怖い人とか、めっちゃ困った人とか、変わってもいっつもかき乱す人とか、何万回言うやつだからしゃあないわっていう形で排除せずに、もしかしたら心理的には排除してるのかもしれないけど、むしろいじって笑って、もうもう流してしまう。そういう困った人の扱い方の懐の深さみたいなことは、確かに東京とかよりは感じやすいかなって思ったりするのは、場所とか空間というよりは、こう、コミュニケーションのあり方に僕は感じることが多いかなって思いますね。"
"山本2","01:43:12:19","01:43:25:00","それを強引に繋げると、やっぱり承認の合理性っていうことにも繋がるのかもしれませんけどね。それはもうお客さんでなるかもしれへん。人を排除するようなことは絶対しませんからね。"
"山本2","01:43:25:02","01:43:30:16","ちょっとやや強引かもしれませんけど、そういうコミュニケーションのあり方に感じることが多いかな。"
"大津留2","01:43:30:18","01:43:31:22","生きてしまわないって。"
"山本2","01:43:31:22","01:43:59:08","うん、そう思いますね。サブカルチャーの話になるけど、そういうのって関西の子どもたち、テレビの吉本新喜劇とかで教育されているんですよね。ヤクザも出てくるし、身体的特徴が著しい人もたくさん出てくるけど、みんな一緒に何か笑ってこけて、何かよくわからんまま共生とが言えるかどうかわからんけど、何かようわからんままおんなじ空間に居てメデタシメデタシみたいなことでも浴びるように見てるんですよね。"
"山本2","01:43:59:08","01:44:09:00","子どもの頃からそういうメディアの影響が強いかなというふうに私、個人史を振り返ると思いますね。"
"D2","01:44:09:02","01:44:09:17","いい話です。"
"山本2","01:44:09:21","01:44:14:07","いやいや。"
"大津留2","01:44:14:09","01:44:21:08","私どもの広島ですね。私自身広島なんですけども、母が生まれたのが中之島にあった阪大病院。"
"山本2","01:44:21:10","01:44:23:02","で、白い橋。"
"大津留2","01:44:23:02","01:44:48:13","と、あとはなしの病院で生まれたそうなんですが、私知らないけど、なんで？の問題があるので、だから結構大阪にはお墓参りと言うんですかね、お骨麻痺というか、生きてたことが。だからわかるということではないんですけども、来てですか。"
"大津留2","01:44:48:15","01:44:54:19","そこものが来たのよというような扱いは東京ほど元気かなって。"
"山本2","01:44:54:21","01:45:21:06","ほんとそうですね。もともとあって、大大阪時代も県外からの流入だって、船場商人も近江商人が元ですから、そういう移動の中で揉まれてきた都市という意味では、確かに伝統と言っていいかもしれない部分かもしれませんね。どんな過程をとっている？"
"山本2","01:45:21:08","01:45:32:04","多分富豪とかそうでない人、ボートの音を聞こえるもの観光船か観光船。"
"大津留2","01:45:32:06","01:45:38:14","ここは乗ったことないんですけど、大河花火のときは乗ったことがある。"
"山本2","01:45:38:16","01:45:39:15","というところで見てますね。"
"大津留2","01:45:39:15","01:45:47:08","それすごかったですね。大学が一つ出すっていうことになって。"
"大津留2","01:45:47:10","01:46:22:07","座らせてもらって。でもあれは船じゃないんですね。なんというか、つながってるんですか？いえ、書きものの上に席を作ってるわけです。一緒に壊し。でもああいうので、ここやっぱり町の中に川があるっていうのは、いろんなことが楽しめる。"
"山本2","01:46:22:09","01:46:28:09","観光地の1。"
"山本2","01:46:28:11","01:46:37:00","じゃ、その民主主義の話でいうと。だから、私がさっき民主制と民主主義のところで言ったみたいに。"
"山本2","01:46:37:01","01:47:12:05","大げさだけど、文化としての民主主義っていうのがあるとしたら、やっぱりそういったコミュニケーションのところとかにも民主主義の要素っていうのが見出すことが可能なんじゃないかなって思います。で、それ私、なんでそういうことを言うかというと、敗戦後、占領下の日本の雑誌とか言論を見てると、今の私たちだったらとてもそれを民主主義と呼ばないようなこと、平等に意見を言い合いましょうとか、まあそれがあるあるかな、それはあるかもしれないけど、届いたんやろうなと。"
"山本2","01:47:12:07","01:47:34:05","間違ってたら、違うと思ったら違うと言いましょうとかね。必ずみんなに相談しましょうとかでもいいし。学校に行けるようになったってこんなこととかまでも民主主義的に捉えられるんですよね。そういう資料をよく読んでた経験があるから、やっぱり生きることと結びついた民主主義みたいなことにどうしても関心がいって。"
"山本2","01:47:34:06","01:47:52:02","で、さっき先ほど来、その制度とは別に何かあるあるんだろう。で、それは変わり続けてるんだけど、かつて日本だったらとても広いものを民主主義と呼んでいたという。そういうところが特徴の一つかもしんないですね。"
"吉田2","01:47:52:04","01:48:31:12","偉大な思想家民主主義について論じた偉大な思想家の本を読むと、やっぱり仕組みとしての民主主義の話と、やっぱり態度としての民主主義、必ず2つ議論してるわけですね。アリストテレスもそうだし、ルソーもそうだし、あるいはトクヴィルもそうだし。なので、やっぱり民主主義っていうのはシステムであり仕組みでありっていうのはもちろんそうなんですけれども、日本国憲法に定められているように、一方でそれを作り上げる力というか態度というか、そういったものがあって初めて仕組みが動くんだということをどれぐらい日本の教育で教え"
"吉田2","01:48:31:12","01:48:38:14","られてるかどうかというところはやや疑問が残るところではあります。"
"大津留2","01:48:38:16","01:49:06:06","が、よく授業なんかで使うのは、日本の民主主義がパラシュートで上から贈り物として降りてくる、自分たちで賢く勝ち取ったんじゃないのっていう、そういう授業の中では質問を学生にするんですけども、その裏側にあるのがアメリカの人たちという、やっぱり民主主義っていうのは勝ち取ったと思ってて、独立宣言という風に書くんですけども、あるいは独立戦争って呼ばないんですね。"
"大津留2","01:49:06:07","01:49:25:14","REVOLUTIONARYって革命戦争だ。そんなもんだから自分たちが決定権を革命でもって奪い取ったんだから、民主主義っていうのは自分たちのアイデンティティーとして持っていかなきゃいけないんだっていう、そういう奪い取った、勝ち取ったっていうところが日本の人はあるんですか？ってね。"
"大津留2","01:49:25:16","01:49:43:22","その負けたらね、お土産のように降ってきたっていう、その絵が正しいかどうかは別として、そういう風に描かれてしまう。それを嬉しく受け取ったっていう、そういう始まり方でいいんですか？という疑問は確かに投げかけられてるんだろうな。"
"吉田2","01:49:43:22","01:50:03:02","と思うんですよね。意地悪な見方をすると、大日本帝国憲法が日本国憲法に変わり、教育勅語が9条に変わりっていう言い方は意地悪な言い方ですけどね、見えなくはないですよね。"
"山本2","01:50:03:04","01:50:07:20","そうですよね。"
"山本2","01:50:07:22","01:50:45:08","他方で、それを勝ち取るというよりは、日本の場合はそうですね、45年から50年代、60年ぐらいまでですかね。その、そういう現状の戦後民主主義が変わっていくことに対して、何とか止めようという社会運動の流れがあって、その過程で勝ち取るとは言わないんだけど、守りとるというかね、その過程でなんとかいわゆる内にクリアしようとした涙ぐましい努力があったというのは歴史に属しますけどね。"
"山本2","01:50:45:10","01:50:50:21","それがうまくいったのかどうかというと、またそれは議論の分かれるところなんですけど。"
"吉田2","01:50:50:23","01:51:23:14","60年代、70年代にヨーロッパでもやっぱり学生運動、労働運動はおかしいところで、やっぱり戦後生まれの人たちがやっぱり20代になって大人になってそういったムーブメントを作っていくわけですけど、こう比較すると、それでも日本はやっぱり70年代で作った遺産というのがある程度ある程度残っていると思うんですけど、他のアメリカと比べても、ヨーロッパと西ヨーロッパと比べても、70年代、いわゆる団塊の世代の人たちが残したレガシーは相対的に少ないんですよ。"
"吉田2","01:51:23:16","01:51:28:05","他の欧米から見るとなぜなんですか、これ僕の長年のですが。"
"山本2","01:51:28:07","01:51:56:16","今私が思うのは、やっぱり日本が別に特殊だとまでは思わないんだけれど、70年代のオイルショック以降も安定的に経済成長できてしまったっていうところが非常に大きいっていうふうに思うんですよね。だから新自由主義への対応も遅れるし、いろんなところもありますけれど、少なくとも74年からバブル崩壊まで、さらに10何年間も安定的に成長しちゃった。"
