Speaker Name,イン点,アウト点,文字起こし,色選択
大津留,01:35:47:06,01:36:18:18,確かにそうか。 私なんか広島なので、どうしても川のその川沿いっていったら、原爆の跡の不法住宅っていうことが、もう子供の頃から不法住宅、不法住宅ってもうみんな住むとこないので作るわけですよね。 川岸だったらまだ良くて、川の中にも柱立てて作ったりして、それを全部止めるんだというのが一斉に行われて、その代わり何年頃だったかな、私が小学校の頃だったような気がするんですけどね。 私が小学校の頃かな。 60年代の微妙なところで、70年代にそれじゃどこに住むの？っていうので、高層アパートだとかを川沿いに作る。,Violet
D,01:36:18:18,01:36:19:12,昭和50年。,Violet
大津留,01:36:19:15,01:36:22:05,だったような気がするんですけど、私が考えている。,Violet
山本,01:36:22:09,01:36:29:08,しかし70年代かな、60年代。 んですが、元町アパートとかってね、いますよね。,Violet
大津留,01:36:29:10,01:36:35:07,そうです。 で、それでもう川きれいになったでしょっていう、これでも不法な住み方しなくていいんですよということなんですけども、別にきれいになるのはいいし、いい住環境に住めるのはいいんですけども、ものすごく大事な歴史の歩みっていうものが、ずっとこうブルドーザーでされて。,Violet
D,01:36:35:09,01:36:36:11,とかは川沿いにです。,Violet
山本,01:36:36:11,01:36:37:10,が、元町アパート。,Violet
大津留,01:36:37:10,01:36:58:12,とかね、そうですね。 それでもう川きれいになったでしょっていう、これでも不法な住み方しなくていいんですよということなんですけども、別にきれいになるのはいいし、いい住環境に住めるのはいいんですけども、ものすごく大事な歴史の歩みっていうものが。,Violet
山本,01:36:58:14,01:37:12:21,ずっと文字通り一掃されますもんね。 そうなんですね。 公共空間かもしれないけど、ホームレスは排除されたりとかね。 そういういろんな問題がやっぱりあるんだろうというふうに思いますね。,Violet
吉田,01:37:12:23,01:37:23:20,ますね。 学生連れて一回、1年に一回海外研修行くんですけど、去年はやっぱりスラムっていうものを見てほしくて、ちょっと昔の日本だったらね、あったんでしょうけど、フィリピンまで行って、有名なスラムがいくつかありますけど、そこ回ガイド付けないと入れないんですけど、行って人が生活するっていうのはどういう。,Violet
D,01:37:23:22,01:37:30:08,フィリピンの有名なスラム街、いくつかありますけど。,Violet
吉田,01:37:30:10,01:37:35:03,ガイド付きなんですけれども。で、人が生活するという。,Violet
D,01:37:35:03,01:37:40:00,のはどういうものか見てもらいました。,Violet
山本,01:37:40:02,01:37:44:16,探さなきゃなりますもんね。そういうと。,Violet
大津留,01:37:44:18,01:37:50:17,天王寺の公園もきれい。 してきれいですけど。,Violet
D,01:37:50:18,01:37:54:18,どこに行ったんだって思います。,Violet
山本,01:37:54:20,01:38:26:10,大阪の街もJR大阪の駅前再開発して、いろんな商業施設建ってるんですけどね。 何かやっぱりこうプチ東京っぽくなっちゃうっていうのはきれいで、確かに今風な居心地もいいなと。 確かにバリアフリー化し、床もふかふかですし、居心地はいいんやろうけど、まあまあ、でも何か東京とあまり変わらんなっていうような感じはね。 しちゃいますよね。 それはやっぱりデベロッパーさんの判断なんでしょうけど。,Violet
吉田,01:38:26:12,01:38:47:13,1言目に2重の安心安全がキーワードですか。 確かに安心と安全は大事なんだけれども、安心安全を作り上げるために、やっぱり我々を失っているものがあるんだっていう意識があるとないとでは、大分構えみたい。,Violet
D,01:38:47:15,01:39:27:21,と思います。 もちろん東京っぽくなってきてしまうのもそう。 否定的な話で、資本主義とかも関係してくるんだと思うんですけど、そうはいっても残っているものというか、運搬とか、やっぱり東京から見ると大阪と違うとは思うんですが、そこらへんは山本さんとかは残っている部分というのは、だから商人の街みたいな、今一応ブランドがあるというか、当然あるとは思うんですけれども、商人みたいなやつって何かないですか？ 北海道もそうですけど。,Violet
山本,01:39:27:23,01:39:30:23,残ってる部分ですね。,Violet
D,01:39:31:01,01:39:54:02,"山本さん、確かとその人の名前が度忘れしましたけど、1000とか1,000万とかって何か残っている部分はないですかね。 時間というか独立時間。",Violet
山本,01:39:54:04,01:41:03:04,はいはいはいはい。 まず前段階として、私なら出身で外京都で大学で今住んでいるの、兵庫で大阪住んだことないっていうのをまず前提として、前提として申し上げておくんですけど、でも大阪の文化とかっていうのは、もう関西に住んでると避けられないんですよね。 つまり在阪メディアがみんな。 強くて。 で、吉本新喜劇、子どもの頃から見ててみたいな、そういう環境なんで。 あと大大阪時代からのこう、大阪の、何て言うんですか、対東京に対する矜持みたいなものって、奈良に住んでてもそのマスメディアを通して共有されるんですよね。 何かそういう限定でお話していこうっていうふうに思いますけど。 確かにですね、大阪は権力としたたかに向き合ってきた町人精神の街だっていうふうに言われることもあって、そういう人を探そうと思えば確かに探せるんだけれど、どうでしょうね。 私が大きくなってからだったら、そういう精神性とか県民性のレベルで、府民性のレベルでそういったものが共有されてるかどうかっていうのは甚だ怪しいと思いますね。 私が大きくなってから。,Violet
大津留,01:41:03:04,01:41:05:08,だったら。,Violet
山本,01:41:05:10,01:42:30:14,在阪メディアなりタレントさんなりっていうのが、面白おかしく大阪性を持ち上げていくっていうことの方が目につくっていう気がします。 それは政治家も含めてですけどね。 うん。 で、その前提の上で、でもやっぱり大阪らしいものが残ってるって、いうふうに思うところっていうのはいくつかありますね。 それはやっぱり人間関係のコミュニケーションのあり方ですけど、これはもしかしたら京都もそうなのかもしれませんけどね。 ものすごくこう。 曖昧な形でお前、俺とお前は違うんだって言いながら、でも共存するような形の言葉って結構あるんだろうっていうふうに思うんですよね。 別にアホ一つとってもそうだっていうふうに思うんですけど。 バカにしたり茶化したりしながら、同じ場所で共存していく、そういう機運っていうのは、大阪の文化とまで言っていいかわからないけど、そういうところは至るところで感じますね。 そうそうそうそうそうそう。 いじるって感じですね。 変な人。 SDGSっていうのが。,Violet
吉田,01:42:30:16,01:42:33:11,出ていることがなんで共生につながるんですか？その場合。,Violet
山本,01:42:33:13,01:43:30:16,例えばめっちゃ怖い人とか、めっちゃ困った人とか、変わってもいっつもかき乱す人とか、あれもああいうやつやからしゃあないわっていう形で排除せずに、もしかしたら心理的には排除してるのかもしれないけど、むしろいじって笑ってもう流してしまう。 そういう困った人の扱い方の懐の深さみたいなことは、確かに東京とかよりは感じやすいかなって思ったりするな。 場所とか空間というよりは、こう、コミュニケーションのあり方に僕は感じることが多いかなって思いますね。 それを強引に繋げると、やっぱり承認の合理性っていうことにも繋がるのかもしれませんけどね。 それはもうお客さんになるかもしれへんけど、排除するようなことは絶対しませんからね。 うん。 ちょっとやや強引かもしれませんけど、そういうコミュニケーションのあり方に感じることが多いかな。 うんうん。 うん、そう思いますね。 サブカルチャーの話になるけど、そういうのって関西の子供たち、テレビの吉本新喜劇とかで教育されてるんですよね。 ヤクザも出てくるし、身体的特徴が著しい人もたくさん出てくるけど、みんな一緒に何か笑ってこけて、何かよくわからんまま共生とが言えるかどうかはわからんけど、何かようわからんままおんなじ空間に居てメデタシメデタシみたいなことっても浴びるように見てるんですよね。,Violet
大津留,01:43:30:18,01:43:31:22,こう言い切ってしまわないって。,Violet
山本,01:43:31:22,01:44:09:00,子供の頃からそういうメディアの影響が強いかなっていうふうに、私、個人史を振り返ると思いますね。 いい話です。 今でも場所の話になるんですね。 うん。 白い京都のとこですね。,Violet
D,01:44:09:02,01:44:09:17,いい話です。,Violet
山本,01:44:09:21,01:44:14:07,いやいや。,Violet
大津留,01:44:14:09,01:44:21:08,私どもの広島ですって。 私自身、広島なんですけども、母が生まれたのが中之島にあった阪大病院で、もうあとはなすなき阪大病院で生まれたそうなんです。 知らないけど、なんで祖父の問題が一心寺にあるので、だから結構大阪にはお墓参りと言うんですかね、あれお骨にというか、来てたことがあって、だからわかるということではないんですけども、来てんですかね。,Violet
山本,01:44:21:10,01:44:23:02,で、白い橋。,Violet
大津留,01:44:23:02,01:44:54:19,外者が来たのよというような扱いは、東京ほどウケがいいかなっていう。,Violet
山本,01:44:54:21,01:45:32:04,ほんとそうですね。 もともとあって、大大阪時代も県外からの流入だって、船場商人も近江商人が元ですから、そういう移動の中で揉まれてきた都市っていう意味では、確かに伝統と言っていいかもしれない部分かもしれませんね。 何か手を振っている。 多分神戸が通ったよね。 ボートの音が聞こえるもんね。 観光船から。 乗ったことがないとこで見てますね。 それ。,Violet
大津留,01:45:32:06,01:45:38:14,ここは乗ったことないんですけど、大河花火のときは乗ったことがあって。 すごかったです。 大学がひとつ出すということになって、それの。 座らせてもらって。 でもあれ船じゃないんですね。 なんというか、下つながってるんです。,Violet
山本,01:45:38:16,01:45:39:15,というところで見てますね。,Violet
大津留,01:45:39:15,01:46:22:07,そんなこう、平らなものの上に石を作ってる。 でもああいうので、ここをやっぱり町の中に川があるっていうのは、すごくいろんなことが楽しめる。,Violet
山本,01:46:22:09,01:47:52:02,の。 こっちの発信できたの。 が、その民主主義の話でいうと。 だから私がさっき民主制と民主主義のところで言ったみたいに。 大げさだけど、文化としての民主主義っていうのがあるとしたら、やっぱりそういったコミュニケーションのところとかにも民主主義の要素っていうのが見出だすこと可能なんじゃないかなって思います。 で、それ私、なんでそういうこと言うかっていうと、敗戦後、占領下の日本の雑誌とか言論を見てるとね、今の私たちだったらとてもそれを民主主義と呼ばないようなこと、平等に点を言い合いましょうとか、まあそれはまあそうか、あるあるかな。 それはあるかもしれへんけど、どう言ったらいいだろうな。 そうですね、間違ってたら違うと思ったら違うと言いましょうとかね。 うん、必ずみんなに相談しましょうとかでもいいし、学校に行けるようになったってこととかまでも民主主義的に捉えられるんですよね。 そういう資料をよく読んでたって経験があるから、やっぱりその生きることと結びついた民主主義みたいなことにどうしても関心がいって。 で、さっき先ほど来、うん、その制度とは別に何かあるんだろうと。 それは変わり続けてるんだけど、かつて日本だったらとても広いものを民主主義と呼んでいたという。 そういうところが特徴の一つかもしんないですね。,Violet
吉田,01:47:52:04,01:48:38:14,この頃ですからね。 偉大な思想家民主主義について論じた偉大な思想家の本を読むと、仕組みとしての民主主義の話と、やっぱり態度としての民主主義、必ず2つ議論をしてるわけですね。 アリストテレスもそうだし、ルソーもそうだし、あるいはトクヴィルもそうだし。 なので、やっぱり民主主義っていうのはシステムであり仕組みでありっていうのはもちろんそうなんですけれども、日本国憲法に定められているように、一方でそれをやっぱり作り上げる徳というか態度というかね、そういったものがあって初めて仕組みが動くんだということ をどれぐらい日本の教育で教えられてるかどうかっていうところは、やや疑問が残るところではあります。 られてるかどうかというところはやや疑問が残るところではあります。,Violet
大津留,01:48:38:16,01:49:43:22,よく授業なんかで使うのは、日本の民主主義がパラシュートで上から贈り物として降りてくると、自分たちで勝ち取ったんじゃないのっていう、そういう授業の中では質問を学生にするんですけども、その裏側にあるのが、アメリカの人たちってやっぱり民主主義っていうのは勝ち取ったと思ってて、独立宣言という風に書くんですけども、独立戦争って呼ばないんですね。 REVOLUTIONARYWARって革命戦争だもんさまの手から自分たちが決定権を革命でもって奪い取ったんだ。 だから民主主義っていうのは自分たちのアイデンティティーとしてこう持っていかなきゃいけないんだっていう、そういう奪い取った、勝ち取ったっていうところが日本の人あるんですか？って。 けどね、その負けたらね、お土産のように降ってきたっていう、その絵が正しいかどうかは別として、そういう風に描かれてしまう。 それを嬉しく受け取ったっていう、そういう始まり方でいいんですか？という疑問は確かに投げかけられてるんだろうなと。,Violet
吉田,01:49:43:22,01:50:03:02,そういう始まり。 は意地悪な見方をすると、大日本帝国憲法が日本国憲法に変わり、教育勅語が9条に変わりっていう言い方は、やはり意地悪な言い方ですけどね、見えなくはないですよね。,Violet
山本,01:50:03:04,01:50:50:21,ですよね。 他方で、それを勝ちとるというよりは、日本の場合はそうですね、45年から50年代、60年ぐらいまでですかね、その現状の戦後民主主義が変わっていくことに対して、なんとか止めようという社会運動の流れがあって、その過程で勝ち取るとは言わないんだけど、守りとるというかね、その過程でなんとかこう、いわゆる内に行くかしようとした涙ぐましい努力が。 たというのはも歴史に属しますけどね。 それがうまくいったのかどうかっていうと、またそれは議論の分かれるところなんですけど。,Violet
吉田,01:50:50:23,01:51:28:05,60年代、70年代にヨーロッパでもやっぱり学生運動、労働運動、華やか若い頃で、やっぱり戦後生まれの人たちがやっぱり20代になって大人になってそういったムーブメントを作っていくわけですけど、こう比較すると、それでも日本をやっぱり70年代で作った遺産というのはある程度ある程度残っているとは思うんですけど、他のやっぱりアメリカと比べても、ヨーロッパと西ヨーロッパと比べても、やっぱりその70年代、いわゆる団塊の世代の人達ですね、残したレガシーは相対的に少ないように見えるんですよ。 やっぱり他の欧米から見ると。 それはなぜなんですかね。 これ僕の長年の熱は疑問。 他の欧米から見るとなぜなんですか、これ僕の長年のですが。,Violet
山本,01:51:28:07,01:52:49:09,私が思うのは、やっぱり日本が別に特殊だとまでは思わないんだけれど、その70年代のオイルショック以降も安定的に経済成長できてしまったっていうところが非常に大きいっていうふうに思うんですよね。 だから新自由主義への対応も遅れるし、いろんなところもありますけども、少なくとも74年からバブル崩壊まで、さらに10何年間も安定的に成長しちゃった。 ジャパンアズナンバーワンって本気で思えた。 それってやっぱり団塊の世代の人たちが就職してからのことなんですよね。 しっかり企業社会に入って、うん、別に今までの感性でええやんと、日本のやり方でええやんというところがあって、その辺のズレ、当時の日本にとってはまだ成長できるっていうんでよかったのかもしれないけど、その辺が現代への向き合い方の、もしかしたら遅れとかズレにつながってる可能性ってあるかもわからんなと思って思ってるところですね。 だから成長の中でしか安定できひんって思える期間が長かった。 むちゃくちゃ55年からね、1955年から90年までってなったらね。 それがちょうど自民党にも重なるけどってなると、うん。,Violet
吉田,01:52:49:09,01:53:20:21,なるほどなるほど。 符合的ですね。 例えばヨーロッパでいわゆる右派ポピュリスト政党が出てきて勢いを増したのって、やっぱりリーマンショックの後なんですね。 ユーロ危機の後なんですよね。 それでで言うと、日本は相対的にまだリーマンショックのダメージって少なかったので、やっぱりワンテンポ遅れて右派ポピュリスト政党なものが今出てきているっていう、ちょっとこう、やはり欧米から10年ぐらいちょっとずれるっていうところがね、一つパターンとして言えるかもしれないですね。,Violet
大津留,01:53:20:23,01:53:30:08,のパターンとしてちょっとずれて、どうして誰かがクッションになって、そのズレを生じさせてたのか、何らかの仕組みがそれを、これもちろん。,Violet
吉田,01:53:30:10,01:54:15:10,は、これも持論なんですけど、やっぱり日本って相対的にグローバル化の程度が低いと思うんですよ。 経済的グローバリズムにおいても、例えば株式でどれくらい外国人が株式を持っているかっていうシェアを見ると、やっぱり実務の中で低いわけですよ。 それから、移民の問題も当然そうですけれども、他のヨーロッパで言うと10%ぐらい、だいたい移民あるいは移民系と呼ばれている人達ですけど、10%、15%が当たり前になってるわけですね。 日本まで3%ですよね。 だから、そういった意味では、やっぱりグローバル化の波の中で相対的に出遅れっていうのは。 で、それは明治の時からそうですよねって話だとは思うんですけど、そういう世界史的な日本の地位っていうのがやっぱりそうさせてるんじゃ。,Violet
山本,01:54:15:12,01:54:24:18,ちょっと遅れるっていうところですよね。 だからそうそう、近代化も追いつけ追い越せやけど、ちょっと沈んでいくのも追いつけ。 ところもあるのかもしれません。 ほんとそうですけど。 あった。,Violet
大津留,01:54:24:22,01:54:31:17,でも、遅れたからこそ、周りを見ててっていう風に、前もってね、何かできる余裕があっ。 の2。,Violet
吉田,01:54:31:19,01:54:57:22,んです。 そうなんですよ。 だから西遅れのトップランナーみたいなね、地位にあるのは確かなんですよ。 なので、やっぱりそれは我々の代わりに何かグローバル化の実験をしてくれてる国があるので、そこからいかに学べるかっていうところは、その立ち位置はやっぱり戦後になっても日本と変わらないのかなという印象は持ちます。,Violet
山本,01:54:58:00,01:55:07:15,変わらない気がするな。 先に失敗してくださってるんだったら、それを活かしてということになかなかなりにくいというところはあるね。,Violet
大津留,01:55:07:21,01:55:20:08,何か逆にちょっと日本違うからそうはならないって思ってるとことかあるんですかね。 そうそう、他の国は失敗してるけど、でも日本はちょっと違うから大丈夫じゃないかみたいな、こう日本特異論みたいな。 言い出した。 でも何か対岸の火事を見てれば。,Violet
吉田,01:55:20:10,01:55:32:12,ごめんなさい。 そういう反応も一般的にはありますかね。 あれはやっぱり海の向こうの話だみたいな感じで、やっぱり対岸の火事っていう風に見なしちゃうっていうことはあって、そうなるともっと深刻なのは、でもそれこそ150年前からやっぱり脱亜入欧で、モデルがやっぱりあったわけですよね。,Violet
大津留,01:55:32:13,01:55:36:00,何か対岸の火事を見て。,Violet
吉田,01:55:36:02,01:56:22:16,それはもう多分にHR召されたモデルなんだけれども、一応モデルというのがあって、それに日本はアダプトしようっていう風に向かってきたんですけど、今逆に失敗出てるんですよね。 モデルになっちゃって。 そうすると日本っていうのはどういう風にある種方向性みたいな、あるいは体系性みたいなものを獲得したらいいんだろうかっていうことを考えなきゃいけないようになったのが、やっぱり21世紀になってなのかなという気がしますね。 そういった意味で、ものすごくこの国の立ち位置みたいなものが変わる可能性は出てくる。 正解がないということで。 そうですよね。,Violet
大津留,01:56:22:18,01:56:34:12,今、教育も何かもうあるものを学ぶんじゃなくて、自分で考えられるような教育言われますね。 私うで、それも関係しているんですかね。 何かこう自分たちの中から出していかないと、もう真似する外のモデルではないんだよっていう。,Violet
吉田,01:56:34:12,01:56:35:08,世界がなっ。,Violet
大津留,01:56:35:08,01:56:41:04,ていかないと、もう真似する外のモデルがない。,Violet
