Speaker Name,イン点,アウト点,文字起こし,色選択
大津留,00:23:19:12,00:23:22:23,ているツールだと思うんですけど、でも私が何かっていうのをどういうふうにして、先生の。,Violet
吉田,00:23:23:01,00:23:32:13,それはもう過去のデータで何を聞いて、どういう風に聞くか、何なのとか、何でしょうかって聞くのでも、答え方も変わってくるので。 そうなんです。 すごい忖度するツールで、その先生相手で出てきました結果が、それを疑いなさい、ダブルチェックしなさいって言うですけど、でもそもそも先生って何かを効率化させようとするためのツールなので、効率化させるツールをさらに非効率の手段でもってチェックするって、人間の何かだろう。,Violet
山本,00:23:32:16,00:23:33:20,ので、最適化されるのです。,Violet
吉田,00:23:33:21,00:24:05:15,そもそも趣旨に合わないんですよね、やり方に。 そこにそもそも構造的な矛盾みたいなものがAIってあるんじゃないかと思います。,Violet
山本,00:24:05:17,00:25:11:17,その先生の問題と、先ほどのSNSの問題と合わせてね、その思うんですけど、やっぱりその、あのね、緊張をそのままSNSの場合と、その背景に人間がいるとかの場合は、人間ませんけど、その対話とか出てくる言葉との間の緊張感みたいなのがあまりにもなさすぎちゃうんですね。 私が使ってて思うんですけど、もうそうかそうかって、もう情報としてパーンと受け止めて、すぐ使えるようになる。 最適化って今、吉田さんがおっしゃった通りなんですけど。 だからその、これAIに教えてもらったことを言うとどうなるかとか、あるいはこのSNSのつぶやきの背景にどういう人がいるかとかってことをあんまり考えずに言論とか表現できちゃうっていうね。 だからその他人がいるってことを感じにくくさせてしまう。 結果的にそういう情報環境に結果的になっちゃってるんですよね。 さっきさっき。 こうやって指示が来るに。 小寺さんがAIっぽい。 の、さっきそうそう吉田さんがおっしゃってくれたあの問題ね。,Violet
吉田,00:25:11:18,00:25:14:21,そう。,Violet
山本,00:25:14:23,00:26:01:07,ここで皆さんが。 だから一人の人が株の仲買人なんでしょうが、私財を投じてドーンと作るっていうね。 何て言うんですか、大阪の分厚い町人文化とか商人文化って言われがちですけど、確かに今の今の経営者が何かあるって言ったら、それは何？ だから一人の人が株の仲買人なんでしょうか、私財を投じてドーンと作るっていう。 ドームに企業の名前を入れるとか、あと自分の名前を入れたホールを作るとか、そういうことをするけど、こういうほぼ公共に見える何かを作るって確かに珍しいかもしれませんね。,Violet
吉田,00:26:01:09,00:26:42:06,こういう1910年代でしたっけ、作り始めたのが。 作り上がったのがやっぱり日本の産業革命が本格的に始まって、岩本ってね、渋沢栄一のとも知り合いだったらしいんですけど、日本の資本主義が、産業革命が始まって、その時にやっぱり富の偏重ってすごいわけじゃないですか。 で、その一部の資本家にドーンとお金が集まったので、こういうこともできると思うんですけど。 だから経営者が小粒になったとか、稼げなくなったって言いますけど、それはもうそれこそ民主化の結果なんじゃないかと思うんですよね。 富が平等に配分されてきたので、どうしてもモノがちっちゃくなっちゃうってしょうがないかなと。 富が平等に配分されてきたので、物がちっちゃくなっちゃうと。,Violet
大津留,00:26:42:07,00:26:52:10,でもそんな集中した時に、その集中を自分のところだけにせずに社会に返していこうっていう、そういう考え方が日本の中でどういうふうに発展してきたんですかね。,Violet
山本,00:26:52:12,00:26:58:04,この岩本の場合は、アメリカへ行った時に、アメリカの資本家たちがこういうことをしてるっていうので。 確かにそうですよね。 暗いところで紙幣に火をつけてみるっていう風刺がよくありましたけれど、あの時期の金持ちがね、確かにあまりに隔たりすぎてるから何か返す。,Violet
吉田,00:26:58:04,00:27:01:02,寄付文化を教えて。,Violet
山本,00:27:01:04,00:27:22:23,で、しかも自分の名声もアップするということで、そういう方法をアメリカから学んできたんじゃないかと思いますけどね。,Violet
大津留,00:27:23:01,00:27:36:04,その割には財団は少なかったですよね。 最近いくつか出てきましたけども、アメリカの場合、税制度のせいだと思うんですけども、持ってると税金取られるんだったら財団にして、それで自分の自分の名前もEMをそこでみんなのためにってお金をっていう、それが今日までやったという。,Violet
山本,00:27:36:06,00:27:36:16,確かに財団で。,Violet
大津留,00:27:36:16,00:27:44:19,は、自分の名前もをみんなのためにお金をっていう、それが今日まで自由。,Violet
山本,00:27:44:20,00:27:51:16,というと。 だから70年代のサントリーさんとかまでさかのぼるというか、こっちまで来ますね。 文化事業にお金回しましたもんね。,Violet
吉田,00:27:51:18,00:27:55:05,80年代、90。 やっぱセゾンですよね。 やっぱね。 もう日本はやっぱり寄付文化はないですね。 こういう比較してみるとあれですけど、やっぱ寄付したことありますか？どれくらい頻度やりますかっていうと、先進国でも最低っていうふうに出るので。,Violet
山本,00:27:55:06,00:27:58:20,文化事業にお金を回しましたね。,Violet
吉田,00:27:58:22,00:28:11:00,しないしない。,Violet
山本,00:28:11:02,00:28:24:18,いろんなところで寄付を募ってるけど、寄付をしてくださいって言われてするのは嫌なんですよね。 うん。 しかしその、しかしそのほっといたらするのかっていうとしないし、これが厄介なところでね。,Violet
大津留,00:28:24:20,00:28:45:00,やっぱり私の同僚で、その寄付のこととかを勉強してる人がいるんですけど、どうして？っていうね、なんでアメリカは、特にアメリカはどうして？って言って、まず教会行くでしょう。 教会へ行ったら回ってくるお皿がお金を入れざるを得ないしっていうね、何かそういう当たり前化している部分っていうのがあるのかなって。,Violet
山本,00:28:45:02,00:28:46:12,日常のところから何。,Violet
大津留,00:28:46:14,00:28:51:05,活かしている部分というのがあるのか。,Violet
山本,00:28:51:07,00:29:01:23,身銭を切るみたいな感覚っていうのは、もしかしたら日本とは違う育ち方をしてるかもしれないですね。,Violet
吉田,00:29:02:01,00:29:54:15,ブラッドっていう面白い映画があるんですよ。 で、アメリカの建国してきたかみたいな。 基本的に話なんですけど、基本的に石油と宗教だって話なんですよね。 それがアメリカを作ったっていうのが映画自体のメッセージなんですけど、それで言うとその寄付でいうとすごくよくできてる仕組みだなと思うんですけど。 つまりアメリカは最初、階級がないところから始まったわけですよね、ヨーロッパと違って。 でそこでどうやってやっぱりある種の卓越さというものを社会の中で見せたらいいかっていうと、お金になるんですよね。 お金を自分のためじゃなくて、他人のために使う。 この公のために使うっていうのは、何かそういう人間として優れているっていうので、他人と差をつけて資本主義が回るっていう、すごくなんかうまくできた仕組みだなっていうふうには思ったりもしますね。,Violet
山本,00:29:54:17,00:30:10:02,たりもします。 確かに卓越化する必要ないような名望家とか篤志家がいっぱいいたら、別にね、寄付しなくてももう常に卓越してるってことになるのかもしれません。 階級社会とか封建制の話かもしれませんけども。,Violet
吉田,00:30:10:04,00:30:17:15,ずっと人間は何かにつけて他人と差をつけないと気が済まないってことなんでしょうね。 だから完成する前に死んじゃったんですよね。 確かね。 また面白い人生だと思います。,Violet
山本,00:30:17:17,00:30:23:21,そうそうそう、岩本さん公会堂を作った山本さん、最後自ら命を絶ってるんですよね。 大失敗し。,Violet
吉田,00:30:23:23,00:30:30:21,大失敗して完成する前に死んじゃったんですよね。 確かにね、また面白いなと思いますけど。,Violet
山本,00:30:30:21,00:30:58:18,だと思いますけどそこで命を絶つところが、いや、本人はものすごくつらかったやろうけど、ちょっと弱さも感じざるを得ないかな。 方にもつながったです。 指令書という。,Violet
吉田,00:30:58:19,00:31:10:19,本人。 の専門。 の自分の専門をなぜ選んだか。なぜそんなにするのかと。,Violet
D,00:31:10:21,00:32:00:05,答えが出ないのでこんな感じ。 元どおり。 本当に惨めだから。 それこそAIの話からいろいろうかがいまして。 場所の話も済みません。 拾っていただいてありがとうございます。 皆さん、今回難民をするにあたって、やっぱりヨーロッパのアメリカと日本かなという感じで、日本の専門家、うまく悩みそうなという狙いはもちろんあります。 それぞれ何で選んだのかみたいな、ちょっと振り返りつつ。 行けるようなお話を聞いてみたいなと思っていまして。,Violet
大津留,00:32:00:07,00:33:22:12,どなたからじゃ単純な私から。 趣旨広島なんですよ。 そうすると広島だと小さい時から毎年何があるかというと、原爆記念日があって、で、何があったのというのはずっと聞かされてきて。 だからそういうふうに言うと、アメリカ嫌いだったんですねって言われるんですけど、そうではなくて、母がちょっと仕事をしてるところがアメリカのお金が入ってるところだったので、職場に遊びに行くとハンカチいらないんですよね。 ペーパータオルなるものがあって、何これっていう、そういう文化的なショック。 全然違う世界がここに存在していて、それがアメリカという国で。 で、そういうその素晴らしさを持ってるアメリカと、原爆を投下したアメリカと、その両サイドをずっとこう経験しながら、じゃあ大学は何にするのって言ったら、ちょっと英語を好きだったので、英語が使えるとこへ行きたいなと思っていたところで、最初の授業がその直前までワシントン特派員をやっていたんだけども、新聞社を辞めた先生がやったアメリカの政治と 外交という授業で、もうバット入りましたね。 もうそれからずっとです。 なので、すごく単純で。 もう割と入りましたね。,Violet
吉田,00:33:22:14,00:33:23:20,なるほど、皆すごく感じ。具体的にですね。,Violet
山本,00:33:23:22,00:33:38:19,日本人ということなんですよ。 先生の授業って大事なのはやっぱり。 最初にを責任重大っていう感じがしましたけど。,Violet
吉田,00:33:38:21,00:35:01:06,僕の専門がそもそも何だろうって今悩んじゃったりもするんですけど、こういうのは多分事後的に何かつじつま合わせてこうだったよなって自己了解するしかないと思うんですけど。 多分政治学っていう看板かけてますけど、高校の時にうちの父親がジャーナリストだいうのもあって、家にたくさんこう今少なくなっちゃった。 月刊誌とかね、週刊誌とか山のように読んでいる。 そういうのに入らないのを僕の家が読んできて、こう渡すよ。 こういう分からない中に読んでいると、なんでみんなこんなに一文も得意にならないことに、こんな侃々諤々論争してるんだろうっていうふうに思うわけですよ。 高校生になると、空理空論をみんなかざして、それがついぞたぶん分かってないってことだと思うです。 つまり、政治家とか政治家だってね、別にもっと楽な生き方って多分あると思うんですけど、あえて政治家になってく、人並みに国のために、地域のために尽くそうっていう、その人間が持っている志向性っていうのが何なんだろうって。 今だこうしっくりくるね、こう、説明って自分でもできないんですけど、それが多分関心の元にはあるんじゃないかなというふうに思うんですけどね。 は難しそうな、何に触れるかって大きい活字。,Violet
山本,00:35:01:08,00:35:06:06,塩谷家の家庭、家庭の環境っていうか、本、月刊誌、特に月刊誌。 にね、分厚い月刊誌がいっぱいありましたもんね。 昔。,Violet
吉田,00:35:06:07,00:35:09:01,こうまだね、正論とか諸君とかね、月刊現代とかね、今はなくなっちゃったのがたくさんありますけど、自然に触れられて。 そうですね。 教科書の代わりにそういうのを読んでたみたいな。 高校生だったので。 大学入って政治学という学問があるんだっていうのを発見するんですよね。,Violet
山本,00:35:09:03,00:35:11:06,月刊月刊現代ありましたね。ありますけど。,Violet
吉田,00:35:11:06,00:35:15:10,昔は世論とか色とか結果であったりとかね。,Violet
D,00:35:15:10,00:35:17:03,今は結果論がありますね。,Violet
吉田,00:35:17:03,00:35:18:16,たくさんありますけど。,Violet
大津留,00:35:18:18,00:35:21:08,すごく自然に触れられてた。,Violet
吉田,00:35:21:10,00:35:46:19,僕は学部は文学部最初入ったんですけど、転部して法学部政治学科っていう展望するんですけど。,Violet
大津留,00:35:46:21,00:35:49:11,文学部入られた時は何かこう、こんなことっていうのがあったんですか？,Violet
吉田,00:35:49:11,00:36:29:06,僕、帰国子女だったので、小学校、中学校がヨーロッパで暮らしてたんですね。 フランス語学校にずっと行ってたので、フランス語ができたんですよ。 だから政治学の中でもフランス政治ってやってますけど、それは単に僕がフランス語たまたまできるっていうんだけどね。 何の自慢にもならないんですけどね。 なんとなくフランス文学やろうかなっていうね。 そんななんとなく日本だとぎりぎりフランス文学者ってかっこいいよねっていう、こうなんとなくこうイメージがあったので、それで文学部だったんですけど。 で、フランス文学やろうかなっていうか、日本とぎりぎりフランス文学者っていうイメージがあったので、それで文学部だったんですけどね。,Violet
山本,00:36:29:08,00:36:46:20,いや、そうですよね。 僕の順番になると思うんですけど、今のお二人のお話と重なる部分が随分とあって、僕、もともと大江健三郎さんで卒論書いたんですが、大江さんに強い憧れがあって、文学者がカッコ良かった時代っていうのがやっぱりいつまでも格好いいと思いますけど、あるんだろうっていう風に思うし、そうすると、小説家に戻るとなるとうん。,Violet
吉田,00:36:46:21,00:36:48:04,風に思うし。作家を志して。 それいいですね。,Violet
山本,00:36:48:04,00:36:50:13,で、後年になって田中角栄も子供の頃作家を目指したって聞いて、やっぱり何かある時期までの男の子、女の子って小説家に強い憧れがあったんだろうと思っ。,Violet
吉田,00:36:50:15,00:36:51:21,いいですね。,Violet
山本,00:36:51:23,00:37:01:15,けど。 そうですよね。 何か独立してる感じもあるし、自分の腕でやっていける感じもあって、憧れますよね。 で、大江さん読むようになって、大江さんで卒論書いて、その後、大江さんのその、それこそヒロシマノートに代表される核の話とか、あと戦後民主主義の話っていうのを読むようにも当然自然となっていって、こう気づくんですね。,Violet
大津留,00:37:01:17,00:37:04:02,も、うちの息子もならなかったんですけど、小説家になるとか、何。,Violet
山本,00:37:04:02,00:38:08:15,俺90年代ぐらいですけど、大江さんえらい悪く言われてるなと、えらい叩かれてるやんかというふうに思って、これ一体何やろうかというふうに思って、戦後日本の民主主義とか、あと知識人とか言論とかっていうのに関心持って今に至るっていう感じですよね。 公共の場、至る所にあると私は思ってますけどね。 何か音楽が始まった。 かな。 あるいはいきなり。 ゲリラ的に始まったのかもしれない。 結婚式じゃなくて。 そうそう、これが公共の場。 まさにそう。 違うところで歌う人も居るし。 そうそうそう、結婚式してるし。,Violet
吉田,00:38:08:21,00:38:10:02,結婚式。 行っても月曜どころ。 これが公共の場ですよね。,Violet
山本,00:38:10:04,00:38:13:11,ゲリラ的に始まったのかもしれない。,Violet
吉田,00:38:13:13,00:38:15:18,そう。,Violet
山本,00:38:15:20,00:38:25:23,そうやね。街宣車もみたいなこと。,Violet
吉田,00:38:26:00,00:38:30:07,9条を守れっていう街宣車も通るし。,Violet
山本,00:38:30:09,00:38:42:11,で。 かな。おめでとう言うてもね、結構。,Violet
吉田,00:38:42:12,00:38:46:03,結婚だ。 結婚おめでとう。,Violet
山本,00:38:46:05,00:39:00:00,コード拾っちゃうのかな。 拾ってるのかね？今軽く拾ってる。 します。 生まれてこの苦しい世の中に生まれてきて。,Violet
吉田,00:39:00:02,00:39:09:13,いつも思うんですけども、反出生主義とかいう言葉が出てる時に、いつもで結婚おめでとうってみんな言うんだろうかと思うんですよね。 何がめでたいになって、僕は苦しいです。,Violet
山本,00:39:09:15,00:39:16:18,生まれたくないと子供は思っているかもしれないぞという。,Violet
吉田,00:39:16:19,00:39:27:15,基本生殖をするから愛でたんでしょう。 人類社会が発展するからめでたいってわけですよね。 それをやんなくなったら何を見たいんだろうっていつも不思議に思って嫌がられるんですけど。,Violet
山本,00:39:27:17,00:39:29:07,だからそれは。,Violet
大津留,00:39:29:09,00:39:33:23,でもゲイのカップルだったら、その周りのいろんな嫌がらせを乗り越えて結婚。 自分たちの価値を守れたことがめでたい。,Violet
山本,00:39:33:23,00:39:36:08,結婚したって。,Violet
大津留,00:39:36:10,00:39:40:23,話だからね。個人でいいじゃないって言ったら、それもめでたくなくなってしまう。,Violet
吉田,00:39:41:00,00:39:43:18,社会的単位として認められたっていう社会的承認を得たのがめでたい。,Violet
大津留,00:39:43:19,00:39:45:00,という社会。,Violet
吉田,00:39:45:00,00:39:45:21,すいません、ちょっと横にそれ。,Violet
大津留,00:39:45:21,00:39:54:06,た。個人でいいじゃないって言ったら、それはもうメタメタとかなくなってしまう。,Violet
吉田,00:39:54:07,00:40:01:12,新しかったのでというと。,Violet
山本,00:40:04:12,00:40:08:12,ペーパータオルの話、面白かったですね。確かに無駄じゃない。,Violet
吉田,00:40:08:14,00:40:11:02,新しかったということです。,Violet
大津留,00:40:11:04,00:43:10:12,44どうして繋がるのかっていうところ。 難しいですね。 私は個人的に被爆者運動をやったわけではなくて、むしろそういう意味では、昨年亡くなった西崎さんは本当に通訳として現場で被害者の。 私は何かあると、広島の出身なのよぐらいで、だからみんなも原爆、このことをやっぱり知っておいてほしいなっていう、そんなくらいしか出さなかったので、そういう意味では積極的には繋がっなかったんですけども、でも私の研究そのものの中には、なぜそんな進んだ米であるはずなのに、その人の命を戦争によって人とも思わずに落とすことができたんだろうかっていう、そういうこう逆に落差ですね。 つなぐというよりもちぎれてる部分はなぜなんだうかっていうのは今でも。 怖い思いをしたというのはなぜかというと、非合法滞在者の調査に行くので、そんなこと言ったら絶対にどっか連れて行かれるので、お友達に会いに行きますって言って、この歳だったお友達に会いに来ますって言っても通るんですね。 なので、それで嘘を言ってこんなのこんなの流れたら今度から行けなくなりますけども。 なんですけども、やっぱりこう、移民の国で、みんな元はどこかから逃れてやってきたはずなのに、なのにお前はダメ、お前はいいっていう風に、特にトランプになってから非常にこう暴力的に国から追い出そうとしている。 なので、それで嘘を言ってこんなのなるなくなる。 それに、やっぱりおかしいよと言っている市民の人達もいて、その両方がいいとか悪いとかじゃない。 言うんじゃなくて、どうやったらそこで対話が始まるのかなっていうのが調査をしながら聞き出そうとするとこなんですけども。 だいたい非合法移民追い出せって言った男は、なかなかアジアの女が一人で行くのは怖いところなので、大抵なんとか守ろうよっていうところにお話を聞きに行くと、だんだん自分の軸足っていうのはそっちにシフトするので、真ん中がいるんです。 大切だよね。 対話の場がいるようで、ちょっとずつ何て言うのかな、政治的な入会地って言うか、誰のものでもないから、みんなそこに入って酷いこと言いながら塾に近い。 何ですかね、そんなそんな場があればいいなと思うんですけど、今なかなかもう政治分断していて、片方の話は聞けるけど、もう片方はかなり確保していかないといけないっていう状態が続いてますね。 なので、あんまりつなごうと思っても繋げてないっていうのが現状かなと思います。,Violet
山本,00:43:10:14,00:43:52:14,でも今徹さんがおっしゃられたことでね、その何年も調査はてるけど、身の危険を感じるのは今回が初めてだっておっしゃられたのがすごい印象に残ってて、何かこの公共の場所が何かこうバトルの場所というか、あるいは下手したら身体的な危害を与えられてしまう場所になってしまう。 それはもちろん国や地域、いろんなバリエーションがあるんだろうけど、そういう公共の場所って怖いとこなんやっていう風に思いやすくなるような事例っていうのが、何か目立つと言えば目立つかなという気はしてますよね。 日本でもそうだというふうに思い。 それはもちろん国や地域、いろんなバリエーションがあるんだろうけど、そういう公共の場所って怖いところがあって。 思いやすくなるような事例っていうのは、何か目立つといえば目立つかなという気はしていますよね。,Violet
