Speaker Name,イン点,アウト点,文字起こし,色選択
D,00:00:01:01,00:01:50:17,では。 生活をやってみたい。 方なので。 古着も。 ほどでもない。 が見つけます。 していただければと思います。 ということで。 大阪での収録ができましたが、ポケットに日本語の番組なので。 大阪の風にならない。 ここでお互いを呼び合う時に。 住んでいなければ。,Violet
大津留,00:01:50:18,00:02:58:22,カッコキタはです。 過去、北川はいいです。 あるよと自分の方で気を遣ったりする。 韓国人でそこまで。,Violet
吉田,00:02:59:00,00:03:18:06,いいもそっちの早朝ですよ。 なるほど。,Violet
D,00:03:18:07,00:03:24:17,適当ですよ。,Violet
山本,00:03:24:19,00:03:26:13,できて。 いただいて。 マイクテストも兼ねて。 席順はこれでいいですか？はいはい。 じゃあ方向性は開いちゃうけど。 教わった方に。,Violet
吉田,00:03:26:15,00:03:29:12,はい。聞こえてますでしょうか。,Violet
山本,00:03:29:14,00:03:44:05,汗の。 拾ってる。 出している。,Violet
D,00:03:44:07,00:03:48:23,から準備ができたら認定なのに任せている。,Violet
山本,00:03:49:04,00:03:51:20,拾ってるからの話を出し合って。,Violet
大津留,00:03:52:02,00:03:53:16,これは別にまた拾っ。,Violet
D,00:03:53:19,00:05:14:10,話はそれでもマイクでこちらで収録しています。 なので、僕と皆さんの話を聴いているだけで、タイムキープくらいしか本当にこの番組ディレクターが割り込む場所はないですが、ざっくり。 事前にお送りしたメールの要点とかで流れて流れをご案内していると思いますけど、なんとなく時事ネタというかはじめましてもありますので、ちょっと雑談があればそこからスタートしてもらって、大阪みたいなことから始めればそれでいいかなとなっていますが。 なので、収録準備ができても問題なく収録できているのを確認できたけど、今の段階で何かいうか収録みたいなことを。 内容というよりは技術的なか何かその辺で確認しておきたいことと。,Violet
大津留,00:05:14:12,00:05:18:16,詰まった時、詰まったときって、後でそこを切っていただけるんですか？なし。 詰まったら詰まったみたいな。,Violet
D,00:05:18:18,00:05:21:00,なしでも。,Violet
大津留,00:05:21:02,00:05:22:09,はい、ありがとうござい。,Violet
D,00:05:22:11,00:05:38:11,が。 放送時代が5050件を107。 ちょっとヤバイです。 クレイジーな番組ですけど、それ全部で18030万ぐらいをつけていただきますので、突然全然変わってしまいます。,Violet
大津留,00:05:38:13,00:05:39:05,ありがとうござい。,Violet
D,00:05:39:05,00:07:09:22,ます。 ただ、何しゃべろうかなというのはむしろ味でもありますし、その考えをめぐらせている時間みたいなことがその場にいる雰囲気になりますので、あんまりまとまってからしゃべってもらっても全然大丈夫というか、そんなに矢継ぎ早に激論する番組じゃないので、後、ところどころ正常ボートが通っていれば、それについて。 の。 何かそういう話をしてもらって、人が歩いていればそういう話をの景色とか雰囲気を感じながら聞いている方もいますのでというところですかね。 スタジオのニュース番組と違って短く。 情報というよりはむしろこの空気感の中でが。 思って先に彼はしてますけども、ちょっと困るんですね。 みなさんも当然ありますから、その中で。 感じています。 から、だんだん話が深まっていけばいいかなと思います。 ただ、今彼がここで。 空間情報っていうのが大事になります。 スタジオとは違う。 紹介されたことなんだ。 からプレートですから。,Violet
大津留,00:07:10:00,00:07:15:18,結構好きに。 今、お昼。,Violet
吉田,00:07:15:20,00:07:27:17,最近、日本人も外で写真撮るようになりましたよね。 もともと中国の人たちがそういう形て日本でやるようになって。,Violet
大津留,00:07:27:19,00:07:28:19,今、お昼。,Violet
D,00:07:28:19,00:07:45:23,になりましたから、音がよければやってくださいと。 ちょっと今皆さん始めたらして、アイドリング時。,Violet
大津留,00:07:46:01,00:07:57:01,今はお昼なんですけども、年末に来るとあそこをずっとライトアップして、クリスマスのちょうど今ここに来るまでの間、とても来られたこと。 きれいです。,Violet
山本,00:07:57:01,00:08:04:21,ことがあります。 あります。 きれいですよね。 本当に。 ぶらぶら散策するには一番という感じです。,Violet
吉田,00:08:04:23,00:08:23:05,一番これ来ると、いつものパリのシテ島っていうのがセーヌ川の真ん中にあるんですけど、ちょっとセッティングに入ってますよね。 両岸があって、真ん中にこう島があって、そこにいろいろ建築物があって、みたいな話なので、いつも何か懐かしく思うんですけどね。,Violet
山本,00:08:23:07,00:08:33:13,何かよくイベントもやってますしね。 ついこの間も古着のイベントとかやってましたしね。 結構天気さえよければいろいろなことができる空間で。,Violet
吉田,00:08:33:15,00:08:54:13,ほんで、この中央公会堂って岩本栄之助さんという人が資本家で寄付して建てたらしいんですけど、その頃は何もなかったらしいですね。 もう年なので、何か町のシンボルになるようなものっていうので、あれを建て。,Violet
大津留,00:08:54:15,00:09:03:01,私はこちらの美術館も好きで東京に来るんですけども、常設展だけでですか。 家建てたから消えたかもしれ。 大丈夫です。 美術館常設してるだけでも。,Violet
D,00:09:03:03,00:09:07:04,さんのマイクをお借りしていいですか？,Violet
大津留,00:09:07:06,00:09:12:17,と言ったから、消えたかパフォーマンス大丈夫ですか？,Violet
D,00:09:12:19,00:09:22:08,ちょっと確認します。,Violet
山本,00:09:22:10,00:09:24:16,こんな感じで通るんですね。,Violet
吉田,00:09:24:18,00:09:32:22,なんかね、ほんと。 いいです。,Violet
大津留,00:09:33:00,00:09:36:04,大丈夫ですか？そっと入れます。,Violet
山本,00:09:36:06,00:09:48:16,登記当時から行ったことないですね。 ここへ来る途中、中川家の剛さんとすれ違い。 知ってたんは何かこうラッキーやし、今日は何かいいことあるんちゃうかなと思ってきましたけどね。,Violet
吉田,00:09:48:18,00:09:50:15,すれ違いましたの収録してた。,Violet
山本,00:09:50:16,00:09:59:12,そうですね。,Violet
吉田,00:09:59:14,00:10:07:16,何かね、テレビも何かまち歩き番組って増えましたよね。 1時よりもね、ぷらぷら普通に歩いてお店とか行ったりするので、ブラタモリもあるし。,Violet
山本,00:10:07:16,00:10:08:03,たり、確かに。,Violet
吉田,00:10:08:03,00:10:12:12,お笑いの人。,Violet
大津留,00:10:12:14,00:10:18:11,結構キャンパスの中でもやってる時があって、知らずに何か映ったりした。 さすがにキャンパスの中ではなくて、何か高校生の皆さんにこの辺はこんなのがっていうのを学生さんのボランティアが作ったりしていて。,Violet
D,00:10:18:13,00:10:19:06,て。,Violet
吉田,00:10:19:08,00:10:21:17,そういうガイドツアー的なのは。,Violet
大津留,00:10:21:19,00:10:31:01,観光で結構教員が知らないところ知ってたりして、耳をそばだて。,Violet
吉田,00:10:31:02,00:10:32:19,ありますね。そういうサークルとかでやってますね。観光客の。,Violet
大津留,00:10:32:21,00:10:35:23,何て言ったって。,Violet
山本,00:10:36:00,00:10:40:12,確かに関大も同志社も絵になるから取材はしやすそうですね。,Violet
吉田,00:10:40:14,00:10:45:11,勉強していくの。,Violet
大津留,00:10:45:12,00:10:49:21,結構教員が知らないところ知ってたりして、耳をそばだてて。,Violet
吉田,00:10:49:23,00:10:50:08,勉強。,Violet
大津留,00:10:50:08,00:10:58:22,していた。そう。,Violet
山本,00:10:59:00,00:11:14:12,何かその事前にいただいてたやつを見ると、なんか最近の世界情勢から入っていけというような感じをしたんですけど。 やはりそういうお話でした。 5月3日。,Violet
吉田,00:11:14:13,00:11:22:23,やっぱりこれ放送っていつなの？でしたっけ？5月3日5月高校がそうか、ちょっと先なのかな。 イランがどうなってるかわからない。 ちょっと先なのか。,Violet
D,00:11:23:13,00:11:41:12,ですね。 今がどうなってるか分からない。 番組の冒頭で年末に収録してみたいな話をしましたので、時事ネタも要は5月のことを想像しながら、今日、昨日の話で全然問題ないです。,Violet
大津留,00:11:41:13,00:11:49:10,はい。 今日、昨日の話って言ったら、パキスタンでやってた交渉がやっぱりなっていうか、うまくいかなくて。 副大統領を出したのが正解なのかどうかというところを私は分からないんですけどね。 あまりに賭けをし過ぎてるのかなっ。,Violet
吉田,00:11:49:12,00:11:50:04,うまくいかないって思ってらっしゃった。やっぱり。,Violet
大津留,00:11:50:04,00:11:51:00,わけではなく。,Violet
吉田,00:11:51:00,00:11:56:06,て思ってらっしゃった。,Violet
大津留,00:11:56:08,00:12:06:02,副大統領を出したのが正解なのかどうかというところも分からないんですけどね。 あまりに賭けをし過ぎてるのかな。,Violet
D,00:12:06:02,00:12:11:09,って思った。,Violet
山本,00:12:11:11,00:12:27:04,何かもうタガが外れたような世界が日常になってしまったっていう感じがしてますけどね。 2つぐらいからなんですか、先生、先生、中球のポーズ。,Violet
大津留,00:12:27:06,00:12:38:12,いつぐらいからなのか、最初にトランプ出てきた時に国際法なんて無視をしてたので、多分その頃ってまだ周りに止めるわよね。 止める人がいても2期目は。 で、もう確信犯で、この間何でしたっけ？あなたは何を基準に判断するのかって私の両親でして、あなたの両親は信じられないわ。,Violet
吉田,00:12:38:13,00:12:40:11,その1期目、2016年。,Violet
大津留,00:12:40:12,00:12:55:14,とか言う人がいても、2期目はもう確信犯で、この間何でしたっけ？あなたは何を基準に判断するのか。 私の両親ですね。 あなたの両親が信じられない。,Violet
吉田,00:12:55:16,00:13:05:16,パンデミックがあって、ウクライナ戦争があってですよね。 だからそう考えると、もう非日常がずっと続いている。 非日常が日常になって慣れちゃったみたいな感じはしますよね。,Violet
山本,00:13:05:16,00:13:06:23,そういう感じになっちゃってますね。 何か建前。,Violet
吉田,00:13:07:01,00:13:12:07,がしますよね。,Violet
山本,00:13:12:09,00:13:24:06,としても、理想主義的なことっていうのはもう機能しないって言うかね。 まさかこうなると思ってなかったっていう。 私の両親か。 こうなると思ってなかったです。,Violet
大津留,00:13:24:10,00:13:31:00,せめて憲法基準ですぐらいのことは嘘でもいいから言ってほしかったんですけども、私の両親か。,Violet
山本,00:13:31:01,00:13:35:01,私の良心か。,Violet
大津留,00:13:35:03,00:14:21:01,私はアメリカ研究なので、出来るだけ毎年のように調査に行ってるんですけども、今年度ちょうど年度終わりまでに予算消化しなきゃいけなかったということもあって、3回行ったんですけども、この年度ほど無事に帰って来れるんだろうかという心配をしながら、まず入れるんだろうか、でいる間に何かないだろうか、で、帰りますで、果たしてもらえるんだろうかと思ったことを40年以上アメリカ研究してるんですけども、初めてここまで来、自分自身の危険を感じる調査っていうのはなかったんで、私ですら そうなんだからね。 非合法に入ってる方たちって生きた思いはしないだろうなって。,Violet
吉田,00:14:21:03,00:14:44:05,例外状態の時こそ、やっぱ国家主権が立ち上がりますからね。 これ、公法学者のシュミットっていう人が言いましたけど、例外状態がパンデミックもそうでしたけど、このもそうですけど、どうしても政治権力って強くなって強くなることで、いろいろ脆弱な立場に追いやられる人々が増えるっていう、そういうことなんだと思いますけど。,Violet
山本,00:14:44:05,00:14:56:14,政治権力が強くなるっていうのと合わせてなんですけど、あまりに属人的過ぎるっていうか、政治権力がそう見えちゃうんですね。,Violet
吉田,00:14:56:16,00:15:53:12,どうでしょうね。 だからね、鶏が先か卵が先かっていうことだと思うんですけど、トランプっていう大統領は出るべくして出てきた。 つまりトランプが原因というよりも結果なんだろうと思うんですよね。 民主主義指数っていうのがあるんですけど、それを見るとやっぱりトランプが出て当選する前よりもアメリカの政治状況ってやっぱ劣化をしてたんですよね。 で、それがやっぱりああいうリーダーがいろんな理由、プロセスでいろんな予期せぬことはありましたけど、それがああいうリーダーを生んだんじゃないかっていうふうに思いますが。 何でもね、ポピュリストが出てきて、民主主義の危機だっていうふうに言いますけど、僕は持論としては、民主主義が危機だから、やっぱりポピュリスト的なメッセージが政治家が出てくるっていうふうに捉えた方がいいんじゃないかと思い。,Violet
大津留,00:15:53:14,00:16:12:10,でも、なかなか危機だというのをとことん最悪の状況に直面するまで気がつかないか。 なんとなく危機が進んでいるんだけども、危機だと思わないうちに、なのでトランプがって言いたくなるような、自分たちとしては悪くなかったのにあいつが出てきてっていう、そのどうして気がつかないんだろうなというところですよね。,Violet
吉田,00:16:12:10,00:16:14:09,なくなるよう。 ゆでガエル的なところはあると思うんですけど、日々の小さなことってやっぱ気づかないですよね。 変化ってね。,Violet
大津留,00:16:14:11,00:16:17:18,どうして気がつかないんだろうなと思います。,Violet
吉田,00:16:17:18,00:16:57:14,何だろう、ここまでインフレもんかあるのもね。 久々の先進国のことですけど、本当にオイル危機以来ですけど、それでもね、なんとかなんとか高くなったな、外食高くなったなと文句言いつつもなんとなくそれでやっていくしかないので、ほんと日々の小さな積み重ねって見えないですよね。 久々の先進国のことですけど、ほんとオイル危機以来ですけど、それでもね。 だからこう物事を観察しておくってすごく大事だと思うんですね。,Violet
山本,00:16:57:16,00:17:22:05,ほんとそうですね。 ほら、炭鉱のカナリアみたいなことを言うじゃないですか。 だからみんなが危機だと思ってない時に、危機だっていう人がものすごくうさんくさく見られてしまうっていう、そういう問題も何かあるのかなっていうふうに思います。 あるいはそういう人に対する信用が失われてるっていうかな。 そうそうそうそう。,Violet
吉田,00:17:22:07,00:17:28:17,平和みたいなものをね、こうディストラックとする、邪魔するやつだってやっぱ思われちゃうんですか。 する人って。,Violet
山本,00:17:28:19,00:17:29:22,そうですね。,Violet
大津留,00:17:30:00,00:17:33:15,そういう人が今のネット状況というのはとお考えですか？学生がどんどん変わっていくので追いついてないんですけども、今。,Violet
山本,00:17:33:17,00:17:34:05,そうですね。,Violet
大津留,00:17:34:05,00:17:38:17,学生がどんどん変わっていくので、追いついてない。,Violet
山本,00:17:38:18,00:18:49:07,今、吉田さんがおっしゃられた論法と同じになるんですけど、やっぱりあれはネットが増幅ネットが、あるいはSNSがきっかけでタガが外れたっていうよりも、もともとあった何かがと極大化して大きく見えている。 それが実態以上に私たちをこう捉えてしまってるっていうところがまず一つあるんだろうっていうふうに思っているんですよね。 だから実際、特にSNSとかってそうですけど、簡単に安易に押せちゃうし、簡単にあんまり考えずに短い言葉入っちゃえるんですよね。 でもそういう短いことも入ったり、引用してる人もよくよく聞いてみると別にそういう思想を持ってるわけじゃないってことだってあり得るって思うんですよね。 だから、その言論とか意思表示のあり方が、なんていうか変わってしまったけれども、実際、じゃあそういう人がどれぐらいいるのかって検討の余地がまだまだ残ってる気がしますね。 ネット上の言葉だけ見てると、なんかもうすごいギスギスしたような異世界って見えちゃうけど、実際私らの日常は普通に生きてるわけでね。,Violet
吉田,00:18:49:09,00:19:45:04,特にメディアの方は何か世の中悪くなってると、トランプとSNSが悪いんだっていう、そういう反応なんですけど、多分その政治家もSNSもメディアであることは変わらないわけですね。 何かを媒介してるわけですよね。 その媒介する装置によって人間のどういうところの人間の言動がフレームアップされるかっていうのが変わるっていうことだったんですよね。 だから民主主義における政党がいろいろある。 いろんなタイプのリーダーがいる。 それからメディアもSNSだけじゃなくて、他のいろんなオールドメディアと呼ばれている。 こういうラジオも含めて、いろんなメディアが存在してるっていうこと自体が、人間の何かもっと立体的な、複合的な、奥行きのある存在であることを可能にせしめるんじゃないかと思うんですよね。 だから、複数性とか多様性って、そういった意味でも大事だなと改めて思いますけどね。,Violet
大津留,00:19:45:06,00:20:06:11,おっしゃったみたいに、押せばいくってすごく簡単だから、そちらにこう流れていって、それと結婚するんで大変なんだけど、時間かけてゆっくり何人かやろうよという方に、どういうふうに私たち自身を引っ張っていけばいいのかなっていう、自分自身も含めて。,Violet
吉田,00:20:06:12,00:20:09:18,うん。 切実な問題ですね。,Violet
山本,00:20:09:20,00:20:37:22,自分には。 ほんとそうですね。 ただ実際はそのSNSを使ってうまく勉強会してる学生さんとか、うまくコミュニティ回している集団とか団体ってあるあると思うんですよね。 そういう意味ではあくまでツールだから、これまでできてなかったことがSNSで一気にできるわけでもないし、できてたことができなくなるわけでもないっていうふうには一応思ってるんですけどね、私はね。 生成AIはね。,Violet
吉田,00:20:38:00,00:20:39:17,先生どうですか、それいうとはね、これもね、たぶん危機だとは思うんですけど、僕も。 でも日々のことなので、やっぱりなんとなく少しずつ変わっていくんだけれども、その帰結がどうなるか誰もわからないわけじゃないですかね。 それを危険とか危機と言わずして、なんといってもこう思うんですけど。,Violet
山本,00:20:39:19,00:20:41:18,そうですよね。,Violet
吉田,00:20:41:18,00:20:58:09,これもたぶん危機だとは思うんですけど、僕も。 でも日々のことなので、やっぱりなんとなく少しずつ変わっていくんだけれども、その帰結がどうなるか誰もわからないわけじゃないですかね。 それを危険とか危機と言わずしてなんという。,Violet
山本,00:20:58:13,00:20:59:02,先生は本当に今の日常に気が付いたら入ってるっていう感じで検索したら最初に出てきますもんね、先生の答えは。 だから、その判断する前にもう入っちゃってるっていうね。 そこの問題はやっぱり技術の問題として大きいっていうふうに思いますね。 あと、試験の作り方が変わりましたね。,Violet
吉田,00:20:59:02,00:21:00:04,ですけど。,Violet
山本,00:21:00:06,00:21:17:19,先生は本当に今の日常に気が付いたら入ってるという感じで検索したら最初に出てきますもんね、先生の答えは。 だから、その判断する前にもう入っちゃってるというね。 そこの問題はやっぱり技術の問題として大きいっていうふうに思いますね。,Violet
吉田,00:21:17:19,00:21:19:19,怖いですよね。 それからレポート書かせるのが一番教育効果が高い教育方法だと思ってたんですけど、今逆ですもんね。 そうすると逆に教育効果なくなっちゃうっていう状況になっちゃって。,Violet
山本,00:21:19:21,00:21:22:16,という状況で、結局筆記試験でその場で書かせ。,Violet
吉田,00:21:22:18,00:21:34:12,お詰め込み式、変形式に戻っちゃったかっていう感じで。,Violet
山本,00:21:34:12,00:21:36:16,で、結局筆記試験でその場で書かせた方が、ええ、そう。,Violet
吉田,00:21:36:16,00:21:40:12,そうそうそう、詰め込み式に戻っちゃったかなという感じ。,Violet
大津留,00:21:40:12,00:22:02:10,良くても、その使い、これからずっと一生使っていく世代なんだから、うまく使うやり方を学ばせることが教育だっておっしゃるんですけども、私自身が使いながら教育されてきてないので、何をすれば本人の能力を高める形で使えるのかというのがわからない。,Violet
吉田,00:22:02:15,00:22:04:18,そうですよね。,Violet
山本,00:22:04:19,00:22:22:17,よく今、相談相手として使う分には求められないし、むしろ言うてることを疑って使いましょうみたいなことはよく言うんだけど、実際じゃあ私はそうやって使ってるかっていうとそうでもなくて、割と鵜呑みにしちゃってるんですよね。,Violet
大津留,00:22:22:19,00:22:54:07,ね。 何を何を引っ張ってきてあなたは間違ってるんだって言えるのかというと、なかなか情報量としてはものすごく差があるんです。 でも、こないだのイラン攻撃の時の戦略も、AIが。 何ですかねという方向が好きだなと思ったら、ええという方向に向かって動いていくんだっていう風に書かれていて、じゃあトランプのような人が使うと思うと、そちらの方向になってしまう。,Violet
山本,00:22:54:07,00:23:00:16,ものすごく優しいツールだと言いますよね。 使えてね、こう、あなた言う意見ですねと言って褒めてくれるっていう。,Violet
吉田,00:23:00:18,00:23:19:12,最近AIも先生もいろんな種類あるんですけど、自分でモードを選べるんですよね。 つまり私に優しくしてっていうと優しくするし、ちょっともっと距離感とってっていうと距離感をとった答えをするし、そういった意味では人間にすごくアダプトしている、適応してるツールだと思うんですけれども。,Violet
