Speaker Name,イン点,アウト点,文字起こし,色選択
東島,00:00:12:00,00:00:16:05,ここで付けるのをちょっと待ちください,Violet
千葉,00:00:31:13,00:00:44:15,2222,Lavender
千葉,00:00:48:05,00:00:50:20,これはねもうポッケというより,Lavender
千葉,00:00:52:05,00:00:55:10,もうつけていただければお話ができるような,Lavender
千葉,00:01:05:00,00:01:14:05,あら、そっちは聞こえてるんだよな。,Lavender
東島,00:01:38:10,00:01:40:10,もうこれ映らないので,Violet
千葉,00:01:52:08,00:01:55:13,どこでも,Lavender
千葉,00:02:04:20,00:02:07:20,どこかでカットするんですねはい分かります,Lavender
千葉,00:02:12:00,00:02:15:05,なんかこうリラックスした感じでって聞いてますけど,Lavender
千葉,00:02:16:10,00:02:20:08,じゃあ、先生呼びっていうのは無しで無しなんです,Lavender
東島,00:03:28:10,00:03:34:05,分かりました。これなんか後ろ車とか救急車とか通った時はもう一回言った方がいいんですか?,Violet
千葉,00:03:57:23,00:04:02:00,雑に始めていいんですね、じゃあ雑に。,Lavender
千葉,00:04:05:23,00:04:14:12,じゃあどっちかというと僕がホスト役っぽい感じでやりますんではいですかねそれは成り行きで成り行きで成り行きで,Lavender
東島,00:04:09:03,00:04:11:20,はい。よろしくお願いします。,Violet
東島,00:04:13:13,00:04:15:03,なるべきではい,Violet
千葉,00:04:16:00,00:04:20:20,東京に来るのは久しぶりですかそれともよく来る,Lavender
千葉,00:04:24:00,00:04:26:03,ちょっと思ったんですけどこっちって,Lavender
千葉,00:04:33:07,00:04:39:20,なんかここに来るとすごくこうなんかなんていうのかな違和感をちょっと感じて,Lavender
千葉,00:04:43:03,00:04:48:12,東京って普通都市ってなんか真ん中に目立つ,Lavender
千葉,00:04:49:23,00:04:53:17,建物とか人が集まる場所とかそういうのがあるじゃないですか,Lavender
千葉,00:04:55:07,00:04:59:10,でもここ真ん中なのに何も見ても何もないんですよ,Lavender
東島,00:04:57:20,00:05:00:10,何もないんですよ,Violet
千葉,00:05:00:18,00:05:13:05,それで変わってるなぁと思うんですけどでも歴史を踏まえてみるとなんかここ昔はちょっと向こうの方かなあの巨大な,Lavender
千葉,00:05:13:05,00:05:25:18,天守閣があって17世紀に巨大な天守閣があってでも火事で燃えちゃってということでかつてはここにすごく目立つものがあって多分そこが街の真ん中みたいな,Lavender
千葉,00:05:26:18,00:05:30:08,目印というかそういう目立つものがあった,Lavender
千葉,00:05:31:07,00:05:35:20,でも今はなくなっちゃった城って言ったらなんか天守があるじゃないですか,Lavender
千葉,00:05:37:03,00:05:42:00,だから天守のない城、ない城、天守が存在しない城っていうのは,Lavender
東島,00:05:41:07,00:05:43:07,はい,Violet
千葉,00:05:45:18,00:05:47:10,面白いところかなと思っていて,Lavender
千葉,00:05:48:22,00:05:52:10,ここ和田,Lavender
千葉,00:05:53:15,00:05:58:02,ちょっと時間があったのでそこを見物してた,Lavender
千葉,00:05:59:03,00:06:08:15,説明板があってそれを見るとあの和田倉門を作ったのはそれを中心になって作ったのは伊達正宗,Lavender
千葉,00:06:10:00,00:06:26:18,伊達正宗って仙台の青葉城を築いた人ですよね東島さんと青山に来られたことがあるからご存知だと思いますけどやっぱり青葉城も天守閣ないんですよ,Lavender
東島,00:06:26:22,00:06:28:20,そうなんですか,Violet
千葉,00:06:28:22,00:06:32:22,そういう意味で共通してるんですけどやっぱり,Lavender
千葉,00:06:34:00,00:06:35:18,なんか目立つものがない,Lavender
千葉,00:06:37:13,00:06:52:05,でもないっていうのは多分それなりの意味があってきっと何か理由があって徳川も長い間の江戸時代の長い期間それから伊達政宗も伊達政宗の場合って天守閣自体は建てなかったらしいんです,Lavender
千葉,00:06:53:05,00:07:02:00,でもないっていう状態を維持したっていうのはなんかそれなりに意味があったと思うんですよねそれを踏まえて実はちょっと遠島さんの,Lavender
東島,00:07:05:23,00:07:08:10,めっちゃイントロがうまい,Violet
千葉,00:07:08:20,00:07:12:20,考えたんです本を読ませていただいて大変感銘を受けた,Lavender
千葉,00:07:14:02,00:07:18:18,とても面白かったんですけどもそこで特にあの,Lavender
千葉,00:07:20:00,00:07:24:02,僕が注目したのがやはり人って尻尾がない,Lavender
千葉,00:07:25:03,00:07:31:23,後ろから生き物を見た時に 例えば哺乳類を見た時に一番注目するのは目立つところって 尻尾じゃない,Lavender
千葉,00:07:34:22,00:07:38:15,それはなぜかという問い立てはとても魅力的で,Lavender
東島,00:07:40:10,00:07:42:12,ありがとう うわぁ嬉しい,Violet
千葉,00:07:40:18,00:07:43:00,はい,Lavender
千葉,00:07:46:15,00:07:53:07,人っていうのは例えば哺乳類で人みたいに尻尾がない,Lavender
千葉,00:07:54:15,00:08:02:05,ないって言っていいのかどうかちょっとそこは後で説明していただきたいんですけど尻尾がないっていうのはかなり特別なことなんでしょうかね,Lavender
東島,00:08:02:15,00:08:13:03,そうですね、少ないと思います。基本形はあるのがベースで、ないってなるとかなり限られてきて、あと極端に短いとかだとちょっといるんですけど、完全にないはかなり少ない。,Violet
千葉,00:08:18:00,00:08:26:20,そうすると尻尾がないというのは人間にとってとても重要なことと考えていいわけですね。,Lavender
千葉,00:08:28:15,00:08:37:13,本の中で東島さんが特に強調しておられて私の印象が残ったところの説明があって,Lavender
千葉,00:08:41:08,00:08:44:22,人に尻尾がないということとそれから,Lavender
千葉,00:08:45:23,00:08:51:08,うーん二足歩行するこのことは実は,Lavender
千葉,00:08:54:02,00:09:03:13,これは非常に強調して書いておられたところなんですけどここなぜそうなのかこれ結構僕も実はうっすらと思ってたところが,Lavender
千葉,00:09:04:22,00:09:14:20,結構いろんな本を読むとやっぱりそういうことが書いてあって、多くの人はそう信じていると思うんですよね。でもそうではないというのはどうしてなのか。,Lavender
東島,00:09:15:00,00:09:30:07,それは化石の証拠から結構はっきり分かっていまして人に尻尾がないっていうのがそもそも人上下って類人猿を含めての先祖からの共有の形質なんですけどもその尻尾がない一番古い化石,Violet
東島,00:09:30:07,00:09:45:15,すでにまだ4足歩行で2足で歩いてないんですよねなので先に尻尾がなくなってからしばらく経ってから2足歩行を獲得したという風に考えるのが自然でなので尻尾の喪失の方が先に起きてるねっていう話,Violet
千葉,00:09:48:15,00:09:50:15,そうすると じゃあ,Lavender
千葉,00:09:52:20,00:09:56:08,今 東島さんが支持している,Lavender
千葉,00:09:57:08,00:10:01:10,その理由になる一番,Lavender
千葉,00:10:02:20,00:10:06:18,想定できるというか、信頼できる考え方というのは何なんですか。,Lavender
東島,00:10:07:00,00:10:23:09,難しいですね。正直現時点だと何も積極的にこうだという証拠も、何かを否定する証拠も現時点でないので、何でも言えちゃうような状況ではあるんですけど、まず少なくとも今言われている仮説で1個一番有力士というか支持している人が多い。,Violet
東島,00:10:23:09,00:10:39:18,ゆっくり動いたからじゃないかという説なんですけどあれはちょっと違うと思っていて私自身は何かなくなる積極的な理由があったんじゃないかなというふうには考えていますなくならざるを得ない理由かなくなった方が良かった理由かどっちかがあったんじゃないかなと,Violet
千葉,00:10:42:02,00:10:57:03,というわけではなくてやっぱりないことというのが何かしらとても生きていく上であるいはそれ以外の理由であるいは子孫を残したりする上で何か有利なことがあって亡くなったというふうに考えていいわけですか,Lavender
東島,00:10:57:03,00:11:06:15,そうですね、あるいは何かそういう積極的な理由ではなくて、発生学的なそれこそ製薬によって作ることができなくなったという可能性もあるんじゃないかな。,Violet
千葉,00:11:06:18,00:11:14:23,それは例えばこういうことですか例えばある部分で何かしら機能なんか役に立つ,Lavender
千葉,00:11:15:23,00:11:25:00,何でもそうですけど、例えば手を羽にしてしまうと物がつかめなくなるというのと同じような理屈で。,Lavender
千葉,00:11:26:00,00:11:37:17,あるいはシーソーみたいにこっちが上がったらこっちが下がるみたいな感じで、尻尾があるとある何らかの仕事ができなくなる、機能が果たせなくなるということなんですかね。,Lavender
東島,00:11:38:05,00:11:52:05,そうですね。例えば下半身の方の形成というと、尻尾の周りだと生殖器とか足とか、運動様式に非常に関わるようなところも同じような遺伝子の仕組みで作っているところがあると思うので、例えば、生殖器なり、,Violet
東島,00:11:52:05,00:12:06:05,繁殖なり運動なりにすごく必要な形質を獲得するために何かのスイッチをオンにしなきゃいけないそうすると尻尾を作ることができないみたいななんかこういうこっちが立ったらあっちが立たないみたいなそういう関係があってもいいんじゃないかなとは思っています,Violet
千葉,00:12:09:05,00:12:13:05,なるほど、わかりました。では、逆にお聞きしたいんですけど,Lavender
千葉,00:12:15:05,00:12:25:23,しっぽ、哺乳類のしっぽって何の役に立つのか動物によってそれは違うと思いますが逆にですね、しっぽって何の役に立つのか,Lavender
東島,00:12:26:05,00:12:41:04,なるほど。一番あるのはやっぱり運動でバランスを取るのが一番大事ですよね。その祖先も木の上にいたのでバランスを取るためにはあったほうが良かったはずなんですよ。機能的にはあったほうが良かったのになくなっているというのが不思議なんですけど。,Violet
東島,00:12:41:04,00:12:56:02,外的なシグナルとして使います群れの中の順位とか今交尾OKっていうサインだったりとかあとは仲間同士の信頼関係の確認だったり威嚇だったりとかあとは他だと死亡の貯蓄とかもあります,Violet
千葉,00:12:59:23,00:13:06:12,そこでちょっと気になったんですけど、今ちょっと気になったんですけど、遠島さんの定義する尻尾。,Lavender
千葉,00:13:07:13,00:13:17:17,例えばですね、あそこに矢倉が立っていて、そこの屋根の上に車中を置く。まあ、シビが由来で、シビから。,Lavender
千葉,00:13:18:18,00:13:31:17,あれってなんか頭がさっき見たんですけどさっきちょっと近くまで行ってみたんですけどでもそこまで細かく見えなかったんですけど頭が胴体の上の方が,Lavender
千葉,00:13:32:23,00:13:34:15,下側が,Lavender
東島,00:13:34:05,00:13:37:05,はい 魚なんですねああシャチだからはい,Violet
千葉,00:13:36:02,00:13:42:18,腕跳ね上がってるじゃないですかでトラで頭がトラで腕坂,Lavender
千葉,00:13:47:03,00:13:53:17,で じゃあ この尻尾 この…今 尻尾って言ったけど この…社長 この…このね…あの…,Lavender
千葉,00:13:54:18,00:13:56:20,あれは尻尾なんですか?,Lavender
東島,00:13:56:20,00:14:09:03,あれは尻尾の一部だと思いますけど、それはこのシャチホコのどこに相配接口があるかというので、肛門があれば肛門より後ろが尻尾なので、そこまでちゃんと描写してくれてたらいいんですけど。,Violet
千葉,00:14:09:15,00:14:11:15,なるほど,Lavender
千葉,00:14:13:00,00:14:15:20,自身は魚だから人魚だとか,Lavender
千葉,00:14:16:23,00:14:18:10,それから人形は違うか,Lavender
千葉,00:14:19:13,00:14:24:02,いすぐにしても魚アワムの尾びれは尻尾なんですか,Lavender
東島,00:14:24:12,00:14:34:00,そうですねヒレ自体ピラピラのところはアタッチメントなんですけど魚の焼き魚を食べてたら肛門から後ろにちょっとだけ身があるじゃないですかあれは尻尾です,Violet
千葉,00:14:34:15,00:14:46:18,ああ、ここからこの部分が、こうヒレがあって、肛門があって、その間のところのちょっと細くなっているような、魚によってそれは違うでしょうけど、そこが尻尾なんですね。,Lavender
千葉,00:14:47:17,00:14:55:05,じゃあ鳥はどうなんですか?例えば最近ですね山鳥山鳥って好きなんですよ結構きれいで,Lavender
千葉,00:14:56:05,00:15:00:23,あれ大好きなんですけど特に繁殖期になるとあれオスがピッとこう,Lavender
千葉,00:15:04:08,00:15:07:07,山鳥の方のシダリオのあれがとても綺麗なんですね,Lavender
千葉,00:15:08:08,00:15:16:10,で、あれの尻尾は今の話だと尻尾の長いところってほとんど尾羽なの,Lavender
千葉,00:15:17:10,00:15:28:18,尾羽はヒレとは違うけど 骨は入ってないですよね血管も入ってないし 筋肉もないですよねそうすると あれは尻尾ではない ということになります,Lavender
千葉,00:15:30:08,00:15:39:15,そうするとその横は実際には隠れちゃってるけどその短い尾羽のつけてる伸びている部分あそこが鳥の尻尾という理解でいいですか,Lavender
東島,00:15:38:20,00:15:40:23,そうですね、ぼんじりまでが尻尾です,Violet
東島,00:15:42:02,00:15:46:12,全部山鳥もクジャクもシダリオをむしって舌のぼんじりがしっぽいです,Violet
千葉,00:15:46:12,00:15:48:10,そうか、ほとんど見えない,Lavender
千葉,00:15:49:13,00:15:55:17,羽で見えなくなってるけどでもあれは一応尻尾はあるだけどみんなが尻尾って言ってる部分は尻尾じゃない,Lavender
千葉,00:15:59:13,00:16:02:18,マニアックな質問していいですか,Lavender
千葉,00:16:03:17,00:16:05:13,思いっきり次はすごいマニアックなんですよ,Lavender
東島,00:16:05:13,00:16:09:17,はい、社長歩行もだいぶマニアックでしたけどはい,Violet
千葉,00:16:09:07,00:16:16:12,カエルって尻尾ないじゃないですかはいオタマジャクシのこのここのこれは何なんてあれは尻尾です,Lavender
東島,00:16:16:18,00:16:19:03,頭弱者は尻尾なんです,Violet
千葉,00:16:17:20,00:16:23:03,尻尾なんですか?あれ?でも積作でしょ?骨じゃないでしょ?でも尻尾でいいんですか?,Lavender
東島,00:16:20:10,00:16:22:00,そうですね。骨じゃないですか。そうなんです。,Violet
東島,00:16:23:05,00:16:30:05,あれ妖精なのでギリギリなとこではあるんですけど一応機能的なしっぽ,Violet
千葉,00:16:35:15,00:16:37:07,一応でも脊椎動物に限るんですか,Lavender
千葉,00:16:38:10,00:16:40:00,トンボだとかサソリの尻尾は入らない,Lavender
東島,00:16:40:15,00:16:47:05,そうなんです。あれだとボディープランが違いすぎて、無脊椎には適応できないんですよ。解剖学的なこの騒動性が。,Violet
東島,00:16:52:15,00:16:59:15,たまに言われるんですねトンボとかサソリの尻尾はどうなんですかって言われるんですけどちょっと違うんですよ先っちょに産卵管とかある,Violet
千葉,00:17:00:18,00:17:13:05,まあ進化の言い方でするとあれは騒動ではないけれどないだけど似てますよね見かけはね多分昆虫だとあの尻尾まあ腹部の,Lavender
千葉,00:17:13:05,00:17:25:17,恥と呼ぶべきかもしれませんけどもあれと例えばネズミの尻尾それが要するに彼らの脊椎動物ネズミたち人それとトンボだとか症状バイだとかそのグループが,Lavender
千葉,00:17:27:03,00:17:42:00,分かれたのはすごく古い時代でその古い時代に分かれた後でそれぞれ独立にその尻尾哺乳類だとか赤水動物の尻尾それから昆虫の副端部,Lavender
千葉,00:17:42:00,00:17:56:23,それが独立にできてきたものなので、ちょっと似たところはあるけど、まあ構造は実際全然違いますけど、なんとなく似たところがあるのは、それは独立にできあがったもので、いわゆる掃除、掃除でもないか、でもいずれにしても独立にできたものという理解。,Lavender
東島,00:17:56:03,00:17:57:17,そういうことです,Violet
千葉,00:17:57:23,00:18:01:03,そうするとですね トンボのしっぽは何と呼んだらいいんですか,Lavender
東島,00:18:01:23,00:18:08:20,あれは何て言ったらいいんですかねあれは無脊椎動物の体の端っこですかね,Violet
東島,00:18:12:18,00:18:16:18,そういう言い方もする時もあるんですよねシュードテイルみたいな,Violet
千葉,00:18:17:03,00:18:20:05,でもとんぼにしてみれば俺のしっぽは偽物かよ,Lavender
東島,00:18:20:10,00:18:21:23,そうですね、不明用の話です,Violet
千葉,00:18:21:23,00:18:23:15,不条外、不条外。,Lavender
東島,00:18:25:15,00:18:30:00,だから全くそのおっていう定義を考え直さなきゃいけないんだと思います,Violet
千葉,00:18:31:20,00:18:36:18,確かにただ考え方によって例えばこういう考え方はどうですかね確かに,Lavender
千葉,00:18:37:23,00:18:44:23,ネズミの尻尾とトンボの尻尾サソリの尻尾は別物だけど,Lavender
千葉,00:18:48:10,00:19:01:16,作るのに使っている設計図と言っていいのかな違うかなアルゴリズムと言っていいのかな要するに遺伝子のレベルの本の中で書かれている,Lavender
千葉,00:19:01:16,00:19:14:23,ウイントだとかウイントの下流で働くCDXだとかそういう遺伝子は哺乳類の尻尾のところではそれが尻尾の形成に関わっています,Lavender
千葉,00:19:16:00,00:19:28:05,そういう話でしたけども昆虫の場合にもやっぱりウイントあるしCDXに関係するとおそらくソードだと考えられるのがゴーダルだから,Lavender
千葉,00:19:29:13,00:19:45:15,やっぱりそれは騒動ではないんだけどやっぱり尻尾の先のところに伸ばしていくのに関わっているということで遺伝子ネットワークつまり発生のネットワークのところのそのアルゴリズムのところは共通なものが使われていると考えることができますよね,Lavender
千葉,00:19:46:20,00:20:02:23,そうするとそういう遺伝子のレベルで見たときにはもちろん全部が共通ではなくて部分的に共通なだけですけれどもでもそういう共通な部分が使い回されている一種のツールキットが使い回されているということは見方を変えると,Lavender
千葉,00:20:03:23,00:20:15:03,同じ視点で形作りボディープランの作り方という面で共通のものと考えることってできないんですかね,Lavender
東島,00:20:15:10,00:20:25:21,体幹の後方への延長部分という意味では一緒だと思いますただその体幹の中に脊椎動物の尻尾だとそもそも体空が存在しないので,Violet
東島,00:20:25:21,00:20:36:08,その点無脊椎は入れられるのでそこには大きな違いがあると思いますけどその体幹を後ろに伸ばす胴体を伸ばす仕組みという意味では一緒だと思います,Violet
千葉,00:20:37:20,00:20:43:10,そうすると見用によっては同じ尻尾顎の中に含めること,Lavender
千葉,00:20:47:17,00:20:50:03,もっと広く広げることも可能ですよ。,Lavender
東島,00:20:50:08,00:20:52:00,そうですね、拡大はできると思います。,Violet
千葉,00:20:53:13,00:20:55:10,ここで難題が生じるんですけど,Lavender
千葉,00:20:57:15,00:21:10:09,僕 貝やってるんですね 貝を割と専門に別に なんだろう だからどうだって話じゃないんですけど哺乳類とか 人は 例えば 遠島さんだったら人文系のこともやっておられます,Lavender
千葉,00:21:10:09,00:21:23:03,もともとそういうことをやっておられたから当然人との関係というのを大事にするので意思疎通というのをとても大切にするじゃないですかで、猿も意思疎通できるんですかね,Lavender
千葉,00:21:24:20,00:21:32:15,犬も意思疎通できますよね 尻尾振ったりしてネズミも意思疎通できる人いますよねでも飼いって,Lavender
千葉,00:21:33:23,00:21:38:05,根本的に人との意思疎通を,Lavender
千葉,00:21:39:08,00:21:44:18,意思疎通を拒否するんですよ何を考えているのかわからない,Lavender
千葉,00:21:49:15,00:21:57:23,そういう存在をやっているとちょっとなんていうのかな尻尾という概念が,Lavender
千葉,00:22:01:13,00:22:20:02,なぜかというと例えば発生学的な話をすると症状映えとそれから人、ネズミさっきのウイントとそれからコーダルだとかCTXなんかもやっぱり同じファミリーというか同じ,Lavender
千葉,00:22:21:03,00:22:23:13,機芸を持っている,Lavender
千葉,00:22:24:12,00:22:26:20,遺伝子が当然貝類で,Lavender
千葉,00:22:27:23,00:22:31:08,体の前後軸の後ろのところで,Lavender
千葉,00:22:33:00,00:22:35:08,発生初期に関わっている,Lavender
千葉,00:22:36:10,00:22:41:00,活躍してるんですけどところが巻貝例えば巻貝って,Lavender
千葉,00:22:42:10,00:22:54:22,発生が進んでいくと体がねじれるんですよそうすると何が起きるかというと例えば肛門とか接触線が頭の後ろに来るんですよね,Lavender
千葉,00:22:56:10,00:23:02:08,それから例えば特に生殖戦なんかはそうなんですけどドラゴンボールの話を本に書かれて,Lavender
千葉,00:23:05:23,00:23:10:10,悟空の尻尾って言ってあの本の中であれ印象的だったんです,Lavender
千葉,00:23:11:15,00:23:14:15,あの中にナメック星人のピコロ大魔王で出てくる,Lavender
千葉,00:23:15:15,00:23:21:05,あの人っていうかあの人ちょっとなめくじっぽいんだけど口から卵飲むじゃないですか,Lavender
千葉,00:23:22:10,00:23:24:05,でもあれ惜しくて,Lavender
千葉,00:23:25:05,00:23:31:05,片つむりだとかなめくじって口の横のほっぺたに相当する部分、場所的にはこの辺りから卵を産む。,Lavender
東島,00:23:31:15,00:23:33:23,貝類だったんですね,Violet
千葉,00:23:34:00,00:23:40:08,いや帰りかどうか分からないけどもまあまあなんかこう頭になんかなめくじっぽいなんか特にあの触覚あるし,Lavender
千葉,00:23:41:10,00:23:55:20,そうするとですね要するに動物だと初期の段階では後ろにあった部分がねじれて前の方に来ちゃってしかも後端部がどこなのかっていうのが発生の後期になってしまうともう分からなくなっちゃうんですよ,Lavender
千葉,00:23:57:23,00:24:08:02,だからある天理高端は立体として存在していてここが一番の端っこというふうに決められない状態になっちゃってるんですよ,Lavender
千葉,00:24:09:08,00:24:16:15,それからイカもそうで、あれもトウソク類、軟体動物ですけど、貝の仲間ですけど。,Lavender
千葉,00:24:17:20,00:24:35:05,あれもなんか墨吐くところあるじゃないですか頭があって頭の上に足が生えてて墨吐くところがあってその近くに実は肛門があってこの辺りが大体いわゆるロートといっているなんか墨吐く場所とかあの辺りが大体症状映えだとか,Lavender
千葉,00:24:36:05,00:24:45:05,なんかでいう 尻尾に該当するところなんですよね 尻尾はないないというか尻尾に該当するものは発生学的には,Lavender
千葉,00:24:46:18,00:24:49:23,対応させるのが困難な生き物なんですよ,Lavender
