Speaker Name,イン点,アウト点,文字起こし,色選択
千葉,00:24:53:03,00:24:57:15,面白いことにえ、あのえっと尻尾って英語だとテイルじゃな,Lavender
東島,00:25:07:05,00:25:09:10,テイルオブテイル,Violet
千葉,00:25:12:00,00:25:23:10,なんていうのかな そうするとカタツムリにもテイルっていう言葉で表現される場所があるんですねで どうかっていうとカタツムリって日本の,Lavender
千葉,00:25:24:10,00:25:36:18,大触覚があって そこに胴体があってなめくじ型の胴体があって 殻しを負ってるじゃないですかそのなめくじ型の足の ここは足なんですけど要するに胴体のこのところに足があって その一番端っこ,Lavender
千葉,00:25:38:05,00:25:41:17,足の端っこ、ここをテール、尻尾と呼んでいるんです,Lavender
千葉,00:25:43:08,00:25:46:20,だから発生学的には全然違う場所を,Lavender
千葉,00:25:47:20,00:25:49:13,あの尻尾と呼んでるんですよ,Lavender
千葉,00:25:51:13,00:26:02:18,謎というか随分だから症状バイだとかそれからトンボだとかサソリだとか節足動物とそれから,Lavender
千葉,00:26:03:17,00:26:10:02,お乳にはかなり多くのメンバーがおおむねなんとなくまあ意見は違っても,Lavender
千葉,00:26:11:15,00:26:15:08,イメージとしては,Lavender
千葉,00:26:16:22,00:26:21:17,なんとなく尻尾って言える感じがするんですけど,Lavender
千葉,00:26:23:05,00:26:25:23,貝の場合には全然違う場所が湿っぽいんですよね。,Lavender
千葉,00:26:27:13,00:26:38:20,ところが機能としてはやっぱり尻尾だったりするんですよ。さっきおっしゃってた、ああいう機能を実は彼らも持っていて、片つむりの尻尾でも持っていて、これは私の前。,Lavender
東島,00:26:34:15,00:26:36:22,お、せー、はい,Violet
千葉,00:26:39:20,00:26:46:10,トカゲって尻尾で自接するじゃないですか敵の目を欺いたりするじゃない,Lavender
千葉,00:26:47:13,00:27:04:02,片つむりも、これは昔、私の研究室にポスドークでいた細さんという人がやった研究なんですけれども、沖縄のさつまという種類では天敵に襲われると足の先端、つまり尻尾ですね、それを自分で自設して、,Lavender
千葉,00:27:05:15,00:27:10:05,それで本体は逃げるということをするんですよ切れた部分は再生,Lavender
千葉,00:27:11:08,00:27:13:00,トカゲの尻尾と同じことをやっている,Lavender
千葉,00:27:14:08,00:27:21:17,それからベッコーマイマイっていうベトナムなんかにいる東南アジアのベッコーマイマイの中には足の先がビューッと伸びて,Lavender
千葉,00:27:22:22,00:27:34:18,ちょうどオオトカゲとかゴジラみたいに尻尾を振って敵が来たりすると攻撃するじゃないですかあんな感じで敵がやってくると尻尾を振ってゴジラみたいに振って,Lavender
千葉,00:27:38:00,00:27:47:08,さらに、沖縄にいる別甲前々の仲間なんですけども、その足の先を使ってジャンプする。,Lavender
東島,00:27:49:08,00:27:51:10,機能的には尻尾ですね,Violet
千葉,00:27:52:20,00:27:54:10,全然違う,Lavender
千葉,00:27:55:15,00:27:59:05,でも尻尾として機能するだから,Lavender
千葉,00:28:01:20,00:28:07:13,多分発生学的な意味での尻尾とそういう機能的な尻尾ってある,Lavender
東島,00:28:10:08,00:28:17:10,できると思います。結局人間側というか我々側がどう定義するかでどこで切るかというのが変わってくるんだと,Violet
千葉,00:28:20:02,00:28:27:00,東島さんの研究としてはそういうふうに尻尾を広く捉えるっていうのもあるわけですか,Lavender
東島,00:28:27:08,00:28:41:00,そうですね将来的にはと思うんですけどあまりにも生き物全部の尻尾全部の定義ってやると膨大すぎて一生が足りないのでとりあえずは脊椎でっていう風に切ってるとこはあるんですけどでも興味はあります機能的な尻尾とか,Violet
東島,00:28:44:10,00:28:46:05,やってみたいなとは思ってるんですけど,Violet
千葉,00:28:49:05,00:28:51:13,直接の,Lavender
千葉,00:28:52:15,00:28:55:08,祖先で尻尾のあるグループというのは何?,Lavender
東島,00:28:56:05,00:29:06:18,猿に近いですかねオナガザルジョーカといういわゆる普通のモンキーとエイプの共通の先祖までは尻尾が生えていたので一番近いのはモンキーですかね,Violet
千葉,00:29:06:22,00:29:12:18,そのモンキーの持っている尻尾の機能というのは一般的に何だと考えられているんですかね,Lavender
東島,00:29:12:20,00:29:16:02,やっぱりバランス維持とか運動でしょうかね,Violet
東島,00:29:21:13,00:29:27:20,地面の上にいるときはあまり何に使っているのかわからないんですけど長ければ社会的なシグナルとしてそれが機能します,Violet
東島,00:29:29:05,00:29:38:02,あとはすごく速く走るやつだとカーブを曲がる時とか方向転換時にギュッと振ったりして素早く身をかわしたりとかそういう感じで使う,Violet
千葉,00:29:42:05,00:29:44:08,人間で尻尾の生えた人,Lavender
千葉,00:29:45:10,00:29:50:00,まさに悟空みたいに人間で尻尾の生えた人っていう話がよくあります,Lavender
千葉,00:29:51:05,00:29:53:13,も紹介されてますけどもあれは,Lavender
千葉,00:29:54:18,00:29:56:05,尻尾ではない,Lavender
東島,00:29:56:08,00:30:10:21,ではないんです、残念ながらあれ大体はですね、なんか柔らかい脂肪しか入ってなかったりとかあとはなんか繊維性のものが入ってるぐらいで動かすことはほぼできないはい、すっごく稀に動かせる人がいるんですけど,Violet
東島,00:30:10:21,00:30:25:10,これは肛門の筋肉の繊維が一部 迷入していてそれで動くっていうかお尻を締めれば動くっていうまあ変なやつですね肛門の形成不全の場合はそういうのがあるんですけど多くの場合はだいたい死亡臭とかです腫瘍です,Violet
千葉,00:30:25:23,00:30:37:23,発生学的な仕組みで遺伝的な何かしらの変異で尻尾の発生に関わっている遺伝的な変化でそれが起きたというわけでは,Lavender
千葉,00:30:38:22,00:30:52:00,要は骨がないということですかね骨も筋肉もないということなんですねだから尻尾の定義ここで扱っている哺乳類の尻尾の定義からは外れているからあれは違うんだ,Lavender
東島,00:30:52:10,00:31:02:18,そうですそうです解剖学的な定義に当てはまらないっていうのとあとはその微部退宿っていうのが発生過程で人がしこなくすんですけどその異常っていうのがあっても,Violet
東島,00:31:02:18,00:31:13:00,良さそうなものなんですけど私、京都にいっぱい1杯のコレクションがあって4万点ぐらい全部であるんですけどざっと見て、そういう1杯の微分退宿以上っていうのが一例もないんです,Violet
東島,00:31:14:18,00:31:21:20,あまりにもないので、やっぱりこの結構発生の根幹的なところには関わっているんじゃないかなとは考えています。,Violet
千葉,00:31:23:05,00:31:31:23,ただ昔からそういう人がいたということは知られていてそういうのは歴史にたくさん残っているわけですよね,Lavender
千葉,00:31:33:03,00:31:34:20,それはなぜ,Lavender
千葉,00:31:35:23,00:31:52:12,多分そういうのが残っているということはやっぱり何かしら引きつけるものがあったんですよね魅力かもしれないけど何かしら引きつけるものがあったんですよねそれはどういうふうに捉えられてきたんですかね要するに人々はそういうのをどういうふうに捉えられてきたんですか,Lavender
東島,00:31:54:00,00:32:05:17,それは結構面白くて時代によって様々だと思います背景にあるのは宗教観が大きいんですけどそれが好ましいって捉えた時代と好ましくないって捉える時代地域っていうのがあります,Violet
東島,00:32:06:18,00:32:10:00,今の日本だとやっぱり手も耳っていうんですか耳をつけたり尻尾,Violet
東島,00:32:11:00,00:32:24:22,好ましいものとして捉えるんですけど例えば古代のギリシャローマだと神様にヤギの尻尾とかヤギの耳を生やすっていうのがあるんですお酒の神様でいいものなんですけどキリスト教が入ってくると一気にダメなもの,Violet
東島,00:32:27:13,00:32:30:05,悪魔には生えているもので天使にないので,Violet
千葉,00:32:30:20,00:32:37:13,見方というか使い方それから捉え方が時代文化によってガラッと変わるということ,Lavender
東島,00:32:37:15,00:32:45:00,そうですそうです一方でヒンドゥー教だと逆にそのヒューマンテイルって1000点以上が出ても親が切らないでくれって言うんですよ,Violet
東島,00:32:46:00,00:32:52:02,それはハヌマーンという猿の形をした神様がいて神の化身であると考えて縁起がいいから着るな,Violet
東島,00:32:53:03,00:32:57:05,いうふうに言われる地域とか時代によって本当にバラバラなんです,Violet
東島,00:33:01:00,00:33:10:22,現在だと日常生活に差し触ったり患者さんのあいつ生えてるでなんかってなるのでやっぱ着るのが多いと思います,Violet
東島,00:33:12:15,00:33:28:12,多くの場合、死亡種の中に脊髄の形成不全とか脊椎の方の形成不全が関わっていることが多いので、手術しておいた方が差し障りがないというか、患者さんのその後の人生には良いと言われています。,Violet
千葉,00:33:29:03,00:33:30:18,なんていうか、そういうのは…,Lavender
千葉,00:33:32:12,00:33:35:05,今だとそういう機能的な,Lavender
千葉,00:33:36:15,00:33:42:15,生活上のメリットとかそういった点でいろいろそこは対処するわけでしょうけど昔の人は,Lavender
千葉,00:33:43:15,00:33:46:18,時代によってはすごく尊いものというか聖なる,Lavender
千葉,00:33:47:17,00:33:49:20,ありがたいものというような捉え方をしたこともある,Lavender
千葉,00:33:52:08,00:33:58:18,で、藤島さんは、その尻尾以外でも、そういうふうに、歴史上、そういうふうに非常にユニークな。,Lavender
千葉,00:34:00:05,00:34:02:10,特徴を持って,Lavender
千葉,00:34:06:05,00:34:10:20,そういう性質っていうんですかね 人のそういう性質っていうのも,Lavender
千葉,00:34:11:23,00:34:15:23,ここもちょっと調べながら研究されてますよね,Lavender
千葉,00:34:17:05,00:34:20:10,これは尻尾から発展した話なんです,Lavender
東島,00:34:20:15,00:34:35:23,そうですそうです。元はというと、尻尾が生えた人っていうのは生物学的にはなかなかありえない記述であるにもかかわらず出てくるので何かなって調べて、一番古いのは何かなと思ったら日本書紀に書いてあったなって思い出して、日本書紀を読み直した。,Violet
東島,00:34:37:00,00:34:47:20,そしたらそもそも1000点以上の研究っていうのがあんまり近年にならないとやられてないってことに気づいて古代の日本でもあるんじゃないかなと思ってもう一回調べてみて,Violet
東島,00:34:50:18,00:34:53:10,尻尾が生えた人2人出てくるんですよ日本初期に,Violet
千葉,00:34:53:23,00:34:55:13,だから要は古文書と,Lavender
千葉,00:34:56:12,00:34:59:20,遺伝学の融合研究ですねそうですねあるいは医学,Lavender
東島,00:34:58:12,00:35:01:13,そうですねあるいは医学そうですね,Violet
千葉,00:35:04:18,00:35:09:23,そういうコンセプトはすごく僕は大好きで僕も実は,Lavender
東島,00:35:06:20,00:35:09:05,よかったです,Violet
千葉,00:35:11:18,00:35:23:03,日本史の専門家の人と協力して古文書を使ってヤンモリがいつ日本に中国からやってきた日本が人間が運んで,Lavender
千葉,00:35:23:03,00:35:34:12,生き物なんですけど それがいつ日本にやってきてどういうふうに広がっていったかということ古文書とゲノムレベルの分析から得られる,Lavender
千葉,00:35:35:18,00:35:37:18,推定年代,Lavender
千葉,00:35:38:20,00:35:43:03,クロスチェックすることによって調べているんですけど古文書を稼ぎ代わりに,Lavender
千葉,00:35:44:22,00:35:47:20,小紋状って難しいじゃないですか,Lavender
千葉,00:35:48:22,00:35:51:15,僕は読めないんですよ読めないです読めない学生は読める,Lavender
千葉,00:35:52:15,00:35:54:22,学生は読めて小文字が趣味ですとかいう,Lavender
東島,00:35:55:10,00:35:57:20,だいぶ変わってますね,Violet
千葉,00:35:58:00,00:36:03:23,日本史の先生がいるからその人にちょっと指導はしてもらう,Lavender
千葉,00:36:07:00,00:36:10:15,あれ読めないんですよ なぜやっぱりそこは訓練が,Lavender
東島,00:36:11:03,00:36:13:03,クルネに必要ですトレーニングがいります,Violet
東島,00:36:14:22,00:36:28:12,そうですね、なんかあれは面白いのが古文書って基本ハンドコピーなんですよなので写し間違えてたりとか肝心の字だけ虫食いでやられてたりとかするのでいろんなこのハンドコピーを集めてきて読み合わせというか見合わせて,Violet
東島,00:36:28:12,00:36:42:02,この人写し間違えてるからこの人以降はみんな間違えてるとかそういうのを見ていくんです系統というか古文書の系統があって何々家が持ってる系統とかそこでまた文家が出てきてここでまた写し間違えてるとか,Violet
東島,00:36:45:10,00:36:48:22,そうです、そうです。だから、古文書も系統書が書けると…,Violet
千葉,00:36:49:00,00:36:58:00,なるほど変異があって写してコピーしてコピーの間違いがあってで間違えたやつがそのまま受け継がれてまさに進化,Lavender
東島,00:36:58:08,00:36:59:23,そうなんですよたまにミューテーション入る,Violet
千葉,00:37:04:08,00:37:23:04,そういう共通点があるのは僕はね誰かと誰かの間の共通点は何かとか生き物と生き物の共通点は何かとかそういうことを考えるのが割と好きでそうすると一般性って見つかるじゃないですかそれまではある生き物をすごくこう,Lavender
千葉,00:37:23:04,00:37:42:00,特殊な性質だなと思っていたのが実はそうじゃなくてどんな生き物あるいは人 すべてに共通する何かあの普遍的な仕掛けがあるみたいなそういったことが分かったりするとなんか綺麗美しいと思うので なんで美しいのかわからないけどなんか,Lavender
東島,00:37:41:00,00:37:43:13,なんかすっきりしますね,Violet
千葉,00:37:46:10,00:38:00:22,だからそういうのを探すのが好きなんですけど実は東島さんの尻尾の研究人の尻尾の研究人に限らずですかね主に哺乳類ですか尻尾の研究で骨を,Lavender
千葉,00:38:02:02,00:38:04:22,尻尾の骨 あの特にサル,Lavender
千葉,00:38:09:05,00:38:11:00,博物館でヨーロッパに,Lavender
千葉,00:38:12:10,00:38:16:00,2時間に行って並べて全部片っ端から,Lavender
東島,00:38:16:18,00:38:18:08,そうです測って,Violet
千葉,00:38:17:13,00:38:26:05,測って比較するっていうことをやっておられますよねあれは大変な作業だと思うんですけど,Lavender
千葉,00:38:27:08,00:38:29:10,貝なので貝殻なんですよ,Lavender
千葉,00:38:31:05,00:38:36:05,骨じゃなくて貝。貝は骨を持っていなくて。ただよくよく考えてみると、,Lavender
千葉,00:38:39:05,00:38:43:23,貝は外骨格なので骨が外側にある,Lavender
千葉,00:38:45:03,00:38:49:20,で、哺乳類なんかは骨が内側にある、それが外側にある,Lavender
千葉,00:38:51:03,00:39:03:10,そう考えると、僕らもよく貝殻をいろんなところを時にはちょん切ったり、あるいは色々と写真撮ったりいろんな物足を測って、形がどこ違う,Lavender
千葉,00:39:04:10,00:39:07:13,細長くなったのか平たくなったのかってことをやったり,Lavender
千葉,00:39:09:03,00:39:17:05,面白いのはさっきお話したウイントって尻尾のところに関わってるあの遺伝子なんですけどあれって貝では,Lavender
千葉,00:39:20:02,00:39:31:03,初期発生の体の後ろ側のところに関係するだけじゃなくて実は貝殻にも関係しているんです,Lavender
千葉,00:39:32:08,00:39:42:08,だからウィントの発現量を変えると貝殻の形が変わっちゃうんですよ細長く密に巻いたり真長く変な形になる,Lavender
千葉,00:39:44:00,00:39:55:20,だから実は人の尻尾に関係する猿の尻尾に関係するあるいはネズミの尻尾に関係する遺伝子って僕らがやっている会では貝殻,Lavender
千葉,00:39:58:15,00:40:00:12,実のところ、尻尾の骨の…,Lavender
千葉,00:40:01:13,00:40:06:20,計測するというのと貝殻を計測するというのはかなり共通のことをやっている可能性が,Lavender
東島,00:40:07:00,00:40:09:08,本当ですね,Violet
千葉,00:40:09:15,00:40:11:18,そういう結構似たような,Lavender
千葉,00:40:13:10,00:40:16:02,ある種のコンセプトで,Lavender
千葉,00:40:20:00,00:40:27:08,捉えることができるかもしれないなしっぽがどこまで拡張するとしっぽがなくじゃなくなっちゃうかもしれないけど,Lavender
東島,00:40:24:12,00:40:28:20,空になっちゃいますね,Violet
千葉,00:40:28:22,00:40:35:08,尻尾額を発展させることで、そういう近隣の領域との視野が広まる。,Lavender
千葉,00:40:36:10,00:40:44:05,違う分野との視野が広まって、新しい別の解釈なのかな、考え方というのが生まれたりする可能性があるのかなと思っています。,Lavender
東島,00:40:44:10,00:40:48:15,まさか殻作りにまで活かせるとは思わなかったですすごいですね,Violet
東島,00:40:49:23,00:40:52:20,ウィントそんなところに効いてるんですね,Violet
千葉,00:40:52:05,00:41:04:10,そうなんですよ意外なんですけどただもちろん貝の研究って哺乳類だとか昆虫みたいにすごく進んでいるわけではなくて特にゲノム読むのが全ゲノム読むのがとっても難しい,Lavender
千葉,00:41:05:18,00:41:12:18,だから繰り返し配率がいっぱいあったり複雑な構造をしていてなかなかそれが難しくてそれが障壁になっていて,Lavender
千葉,00:41:13:23,00:41:25:03,ずっとなかなか進まなかったんですけどようやく最近いろんなことが読めるようになっていろんな軟体動物でもいろんなものが読めるようになってようやく,Lavender
東島,00:41:17:23,00:41:19:23,あ、読めたんですね。,Violet
千葉,00:41:26:10,00:41:36:03,理解が深まってきたので 実は全然違う生き物実は尻尾に関わっている何か多くの遺伝子が,Lavender
千葉,00:41:38:12,00:41:43:15,一方じゃないかもしれないけど 貝殻の重要な機能に関わってたりということってあるかも,Lavender
千葉,00:41:48:18,00:41:50:18,買える医学大きく買える,Lavender
東島,00:41:50:03,00:41:53:03,そんな,Violet
千葉,00:43:11:23,00:43:14:08,言いたい放題言ってるんですけどね,Lavender
東島,00:43:27:08,00:43:30:05,めっちゃうまいんですよ,Violet
東島,00:43:50:15,00:43:53:07,そうですね、さっきまで鳩がいたのに鳩もいなくなったんです。,Violet
東島,00:43:58:10,00:44:00:15,噴水も止まるし,Violet
東島,00:44:01:15,00:44:05:20,なんもないんですよ 人間しかいてないんですよ,Violet
東島,00:44:12:03,00:44:17:13,いや本当に人間しかいないんですよねさっきいたのに全部どっか行きましたね,Violet
東島,00:44:30:15,00:44:34:00,鳥の話は冒頭で山鳥したからいいかなと思ってた,Violet
東島,00:44:35:20,00:44:39:13,いや全然わかんないです私陸上の哺乳類が好きです,Violet
千葉,00:44:39:17,00:44:42:05,ああ、ネズミ何が一番好きですか?,Lavender
東島,00:44:42:15,00:44:45:20,私最近一番好きなのはモルモットででもしっぽないんですよね,Violet
千葉,00:44:46:00,00:44:49:23,尻尾のあるのとまた僕が回しちゃうって言うけどいいです,Lavender
千葉,00:44:51:00,00:44:53:20,だってお話聞くの面白いんだもんだって遠島さんが,Lavender
千葉,00:44:54:20,00:45:01:10,東島さんの話が面白いから聞きたくなっちゃうじゃないですか僕の話しても面白くないんだもんだって面白いですよ,Lavender
東島,00:45:00:00,00:45:02:00,面白いですよ面白いですよ,Violet
千葉,00:45:02:15,00:45:05:10,やっぱりね面白いことやってる人の話を聞きたい,Lavender
東島,00:45:05:23,00:45:08:00,ねえもうしゃべりましょう,Violet
千葉,00:45:08:10,00:45:15:17,尻尾のあるモルモットみたいに尻尾のあるのとハツカネズミみたいに尻尾のあるやつとどっちが尻尾のあるのか,Lavender
東島,00:45:16:20,00:45:26:03,私最初は尻尾がある方が好きだったんですよ。でももろもっと見てないのもいいかもって思ったんです。だから人に尻尾がないから、人はあんまり好きじゃないからちょうどいいやって思ったんですよ、研究するの。,Violet
東島,00:45:27:03,00:45:36:20,と思ったんですけど人が知りたくてやってるから結局人に興味はあるんですけどあんまり思い入れが強い動物って実験すると良くないかなと思って,Violet
東島,00:45:37:23,00:45:40:10,愛で歪まないかなって思ったんですよ,Violet
千葉,00:45:40:22,00:45:42:15,よくそういう人いますよね,Lavender
東島,00:45:45:05,00:45:46:22,ほどほどがいいかなと思ったんです,Violet
千葉,00:45:46:22,00:45:53:10,それね同じ僕もねそう 片つむり好きじゃないって言うかねなめくじ大嫌いだし,Lavender
東島,00:45:48:05,00:45:51:05,片つもりそんなに多い?片つもり好きじゃないです好きじゃないです,Violet
東島,00:45:52:12,00:45:54:15,殻がないからとかそうやっぱ,Violet
千葉,00:45:54:15,00:46:02:00,だってそうでしょ だって 片つむりはね 殻があるから許せるだけど 殻がないって ありえないじゃないですか,Lavender
東島,00:45:57:20,00:46:00:03,だけど,Violet
東島,00:46:01:10,00:46:03:15,ありえないですね,Violet
千葉,00:46:03:07,00:46:07:00,だってその辺の人がね ここたくさん人歩いてるけどはい服着てるから,Lavender
千葉,00:46:08:00,00:46:14:03,まあ見ていられるんだけど みんな服脱いちゃったら見ていられないでしょうわーってみんな逃げちゃうでしょ それと同じ,Lavender
千葉,00:46:19:15,00:46:24:00,カラーがあるから見ていられるナメクジがダメだからだからカタツムリが,Lavender
千葉,00:46:25:00,00:46:30:12,殻があるから許せるだから別に特別片爪が好きだからというわけじゃないんです僕が好きなのは昆虫なんです,Lavender
東島,00:46:30:20,00:46:34:03,ああ外骨格ですねめちゃくちゃ,Violet
千葉,00:46:33:07,00:46:46:10,そうそう外骨格という意味で同じだけど 昆虫は割とメカニックだからでもなぜ好きかって言われても困るんだけど 昔から好きだったんで,Lavender
東島,00:46:45:13,00:46:48:12,そうなんですね 虫捕り少年やったんですかそうです,Violet
千葉,00:46:47:20,00:46:49:07,そうです。虫とね。,Lavender
東島,00:46:53:10,00:46:55:07,ああ、漫画はいいですね。,Violet
千葉,00:46:58:18,00:47:01:20,虫の研究者になるかどっちかという,Lavender
千葉,00:47:03:05,00:47:17:05,そうそうそれでそれでその通りでだけどその割と子供の頃からその世の中をあの 賢く見ていてで漫画家とか昆虫の研究者っていうのはあの,Lavender
東島,00:47:12:00,00:47:13:15,漫画家,Violet
千葉,00:47:22:00,00:47:28:03,リスキーだとするとこれに挑戦するには一番いいポジションは医者だと思って,Lavender
東島,00:47:28:05,00:47:31:00,完全に手塚治虫をする,Violet
