Speaker Name,イン点,アウト点,文字起こし,色選択
千葉,00:47:30:10,00:47:36:12,それは手塚治虫のことを知ってたからっていうのもあるけどなるほど医学部に行くはずだ,Lavender
東島,00:47:36:18,00:47:38:12,ああああああ,Violet
千葉,00:47:37:23,00:47:46:00,でもね当時はね今と違うんですよ大学のね僕は私立行けるほどお金持ちじゃなかったから国立大学しか行けないから,Lavender
千葉,00:47:47:05,00:47:54:20,当時は今と違って試験って1回しか受けられなかったんです今2回あるでしょ確かに1回失敗しても次に頑張れば何とかなるけど今1回勝負なんです,Lavender
千葉,00:47:58:05,00:48:01:07,3回目に日が変わって,Lavender
千葉,00:48:02:15,00:48:05:00,なぜか気が変わって医学部に行かなかったので,Lavender
千葉,00:48:06:08,00:48:08:03,満減罪に至っちゃったんですけど,Lavender
千葉,00:48:09:10,00:48:11:03,いや、たぶんね、あの…,Lavender
千葉,00:48:12:08,00:48:14:15,今の若い人に言いたいのは医者になり,Lavender
千葉,00:48:17:20,00:48:27:13,やっぱりね お医者さんになるには東島さんはお医者さんとの医学の研究をされているからよくご存知だと思いますけどやっぱり人の命を預かうんだから,Lavender
千葉,00:48:28:12,00:48:30:03,横縞な気持ちになるのは良くない,Lavender
東島,00:48:31:17,00:48:36:20,それはでもめっちゃ言いたいですねめっちゃ言いたい安牌でエラバン取ってくれ,Violet
千葉,00:48:37:15,00:48:39:15,これで良かったんだと自分は思って,Lavender
千葉,00:48:41:03,00:48:44:12,あともう一つは本当にお医者さんになりたいんだったら,Lavender
千葉,00:48:48:00,00:48:57:07,難しい大学にあるいは評判のいいというか難しい入るのに難しい大学なんか行かずに少しでも早くお医者さんになる,Lavender
東島,00:48:57:15,00:48:59:05,ああ確かに,Violet
千葉,00:49:00:05,00:49:06:20,余計なことは考えた方がいいですよ人を救うことの方が大事だから全然関係ないことを言ってしまったんだけど何を言うよ,Lavender
東島,00:49:08:05,00:49:10:03,あれですよ虫が好きだ,Violet
千葉,00:49:10:12,00:49:23:17,そうだそれで虫が好きだって結局でも今考えてみると昆虫は今研究してないんですよね学生はやったりしてましたけど僕自身は昆虫やってなくて大学に入っていろいろとあってもう説明すると長くなるから全部省略して,Lavender
東島,00:49:24:00,00:49:28:03,そこを多分喋らなあかんとこなんじゃないですか,Violet
千葉,00:49:27:03,00:49:31:20,いろいろあったんで結局なんだかんやあって,Lavender
千葉,00:49:33:03,00:49:36:15,現在に至って会議の,Lavender
東島,00:49:38:08,00:49:42:08,歌を片つむりの本の中の早見先生との出会いがめっちゃ面白かった,Violet
千葉,00:49:42:15,00:49:49:10,偶然ですよねそれは東島さんも同じで随分偶然がいろいろと左右してますよね,Lavender
東島,00:49:47:20,00:49:49:17,そうですね,Violet
千葉,00:49:50:15,00:49:52:18,まあなんだろうな人生って結局,Lavender
千葉,00:49:53:23,00:49:55:15,地雷源を,Lavender
千葉,00:49:59:10,00:50:09:13,いつ地雷に足突っ込むか分からないんだけどそこを運良く突破できるだけど思うに一番大事なのって,Lavender
千葉,00:50:10:15,00:50:18:05,地雷に引っかかった時、つまり一種の負け戦ですよね。負け戦をどう切り抜けるか、これが多分大事だと思うんですよ。,Lavender
千葉,00:50:27:10,00:50:40:04,あの nhk の nhk だから言うんだけどあの つい最近あのあのね秀吉やってるじゃないですかあれですつい最近ですね金ヶ崎の戦いの 話があって浅い朝倉の,Lavender
千葉,00:50:40:04,00:50:52:22,攻撃を受けて織田の奥の中に逃げてくるんですよねそうするとその心狩りを秀吉が俺がやる私がやりますとか言って秀吉がそれを担当してでうまく,Lavender
千葉,00:50:53:23,00:50:55:10,信長の,Lavender
千葉,00:50:58:18,00:51:04:00,このおかげで信長は逆襲できたわけだけど要するに真狩りが,Lavender
千葉,00:51:05:07,00:51:16:00,廃却する時に芯刈りがどうそこでうまく対処するかってことが実は勝つために一番大事なことだってことがあれで分かる,Lavender
千葉,00:51:17:00,00:51:19:10,で、ヒンガリって結局何かっていうと尻尾なんですよ。,Lavender
東島,00:51:21:23,00:51:24:03,そうですよ。戻ってきた。,Violet
千葉,00:51:25:20,00:51:31:15,傾向牛語っていう言葉を子供の頃から周囲の人に聞かされてきて大嫌いな言葉だった,Lavender
千葉,00:51:33:00,00:51:49:13,いやいいと思いますよそのコンセプトは分かるんだけどでもそれを動物の鶏の口と頭か口かそれと牛の尻尾でなんか比較するっていうのはアナロジーとして不適切ではないかと,Lavender
東島,00:51:41:03,00:51:43:05,あったんですか?はい、口,Violet
東島,00:51:49:15,00:51:51:07,真面目にはい,Violet
千葉,00:51:51:13,00:52:01:17,だって尻尾って重要な機能を持ってるわけでしょで、東島さんも本の中で書いてましたよね人は正面から見たときには何か関心があるけど後ろから見たときにはあんまり関心がない,Lavender
千葉,00:52:04:22,00:52:19:20,後ろが大事なんですよ 融合が大事なんですよ今はみんなやたらにリーダーシップが大事ですとかね研究者でもとにかくリーダーシップを取ってやれる人を採用しましょうとかね会社でもリーダーシップをみんな持ってなきゃいけませんという,Lavender
千葉,00:52:19:20,00:52:34:18,大事な 要するに尻尾の役割というかあの 撤退戦があった時に心狩りを務めるような その見えないところで一番重要な役割を果たすような 負け戦をとにかく抑える,Lavender
千葉,00:52:35:17,00:52:46:20,そういう人材って実は今一番大事だと思うんですよ要するに尻尾の役割を敵がやってきた時に自節するとかやっつけるとか偽然なってだけど,Lavender
東島,00:52:43:07,00:52:45:23,犬犬になってる,Violet
千葉,00:52:47:23,00:52:52:05,そういう…いや…あれも大事です自説はやめた方が良かったかな,Lavender
東島,00:52:52:05,00:52:54:12,いやいいですいいですしんがりねしんがりが,Violet
千葉,00:52:54:20,00:52:58:22,役割っていうかね見えないところで 重要な役目をするっていうねそういう,Lavender
千葉,00:53:00:00,00:53:04:22,そういう牛語の役割をする人がね、とても望まれていると思うんですよ。,Lavender
千葉,00:53:10:00,00:53:15:13,尻尾はとても大事 いやみんなやたらにねあの頭目だとかから頭だとか,Lavender
千葉,00:53:16:12,00:53:18:12,脳だとかそういったことの研究ばっかりするんだ,Lavender
千葉,00:53:19:20,00:53:24:00,ちゃんと尻尾も研究すべきだとそうなんですどうですかいや本当にすごい,Lavender
東島,00:53:22:00,00:53:29:07,そうなんです。本当そう思います。私は今いるのが教授の研究室が脳の研究室なんで負けずに。,Violet
東島,00:53:30:08,00:53:33:10,いやいやいいんです私ノアはみんなやりすぎやと思ってます,Violet
千葉,00:53:34:22,00:53:37:03,いや脳大事だし脳はとても,Lavender
東島,00:53:37:05,00:53:46:05,はい、大事です。脳があるから尻尾のこと考えられるので脳は大事です。はい。そうですよね。はい。,Violet
千葉,00:53:42:12,00:53:45:07,そうですよね,Lavender
東島,00:53:52:18,00:53:56:15,その後噴水がやっと出ましたやっと出ました,Violet
東島,00:54:00:20,00:54:05:23,でも噴水で特に語るべきことがないんですよね,Violet
東島,00:54:10:12,00:54:16:12,私噴水より日本の庭園の方が好きですでも面白いから見てるのは好きです,Violet
千葉,00:54:18:10,00:54:22:10,ヨーロッパの庭園はどれですか?ここはどっちかというと日本の庭園です。,Lavender
千葉,00:54:24:03,00:54:28:05,ヨーロッパのイギリスとかのなんていうんだろう,Lavender
千葉,00:54:29:17,00:54:33:00,ブリティッシュガーデン,Lavender
東島,00:54:35:13,00:54:39:07,どこを見たらいいのかがわからないんですよね,Violet
東島,00:54:40:15,00:54:49:17,花なのか、この花を見ればいいのか、作りを見ればいいのか、どこ見たらいいのか分からないプレゼンみたいな感じ。,Violet
千葉,00:54:50:12,00:54:59:00,ブリティッシュガーデンにもいろいろあって多分一部は日本の影響を受けてるんですよね19世紀かな,Lavender
千葉,00:55:00:12,00:55:05:13,割と自然昔はフランスの,Lavender
千葉,00:55:06:20,00:55:14:22,フランスのよくある気化学的なああいう典型的なヨーロッパ型の給電が有名だったんだけど,Lavender
千葉,00:55:15:23,00:55:17:17,そのうちイギリスでは,Lavender
千葉,00:55:20:15,00:55:24:12,あまり人が手を入れない形の庭園という,Lavender
千葉,00:55:25:15,00:55:29:15,だんだん発達していっていわゆるコテージが,Lavender
千葉,00:55:31:07,00:55:33:23,ああいうのが広がっていったんですけど,Lavender
千葉,00:55:35:20,00:55:47:05,あれって割と生態系の考え方というのかな生き物と生き物のつながり捕食者がいるから害虫が少なくなるというようなそういう考え方が結構入っています,Lavender
東島,00:55:48:03,00:55:50:12,なるほどそういう風に見れば面白いんですね,Violet
千葉,00:55:50:15,00:55:56:12,そういう考え方がコテージガーデンの中にはあるんですよねウィリアム・ロビンソン,Lavender
千葉,00:56:06:20,00:56:10:00,意外に目立たないんですけど、目立たないところに…,Lavender
千葉,00:56:11:07,00:56:13:05,とても重要なものがあります,Lavender
東島,00:56:14:20,00:56:16:22,大事なコンセプトですね,Violet
千葉,00:56:17:23,00:56:22:20,みんながあんまりそういう考え方っていうのは当時もあまり人気がなくて,Lavender
千葉,00:56:24:10,00:56:32:03,みんなが見落としてた部分なんですよね自然な姿で人々を楽しませるというのはなかったんですけど,Lavender
千葉,00:56:33:17,00:56:37:23,ここもだからそういうのをもうちょっと取り入れたらいいと思うんですよね。ちょっとあまりにも人工的すぎちゃって。,Lavender
千葉,00:56:39:15,00:56:41:20,ちょっとねこれねあの,Lavender
東島,00:56:43:07,00:56:49:20,でもよく日本ではそういうのがありますよね見た目だけ真似していて結局コンセプトが真似できていないというのはよくありますよ,Violet
千葉,00:56:51:07,00:56:53:00,ああ面白い見かけが,Lavender
東島,00:56:53:13,00:57:11:00,パッと見た感じはよく模倣してるんですけど博物館の展示とか怒られるわとかそうなんですけどこれどこどこの博物館の展示を真似し張ったんやなっていうのが分かる時はあるんですけどその背景にあるこういう風に考えてこれを作ったんやろうっていうオリジナルのそこを真似できてないなっていう時が,Violet
東島,00:57:12:08,00:57:22:08,あったりしてそういうのはちょっと日本に多いなって思っちゃいますなんでですかなんででしょうね読み取れてないのか文化が違うからそこをちょっと理解するのが難しいのか,Violet
東島,00:57:24:22,00:57:40:10,なんか流行りの博物館だと流行りの展示みたいなのがあってこれを置いといたらお客さんが来るだろうみたいなのを多分思って置いてるんだろうなって思う時あるんですけどなんでそこの元の博物館はその並びでそこに置いたのかを多分分かってないな,Violet
千葉,00:57:40:20,00:57:59:07,それは東島さんはヨーロッパの博物館なんかでいろいろと実際に仕事をされてよく知ってご存知じゃないですかそこでの標本の扱い方とか展示の仕方っていうのは当然よくご存知だと思うんですけど日本の今の話ともしかしたら共通するかもしれないけどその日本の博物館なんかの,Lavender
千葉,00:58:00:08,00:58:09:10,骨の扱い方、その捉え方かな、コンセプトか、さっきの考え方からすると、コンセプトか、それはどういう違いがあるんですか。,Lavender
東島,00:58:13:20,00:58:27:00,難しいですね。言語化、自分で言っといていきなり言語化が難しくなりましたけど。なんていうのかな。死んだものとかに対する捉え方が、わりと日本と西洋とで違うなって思う時が。,Violet
千葉,00:58:27:05,00:58:28:18,どういう風に違うんですか,Lavender
東島,00:58:28:03,00:58:46:03,やはり向こうの自然史博物館っていうのはいわゆるトロフィーみたいに取ってきて珍しいものこれを取りましたこれを持っている僕たちはすごいですみたいな感じで置いていることが多いんですけどでもそれを例えば進化の概念でやるときは生物多様性を表現するためにこうするとか,Violet
東島,00:58:46:03,00:59:04:03,秩序を表現するためにこのように並べるとかこれを先に並べるとかそういうのがあるんですけど何だろう日本の方もそういう博物学的な考え方というか物を集めるというコレクションという考え方はもちろんあるんですけど何だろうななんとなく綺麗に見せようと,Violet
千葉,00:59:07:07,00:59:08:22,それは僕も賛成します。,Lavender
千葉,00:59:10:05,00:59:13:05,そんな気がしてたっていうのを言語化してくれましたねそうですか,Lavender
千葉,00:59:14:20,00:59:20:18,っていうのが やっぱりそうなんだっていうあのなんだろう 多分もしかしたら自然史っていう言葉,Lavender
千葉,00:59:22:03,00:59:29:15,ミュージアムと例えば博物館 博物学って英語だとナチュラルヒストリーじゃない,Lavender
千葉,00:59:30:22,00:59:36:20,だけどナチュラルヒストリーって日本語に訳すと自然史って自然の歴史みたいに訳すじゃないですかそうすると,Lavender
千葉,00:59:44:22,00:59:47:20,植物館っていうのって要するに,Lavender
千葉,00:59:52:15,00:59:57:15,で、あれってそもそもナチュラルヒストリーって 宗教的なものでしょう要するに神がつく,Lavender
千葉,00:59:58:18,01:00:01:17,世界の秩序それを,Lavender
千葉,01:00:02:18,01:00:08:03,実際にそれを記述するそれを集めるそれが博物館の仕事それがナチュラル必須,Lavender
東島,01:00:05:17,01:00:07:05,そうそうなんです,Violet
千葉,01:00:09:07,01:00:17:07,だからヨーロッパはそういうスタイルになってるんだけど日本の場合にはそういう考え方がないので要するにミュージアムとそれから,Lavender
千葉,01:00:19:00,01:00:24:20,博物館がある意味混同されて見せるものになっちゃってる,Lavender
千葉,01:00:26:00,01:00:36:15,だから入館料をもっと上げろとかお客さんもっと入れろとかもっとみんなが喜ぶようなアピールするような面白い企画をやれとか言って館長が騒いだりするわけです,Lavender
東島,01:00:39:13,01:00:46:10,エクスティビジョンとアレンジメントの違いがついてないところがたまにあったりするのでちょっとなって思うときは,Violet
千葉,01:00:46:03,01:00:53:15,だからデータを集める資料を集めるその大事さというのが多分きちんと理解されていない,Lavender
千葉,01:00:56:12,01:01:09:10,研究者が何か例えば僕も実は貝を博物館に行って実際骨であれでかなり共感したんですけど博物館僕の場合は割とあの科学国立科,Lavender
千葉,01:01:10:10,01:01:21:20,たくさんの貝の標本があるので、そこに行って、1日中いろんな貝の高さとか幅とか測ったことがあるんですけど、貝の進化の研究でやったことがあるんですけども、,Lavender
千葉,01:01:24:08,01:01:43:00,だから博物館にはそういうすごく重要なデータベースデータの保存庫としてのすごく重要な科学的な意義があるんだけどそれをただ見せるだけのものというふうに捉えてしまうとそういう博物館が持っているすごく重要な機能が失われてしまう,Lavender
東島,01:01:42:00,01:01:43:20,そうですね,Violet
千葉,01:01:45:10,01:01:46:22,そういう部分があると思うんですよね。,Lavender
千葉,01:01:48:03,01:01:50:03,だからまあだいぶ,Lavender
千葉,01:01:51:03,01:01:52:22,最近は変わってきているんだけど,Lavender
千葉,01:01:53:23,01:01:57:15,まだちゃんとそこのところが分かっていなくてもっと収益を上げろという,Lavender
千葉,01:01:58:15,01:02:04:03,そういう風な方向に行ってしまうのは、あまり科学の発展にとっては好ましいことではない。,Lavender
東島,01:02:05:17,01:02:08:08,綺麗にまとめてくれありがとうございます,Violet
東島,01:02:10:12,01:02:17:10,千葉さんが集めて貼る貝って色もとりどりだと思うんですけど色とかはどうやって記述し貼るんですか,Violet
千葉,01:02:17:17,01:02:19:13,色はですね昔は,Lavender
千葉,01:02:20:18,01:02:29:03,単純に例えば片つむりであれば色の黒いもの白いもの黄色いもの赤いものピンク色のものとか,Lavender
千葉,01:02:30:03,01:02:37:05,そういうのがあるわけですけど昔は質的に単純に赤色を何段階赤みの強さで,Lavender
千葉,01:02:38:05,01:02:40:18,黒みの強さで段階表示するとか,Lavender
千葉,01:02:44:22,01:02:47:00,写真撮って同じ条件で全部写真撮って,Lavender
千葉,01:02:48:00,01:02:51:23,それで、えーと…,Lavender
千葉,01:02:53:07,01:02:56:08,赤緑青か,Lavender
千葉,01:02:57:07,01:02:59:05,区別して,Lavender
千葉,01:03:01:03,01:03:02:15,シアンか,Lavender
千葉,01:03:06:18,01:03:12:12,何て言うんだっけな忘れたけどもあのいずれにしろもあのフォトショップなんか使うとあの,Lavender
東島,01:03:11:10,01:03:15:23,CMYKみたいなやつですか,Violet
千葉,01:03:15:03,01:03:19:23,違う、そうそう、それです。それで、数値で定量化できるんです。,Lavender
千葉,01:03:21:03,01:03:26:03,これを使って定量化して色の具合、それからの明度,Lavender
千葉,01:03:27:05,01:03:29:23,そういったものを定量化するということをやっています,Lavender
東島,01:03:29:10,01:03:32:12,なるほどそうやったんですね,Violet
千葉,01:03:33:10,01:03:43:03,そうすると昔は客観性に難があったんですけど今はある程度数字で記述できるので便利です,Lavender
東島,01:03:44:08,01:03:58:08,それいいですね。気になっていたのは本を読んだ時に、例えばギュリックが見た、こう思った色と、今の日本人の我々が見て思う色って、虹の色が何色あるかに違うみたいなので、結構難しいなと思っていた。,Violet
千葉,01:03:58:10,01:04:04:15,おっしゃる通りです。表によって違うんですよね、あれね。見え方が違っていて、ある人は赤っていうんだけど、ある人はオレンジ。,Lavender
千葉,01:04:06:00,01:04:08:20,結構ねあれ違うんで客観性に何があるか,Lavender
東島,01:04:09:00,01:04:10:22,なるほど,Violet
千葉,01:04:11:05,01:04:16:15,今はだからそういうスタンダードを決めて表現できるので,Lavender
千葉,01:04:19:07,01:04:21:15,結構貝の色って大事で,Lavender
千葉,01:04:23:00,01:04:24:20,基本的に多くはカムフラージュなんですよ,Lavender
千葉,01:04:25:23,01:04:27:15,だからあの,Lavender
千葉,01:04:28:15,01:04:31:03,木の上に付いていれば黄色くなって,Lavender
千葉,01:04:33:23,01:04:40:18,重要なのって見てるのは彼らの色の機能って人間が対象になってるわけじゃないんですよね,Lavender
東島,01:04:40:18,01:04:43:17,そうですね鳥とか捕食者とか,Violet
千葉,01:04:42:18,01:04:53:17,見てるのは多くは鳥なんですよね木の上にいる片つぶりなんかの場合だから彼らのカムフラージュの対象は人間じゃなくて鳥だから鳥の目で物見ないといけないんですよ,Lavender
千葉,01:04:54:18,01:04:58:10,そうするとご存知のように鳥って人間と見え方がちょっと違うんですよね。,Lavender
千葉,01:04:59:13,01:05:05:13,例えば紫外線も見えたりするわけですよ 多くの鳥はそうすると昔,Lavender
東島,01:05:00:22,01:05:02:15,多くの鳥は,Violet
千葉,01:05:06:12,01:05:26:10,黄色いカタツムリとピンクのカタツムリっていうのがなぜいるのかっていうのがよくわからなくて黄色はカムフラージュに見えるピンクが葉っぱの上にいたら目立っちゃうだろうだからみんな自然洗濯で全部黄色になるはずなのになんでピンクがいるんだっていうことで謎だったんですけども,Lavender
千葉,01:05:28:00,01:05:39:16,割と最近鳥の目をシミュレーションで表現して鳥にはこういう風に見えているはずだカラスだったらこういう風に見えているはずだというのを想定して実際に,Lavender
千葉,01:05:39:16,01:05:51:07,どれだけバックグラウンドの葉っぱの色と殻の色が同じになっているか調べてみるとピンクも黄色もカムフラージュどちらも同じくらい背景に飛んで込む,Lavender
千葉,01:05:52:12,01:06:00:20,人間の目で違うからこいつら何か違うって解釈するんだけどそれは誤りで,Lavender
千葉,01:06:01:20,01:06:06:20,鳥の目で見ないといけない結構私たちって人間中心で物を考えるから,Lavender
千葉,01:06:08:03,01:06:25:05,人間がこう思っているんだから生き物もきっとこういう風になっているんだろうと思うんだけど生き物にとってみたら人間を意識して行動しているとは限らないわけでそうすると実は人間中心で物を考えていく私たちは次考えがちなんだけどもそれは,Lavender
千葉,01:06:26:15,01:06:33:03,いつも気をつけなきゃいけないのはそういうふうに人間中心で物事を考えがちですよということで,Lavender
千葉,01:06:36:18,01:06:46:08,人間を脇に置いて生き物のことを考えるということもしないといけないなということはよく感じるんですよ。,Lavender
東島,01:06:47:00,01:06:50:05,本当に視野を広くですねそうすると,Violet
千葉,01:06:52:18,01:06:56:12,ここがないこれはもうね,Lavender
東島,01:06:53:00,01:06:54:22,あ、戻ってきた,Violet
千葉,01:06:58:05,01:07:01:20,人間じゃない生き物たちから見たらどう見えるのか,Lavender
東島,01:07:03:23,01:07:08:22,やっぱりおかしいなと思うじゃないですかねおかしいと思うんですかはいなんでないんだろうなって思うんじゃないですか,Violet
千葉,01:07:09:03,01:07:13:05,たぶんチンパンジーってないんでしょ?ないですチンパンジーはたぶん変と思わないですよねきっと,Lavender
東島,01:07:13:13,01:07:31:05,きっと ただ そうですね チンパンジーは後ろから見ると性皮がめちゃくちゃ盛り上がって見えるんであれは多分 人間よりお尻見てると思いますこのメスは交尾できるかどうかっていうのが性皮の主張 腫れ具合で分かるんで多分 そうですねゴリラとかだったら人間見てもないなと思うぐらいか,Violet
東島,01:07:32:15,01:07:37:17,人間は意外とお尻を見ていて尻尾あるなしで人か人じゃないかを判断している気がします,Violet
千葉,01:07:38:15,01:07:40:15,そうなんですか,Lavender
東島,01:07:40:15,01:07:52:18,なんかそんな気はしますなんかこうつけた時のあまりにも人に尻尾をつけるっていう表現が多すぎるんで自分と違うっていう表現としてやりすぎっていうかよく使うなっていう,Violet
東島,01:07:54:20,01:07:56:12,を生やした人がいるみたいな,Violet
千葉,01:07:58:00,01:08:01:20,例えば犬なんかだと喜んだりすると尻尾が,Lavender
