Speaker Name,Start Time,End Time,Text
東島,01:11:09:21,01:11:24:18,たまにそういうことを言うあれなんですけど自分は気をつけなきゃなと思いながら読んだんですけど一つに突き抜けるっていうのはいいことかもしれないんですけど若いうちはできるだけ視野広い方が楽しいないろんなことを分かる方が
東島,01:11:34:12,01:11:37:20,興味を幅広く持てる方が楽しい
東島,01:12:40:18,01:12:46:05,そうだね、多分それが普通なんですよ
東島,01:12:49:23,01:12:56:23,森井さんが言ってました、千葉さん最近本を書くスピードがすごい速すぎて追いつけないって、弟子が誰も追いつけないとか。
東島,01:13:00:15,01:13:03:00,すごい
東島,01:13:05:07,01:13:09:10,私だってものはスズメの涙ほどしかありません
東島,01:15:57:23,01:15:59:17,うーん
東島,01:16:01:05,01:16:15:05,結果的にたまたまそうなっているとは思いますけど多分なんかその進化っていう言葉が一人歩きしすぎていてその人の社会の中で本来の意味でのただ変化するとか変化した
東島,01:16:15:05,01:16:29:05,歴史のことを進化と呼ぶはずなのにそれに方向性があるかのように語ったりとかそれに優劣というか古い新しいに優と列をつけるみたいなそういう風潮があるから良くないという話だと思います
東島,01:17:26:05,01:17:27:17,そうですそうですそうでしょ
東島,01:17:47:00,01:17:48:20,それはそうですね
東島,01:18:04:08,01:18:08:18,まあそうですねそういった手がそうだから確かにやむを得ないと思うんですよそうですね
東島,01:18:56:00,01:18:58:05,ああ、そうですね。それはダメです。
東島,01:19:39:03,01:19:42:03,そうですね、確かに。
東島,01:20:02:12,01:20:04:18,ああ、そうですね。
東島,01:20:36:12,01:20:40:03,そうですね。
東島,01:21:00:15,01:21:11:06,自然人類の方ですか?でも自然人類の方も結局やっぱり最初のスタートが人種というところからスタートはしている学問なのですが
東島,01:21:11:06,01:21:21:23,おっしゃるようにやっぱり方向性とか自分が後ろを振り返っているという前提でやっているのでどうしても拭いきれないんですかね
東島,01:21:58:00,01:22:06:03,バリエーションとグラデーションが違うんですけど割とそこがごっちゃになる時があるのでなんて言いますかね
東島,01:22:07:05,01:22:11:03,ランク付けをするようなもんではないんですよね
東島,01:22:45:20,01:22:48:20,気をつけないとなと思っていますいけます?
東島,01:24:10:20,01:24:12:12,はいはいなんか探します
東島,01:24:14:10,01:24:16:00,[HALLUCINATION_FILTERED]
東島,01:24:29:15,01:24:42:08,うーんまあなんでしょうね全体的につまんなくなりそうな気がするんですよねつまんなくなりそうこうまあなんですかねまあまあコロナの影響もあったのかも
東島,01:24:42:08,01:24:55:00,だんだんみんな小さくまとまって冒険をしなくなってだんだん安牌をとるというかそれぞれの対立も深くなっていくのでなかなかつまらない世の中になるなっていうのは
東島,01:24:57:20,01:24:59:23,そうですね、なんか当初効果じゃないです。
東島,01:25:47:05,01:25:49:13,外来所ですか?
東島,01:26:03:20,01:26:05:13,あれはスズメです
東島,01:28:33:18,01:28:48:14,難しいですね。そもそも変えられるのかというところは疑問ではありますね。結局、例えば一部の人間が変えたところで、結局また誰かが繰り返してしまって、歴史がどんどん繰り返されていったみたいに、一つの地域がそれを…
東島,01:28:48:14,01:29:03:10,でもその時それをやらなかった地域が次また同じことをするっていう感じで結局連鎖的に同じことがあちこちで起きていくんじゃないかなというふうには思いますけど最終的にはあんまりこの種は存続できないんじゃないかなというふうには正直思います
東島,01:29:05:05,01:29:19:04,文化人類学的にもどんどん文化というものが画一化されてきて多様性がそれこそ失われていくのではないかなと思います環境への威風とか恐怖とか人間ではどうしようもないというものがあった頃こそ生まれた
東島,01:29:19:04,01:29:33:03,表現っていうのがたくさんあったんですけどそれが全部コントロールできるようになるとただ全部可愛いとか全部その管理できるものに収まってきちゃうのでそういう多様性もなくなってくるでしょうしネットワークが広まっていくこと
東島,01:29:33:03,01:29:47:03,そういうのがまた広まっていくそこから生まれてくるものもあるんでしょうけどなんかこう一旦割と画一化しちゃうのかなってそれに満足できない人がまた何か作っていったらまた変わるのかもしれないです
東島,01:30:01:20,01:30:03:10,なるかなー
東島,01:30:21:10,01:30:32:18,そうですね噴水がすごいポピュラーになってくるとまたそれに満足できない人が自然ってどうだったのかってまたその古文書その当時の古文書とか写真を振り返ると昔は山があったらしいと
東島,01:30:32:18,01:30:44:00,川があったらしいと言ってまた人工的に山とか川を作ってまたそれに満足できなくなった人がまた噴水を作ってという感じで結局同じようなものが何パターンか繰り返されるような気はしなくも
東島,01:33:39:05,01:33:41:10,ああ、わかりました。
東島,01:34:05:05,01:34:13:03,あっはい 東北って解剖医学部解剖に昔人類があったと思うんですけどもうまだ居はるんです
東島,01:34:19:20,01:34:21:20,ああ、メアンデルタル
東島,01:34:24:02,01:34:29:00,そっちの人なんですよじゃあ東大系の人ですかね
東島,01:34:32:15,01:34:34:10,あっそうなんですか
東島,01:35:25:07,01:35:38:00,そうなんですか。私、実は今年から文化進化をちょうどやろうとして、尻尾の文化的な表現を集めてきて、どこから来たのかとかやりたいなと思って、研究費が取れたので、やろうと。
東島,01:35:39:10,01:35:47:15,とりあえず今集めてるんですけど私実はお恥ずかしながら系統樹書いたことがなくてだって書こうかな形質をコード化していくところからやろうと
東島,01:35:49:05,01:35:52:15,それこそ先生にご相談しなあかんかもしれませんどうやってこれ系統順にしたらいいですか
東島,01:36:18:22,01:36:21:03,ああ、はい、縄目ですかね。面白…
東島,01:37:05:15,01:37:08:02,この椅子めちゃ座りにくかったですよね大丈夫でした
東島,01:37:09:05,01:37:11:13,いやなんか申し訳ないなと思って途中で椅子
東島,01:37:38:02,01:37:44:12,小笠原って行ったことないんですけどあれは東京の不当から出るんですか伊豆大島とかに行く
東島,01:37:47:00,01:37:48:20,小笠原丸
東島,01:37:56:00,01:37:57:13,伊豆大島までしか行ったことがない
東島,01:38:12:02,01:38:15:13,あなんか寄生虫がいるやつです農業害虫です
東島,01:38:19:00,01:38:23:05,アフリカマイマイは今世界あちこちにいると思うんですけどあれは誰か持ち出したんですか
東島,01:39:01:20,01:39:06:02,あれは多分M1でほぼ初海外で置いてかれたせいだと思うんですけど
東島,01:39:13:18,01:39:24:08,そうなんですよ。言葉が基本で。ナイロビは英語がいけるんですけど、ナイロビを出たらスワヒリ語じゃないとダメで、スワヒリ語も通じなくなるんですよ。現地語じゃないとダメ。
東島,01:39:26:02,01:39:28:20,でも大丈夫です。言っていることは何パターンか。
東島,01:39:30:08,01:39:35:05,肉を焼くかとかお給料を前借りしたいとか大体そんなことしか言ってない
東島,01:39:59:05,01:40:05:05,なんかお堀屋あったじゃないですかここ来るまでに私こっちから来て川?なんか橋渡ったんですけどああいうとこでもいいかもしれない
東島,01:40:09:20,01:40:12:05,来てたらこっち出そうですけどねめっちゃ
東島,01:40:24:15,01:40:30:12,本に載ってたギュリックの集めたカタツムリの殻みたいなあれボーンってあんなたくさん箱か何かに入ってるんですか
東島,01:40:40:18,01:40:45:15,すごい量写真で出てたんですごいなと思う
東島,01:40:54:00,01:40:56:00,あんなきゃあったら測りたくなりますよね
東島,01:41:02:18,01:41:06:10,そうなんです。形あるものを見るとなんか測りたくなっちゃう。
東島,01:41:10:00,01:41:11:15,変な人多いですね
東島,01:41:14:05,01:41:15:18,おー、確かに
東島,01:41:19:18,01:41:24:15,そうですねホソさんもそうだったそうですホソさんも
東島,01:41:26:18,01:41:31:05,そうですね、ちょっとそうですねとか出すけど、ちょっとおかしいです。
東島,01:41:33:13,01:41:35:23,森井さんが千葉さんによろしくって言ってました
東島,01:41:38:22,01:41:49:05,メールをちょうどやり取りしてて歌う方つもりに出てきたので森井さんの名前が線引いて書いてあるよって送ったらうちの師匠なんですとか
東島,01:41:51:00,01:41:56:20,でなんかメールして今度ラジオでご一緒するよって言ったらなんかなんでとかってメールが来てました
東島,01:42:12:18,01:42:15:05,ああそうですよねニュージーランドがなんか
東島,01:42:19:23,01:42:26:05,ハクビの時に誰かについてアフリカに行ってました
東島,01:43:04:15,01:43:07:05,違わない大学教員は通れないです
東島,01:43:11:15,01:43:17:23,全然関東がわからなくてほぼ関西から出たことがなかったんで
東島,01:43:20:00,01:43:21:23,江戸の知識は全部時代劇から今
東島,01:43:23:07,01:43:25:13,池波翔太郎由来です
東島,01:43:32:15,01:43:35:23,八丁堀っていう地面を見たときびっくりしましたあるんだ本当に
