Filename;Speaker;Start Timestamp;End Timestamp;Transcript
00093_Bmic;Speaker 1;00:00;00:07;"だからなんか新たなコミュニケーション障害みたいなのが出てきてるっていうのが今の時代なのかなっていうふうに思ってますけど"
00093_Bmic;Speaker 2;00:09;00:12;"人間大事にしてそうでしてないってことですね"
00093_Bmic;Speaker 1;00:12;00:12;"そうそうなんですね"
00093_Bmic;Speaker 1;00:14;00:18;"なんかだからすごい抑圧的に"
00093_Bmic;Speaker 1;00:19;00:24;"労働問題としてはだから労働者の人間性が抑圧されている合理化一変とみたいな"
00093_Bmic;Speaker 1;00:25;00:29;"チャップリンが描いたようなそういうところではなくて"
00093_Bmic;Speaker 1;00:30;00:34;"感情が大事ですってなって感情労働でケアしましょうみたいな時代もあり"
00093_Bmic;Speaker 1;00:35;00:38;"でも最近だと本当にもうなんかアンガーマネジメントとか"
00093_Bmic;Speaker 1;00:38;00:42;"いろんな心理的安全性とかいろんなことがあって"
00093_Bmic;Speaker 1;00:43;00:49;"なんかもううまくコミュニケーションしなきゃみたいな圧がすごくなってて"
00093_Bmic;Speaker 1;00:49;00:52;"もう感情邪魔とかもう分かんないみたいな"
00093_Bmic;Speaker 1;00:53;00:57;"どうしていいか分かんなくなっちゃってるみたいなところが多いですかね"
00093_Bmic;Speaker 1;00:59;00:59;"本当に"
00093_Bmic;Speaker 1;01:00;01:00;"なんか"
00093_Bmic;Speaker 3;01:01;01:03;"今の話と"
00093_Bmic;Speaker 3;01:03;01:06;"一方でそれこそトランプだったり"
00093_Bmic;Speaker 3;01:06;01:06;"はい"
00093_Bmic;Speaker 3;01:08;01:10;"政治はむしろ感情を向け出しにして"
00093_Bmic;Speaker 3;01:11;01:13;"ダブルスタンダードとか"
00093_Bmic;Speaker 3;01:13;01:14;"ファインディングみたいな"
00093_Bmic;Speaker 3;01:16;01:18;"ぜひ吉田さんに"
00093_Bmic;Speaker 1;01:18;01:19;"紐を結んだ後に"
00093_Bmic;Speaker 1;01:19;01:20;"紐を結んだ後に"
00093_Bmic;Speaker 2;01:27;01:27;"はい"
00093_Bmic;Speaker 2;01:27;01:30;"非常に外国ってちょっと違う気はしますけどね"
00093_Bmic;Speaker 2;01:30;01:33;"やっぱり欧米あるいは途上国もそうですけども"
00093_Bmic;Speaker 2;01:34;01:38;"一部のマネジメント層とかでは"
00093_Bmic;Speaker 2;01:40;01:42;"マネージャークラスだとそういうアンガーマネジメントとか"
00093_Bmic;Speaker 2;01:42;01:46;"センフコトロールとかということは言われますけども"
00093_Bmic;Speaker 2;01:46;01:48;"もっとダイレクトなので"
00093_Bmic;Speaker 2;01:50;01:52;"これはいつも外国行くと"
00093_Bmic;Speaker 2;01:53;01:56;"僕はもっと身軽になるんですけど"
00093_Bmic;Speaker 2;01:56;01:59;"もっと人間関係がダイレクトなんですよね"
00093_Bmic;Speaker 2;01:59;02:02;"怒ってる人は怒るし悲しい人は悲しいし"
00093_Bmic;Speaker 2;02:04;02:06;"それを表に出すっていうことを"
00093_Bmic;Speaker 2;02:09;02:12;"基本、障害なくみんなやってるし"
00093_Bmic;Speaker 2;02:12;02:17;"日本の薄い被膜にみんなが包まれてるような感じで"
00093_Bmic;Speaker 2;02:18;02:23;"どうしてもダイレクトに相手と繋がれない感じはあるので"
00093_Bmic;Speaker 2;02:23;02:28;"それやっぱり政治のところにも現れていて"
00093_Bmic;Speaker 2;02:29;02:31;"政治家同士で討論会があります"
00093_Bmic;Speaker 2;02:32;02:35;"みんなお互いに喋らないわけです"
00093_Bmic;Speaker 2;02:36;02:40;"いちいち司会が何々さんに質問ありますか"
00093_Bmic;Speaker 2;02:40;02:43;"こういうふうに思うんですけどみたいな感じで"
00093_Bmic;Speaker 2;02:43;02:45;"お互いに直接話してないと"
00093_Bmic;Speaker 2;02:45;02:46;"政治家の討論会が"
00093_Bmic;Speaker 2;02:47;02:49;"なので確かに日本も昔よりは"
00093_Bmic;Speaker 2;02:49;02:54;"政治にとりわけネットの空間とは"
00093_Bmic;Speaker 2;02:54;02:56;"お互いに攻撃的にはなっているけど"
00093_Bmic;Speaker 2;02:56;02:59;"それがダイレクトに現場に出ているかというと"
00093_Bmic;Speaker 1;02:59;03:01;"そんな感じはしないんですよね"
00093_Bmic;Speaker 2;03:02;03:05;"やっぱり海外と日本の社会の仕組みも違うから"
00093_Bmic;Speaker 2;03:06;03:09;"政治のあり方も違うというふうには思います"
00093_Bmic;Speaker 2;03:09;03:09;"なるほど"
00093_Bmic;Speaker 1;03:12;03:15;"なんかその感情的な"
00093_Bmic;Speaker 2;03:15;03:26;"例えば、昔、それこそね、委員会とかで可決を阻止するために、みんなで体を張ってとか、"
00093_Bmic;Speaker 2;03:29;03:35;"技場で昔、水かけた人がいましたけど、ああいうのやったら、すごく批判されるわけですね。"
00093_Bmic;Speaker 1;03:36;03:37;"今の時にね。"
00093_Bmic;Speaker 2;03:37;03:50;"でも例えば台湾とか韓国って、まさに物理的に身体的にそういう議場で喧嘩をしたり、あるいは選挙をしたりしてるわけじゃないんですけど、"
00093_Bmic;Speaker 2;03:50;04:00;"そこはやっぱり日本と外国で違うのかなっていう気がして、だからそれはやっぱり文化が違うので、政治の在り方も違うのかなって感じはしないですね。"
00093_Bmic;Speaker 2;04:00;04:00;"なるほど。"
00093_Bmic;Speaker 1;04:04;04:11;"もともとそういう日本人的なメンタリティみたいなのが"
00093_Bmic;Speaker 1;04:12;04:17;"ある上でさらにそういう感情の管理みたいなのが乗っかってきちゃってるので"
00093_Bmic;Speaker 1;04:18;04:22;"本当にどうなるんでしょうねっていう"
00093_Bmic;Speaker 1;04:22;04:24;"対抗した方がいいと思うんですけど"
00093_Bmic;Speaker 2;04:28;04:32;"これ小島英二さんが言ってたんですけど"
00093_Bmic;Speaker 2;04:32;04:48;"でもやると、やっぱり子どもの予想教育を考えても、大人が、私紛ではなくて、法的な意味合いで、怒っているという姿を見せるのがすごく大事なことだと思っていたんですけど、"
00093_Bmic;Speaker 2;04:48;04:58;"大人が真剣に怒っている、何かに対して、というのを、やっぱり子どもに見せるってすごく、まさに予想教育がありました。"
00093_Bmic;Speaker 1;04:58;05:04;"そうですよね。何かそれで政治が動いたりとか社会が動いたりしますもんね。"
00093_Bmic;Speaker 1;05:05;05:10;"社会を動かす原動力としての怒りみたいなものがすっかり忘れ去られているというか、"
00093_Bmic;Speaker 1;05:12;05:17;"もう抑制しないといけないものみたいな感じに怒りがなっているので、"
00093_Bmic;Speaker 1;05:19;05:26;"そういう社会を動かす原動力として怒りが捉えられなくて、"
00093_Bmic;Speaker 1;05:26;05:31;"ただイライラしてるとか、ストレスを抱えてるみたいな文脈で"
00093_Bmic;Speaker 1;05:32;05:36;"怒りが解釈されてしまうことがすごく多いんだろうと思っていて"
00093_Bmic;Speaker 1;05:36;05:40;"で、そのミクロな人間関係の中で"
00093_Bmic;Speaker 1;05:40;05:45;"怒りぶつけないようにしましょうっていう話ばっかりになってると思います"
00093_Bmic;Speaker 2;05:46;05:52;"その日本の海外メディアとか日本でデモをやりました"
00093_Bmic;Speaker 2;05:52;05:57;"でもやって、ゴミを拾うってすごく驚くわけですよ"
00093_Bmic;Speaker 2;05:57;06:02;"でもやって、こんなイカにをぶつけて、その後みんなきれいにして帰るって"
00093_Bmic;Speaker 2;06:02;06:08;"こんなお行儀のいい国って誰のかって、みんな驚くわけですよね"
00093_Bmic;Speaker 2;06:08;06:12;"一切でもすごく日本の番、おとなしいんじゃないですか"
00093_Bmic;Speaker 2;06:12;06:17;"はい、ここで泊まるよーって、はい、いつ信号渡りましょうみたいな感じでやってて"
00093_Bmic;Speaker 3;06:18;06:22;"でもやってる意味があるの?って思うとも思ったりするんですけど"
00093_Bmic;Speaker 3;06:22;06:25;"それぐらいやっぱりいろんなものがコントロールする"
00093_Bmic;Speaker 3;06:25;06:28;"そんな国でダイナミックになっていると奪われないだろう"
00093_Bmic;Speaker 3;06:31;06:31;"そうですね"
00093_Bmic;Speaker 2;06:34;06:39;"多分怒りと政治って難しくて"
00093_Bmic;Speaker 2;06:40;06:41;"思憤じゃダメなんですよね"
00093_Bmic;Speaker 2;06:42;06:46;"私がこうだから私こんなに気をつけられたと"
00093_Bmic;Speaker 2;06:46;06:48;"それはあなたの問題だよって言われた"
00093_Bmic;Speaker 2;06:49;06:49;"そうじゃなくて"
00093_Bmic;Speaker 2;06:50;06:52;"僕はこんなことに怒ってます"
00093_Bmic;Speaker 2;06:53;06:55;"あなたも怒ってるんですね"
00093_Bmic;Speaker 2;06:55;06:57;"あそこにも怒ってる人"
00093_Bmic;Speaker 2;06:57;07:01;"そこをつなげていく言葉とか"
00093_Bmic;Speaker 3;07:01;07:03;"理事とか理屈っていうのが生まれていって"
00093_Bmic;Speaker 3;07:04;07:05;"それが公的なものになっている"
00093_Bmic;Speaker 3;07:05;07:06;"そうですね"
00093_Bmic;Speaker 3;07:06;07:10;"そうするとそこで始めて理性とか知性とかが必要とされている"
00093_Bmic;Speaker 3;07:12;07:14;"原動力はそこはやっぱりといけない"
00093_Bmic;Speaker 1;07:19;07:19;"なるほどです"
00093_Bmic;Speaker 1;07:21;07:26;"私の怒りとあなたの怒りは別々であなたの事情ですよねみたいな"
00093_Bmic;Speaker 1;07:26;07:30;"個別にコントロールしてそれぞれうまくやりましょうみたいな感じで"
00093_Bmic;Speaker 1;07:30;07:33;"今終わっていってしまうことが多いと思うので"
00093_Bmic;Speaker 1;07:34;07:39;"そういう同じような怒り集合的な怒りというか"
00093_Bmic;Speaker 1;07:39;07:47;"そういうものをつなげていくやり方とか言葉みたいなのが必要なんだろうなと"
00093_Bmic;Speaker 2;07:48;07:57;"感情労働の話とも関係すると、最近当事者性とか、当事者研究があるじゃないですか。"
00093_Bmic;Speaker 2;07:59;08:07;"大事なことだと思うんだけど、一方で僕はすごい違和感を持っていて、当事者しか当たれないんですか。"
00093_Bmic;Speaker 2;08:09;08:10;"それはそれが即正義なんですか"
00093_Bmic;Speaker 2;08:11;08:14;"っていうところがすごく引っかかるんですよね"
00093_Bmic;Speaker 2;08:14;08:17;"当事者がかかると"
00093_Bmic;Speaker 2;08:17;08:18;"当事者しか分からないこと"
00093_Bmic;Speaker 2;08:18;08:21;"当事者ならではの問題っていうのはあるんだけれども"
00093_Bmic;Speaker 2;08:21;08:26;"それがどれぐらい不変性を持っている問題なのか"
00093_Bmic;Speaker 2;08:26;08:28;"どういうふうに社会にかかっているのか"
00093_Bmic;Speaker 2;08:30;08:32;"当事者じゃない人が"
00093_Bmic;Speaker 2;08:34;08:36;"なぜそれを理解しなきゃいけないのか"
00093_Bmic;Speaker 1;08:36;08:39;"という言葉がありない気がするんです"
00093_Bmic;Speaker 1;08:39;08:42;"当事者というだけでそれがパワーマークになっちゃって"
00093_Bmic;Speaker 1;08:42;08:42;"わかります"
00093_Bmic;Speaker 1;08:45;08:48;"それイルーズもチラッと言ってたのが"
00093_Bmic;Speaker 1;08:48;08:49;"やっぱ感情"
00093_Bmic;Speaker 1;08:49;08:51;"今あなたがとか私が"
00093_Bmic;Speaker 1;08:52;08:53;"今こう感じてるって言ったら"
00093_Bmic;Speaker 1;08:53;08:55;"もうそれで誰も何も言えないみたいなとこがあって"
00093_Bmic;Speaker 1;08:56;08:57;"そうなんですよ"
00093_Bmic;Speaker 2;08:57;08:59;"それが持っているアルシュ合力"
00093_Bmic;Speaker 1;08:59;08:59;"そうなんです"
00093_Bmic;Speaker 1;09:00;09:02;"それ本当にそれをどうするかっていうのは"
00093_Bmic;Speaker 1;09:02;09:04;"考えないといけないなと思っていて"
00093_Bmic;Speaker 1;09:05;09:08;"だからすごい一方で感情を抑えるとかコントロールしてるけど"
00093_Bmic;Speaker 1;09:09;09:12;"私が今こう思ってるんですとかこう感じましたということについては"
00093_Bmic;Speaker 1;09:13;09:15;"もう誰も何も言えないっていうところの"
00093_Bmic;Speaker 1;09:16;09:21;"共通の言語が見つからないっていうところの問題性がすごいあると思います"
00093_Bmic;Speaker 2;09:25;09:28;"それをやっぱり翻訳したり解釈すると"
00093_Bmic;Speaker 2;09:28;09:32;"何種感情ではないものが逆に必要なこと"
00093_Bmic;Speaker 1;09:32;09:34;"そうですよねどこに行くんだろうこれは"
00093_Bmic;Speaker 2;09:37;09:38;"渡れない"
00093_Bmic;Speaker 1;09:39;09:40;"橋が"
00093_Bmic;Speaker 1;09:45;09:46;"バラ園が"
00093_Bmic;Speaker 1;09:46;09:48;"あっちにあるんですかね"
00093_Bmic;Speaker 1;09:49;09:50;"ここ降りたらいいんですか"
00093_Bmic;Speaker 2;10:02;10:20;"お客様のお客"
00093_Bmic;Speaker 1;10:20;10:23;"全然だと思いますけど"
00093_Bmic;Speaker 3;10:50;10:54;"レイジベイトっていう言葉がありました"
00093_Bmic;Speaker 3;10:54;10:56;"今年の言葉みたいなのね"
00093_Bmic;Speaker 3;10:57;11:00;"あれって怒りをお金に変える仕組みを"
00093_Bmic;Speaker 3;11:01;11:01;"まあ"
00093_Bmic;Speaker 3;11:03;11:04;"仕組み自体は"
00093_Bmic;Speaker 3;11:04;11:06;"怒りが金に変えやすいってことの発見だった"
00093_Bmic;Speaker 3;11:07;11:09;"なんかその辺は"
00093_Bmic;Speaker 3;11:09;11:12;"政治にどうやって動員するかというか"
00093_Bmic;Speaker 3;11:12;11:14;"そこはちょっと違いました"
00093_Bmic;Speaker 3;11:15;11:15;"なんでしょうね"
00093_Bmic;Speaker 3;11:17;11:18;"感情ってやっぱり"
00093_Bmic;Speaker 3;11:20;11:25;"頭のいい人が立っちゃうものでしかなくなっていくのか"
00093_Bmic;Speaker 2;11:28;11:31;"さっきの話もあったように"
00093_Bmic;Speaker 2;11:31;11:37;"感情は操られやすいものでもあるので"
00093_Bmic;Speaker 2;11:38;11:42;"そこをうまくフックをかけるのと言いますけど"
00093_Bmic;Speaker 2;11:43;11:50;"それを何でも金になるんだよね"
00093_Bmic;Speaker 2;11:53;11:56;"これはリードブールというのはスペクタクルな社会"
00093_Bmic;Speaker 1;11:56;11:58;"1970年にとってもらうのですけど"
00093_Bmic;Speaker 2;11:59;12:04;"もはやどんどん消費資本主義文化資本主義になっているので"
00093_Bmic;Speaker 2;12:05;12:08;"そうすると人々の想像力であるとか"
00093_Bmic;Speaker 2;12:08;12:12;"あるいはそれこそ喜怒哀楽というものが"
00093_Bmic;Speaker 2;12:14;12:17;"社会が動くようになるお金よりの人々の中に"
00093_Bmic;Speaker 2;12:18;12:22;"そこに当然ながらいろんなメディアを含め"
00093_Bmic;Speaker 2;12:22;12:25;"今はSNSでしょというのが目をつけて"
00093_Bmic;Speaker 2;12:25;12:27;"人々の想像力をどんどん奪っていく"
00093_Bmic;Speaker 2;12:27;12:30;"逆に内発的なものじゃないですか"
00093_Bmic;Speaker 2;12:31;12:33;"操作されるものになるというのは"
00093_Bmic;Speaker 2;12:33;12:36;"かなりはスペータルな社会で書いてあるんですけど"
00093_Bmic;Speaker 2;12:36;12:41;"その延長線上に今の時代は当然ながらあるというふうに思います。"
00093_Bmic;Speaker 2;12:42;12:46;"経済がものづくりではなくて製造業ではなくて、"
00093_Bmic;Speaker 2;12:47;12:51;"認知資本主義とか文化資本主義とかいうふうに言われるような人がいると、"
00093_Bmic;Speaker 2;12:51;12:56;"そういうところで社会が当然ながらそこにお金が集まって、"
00093_Bmic;Speaker 2;12:56;13:02;"人々の人々が操作のための対象になっているというふうに思います。"
00093_Bmic;Speaker 2;13:02;13:04;"そういうアルゴリズムってもうできてしまう。"
00093_Bmic;Speaker 1;13:06;13:06;"そうですね。"
00093_Bmic;Speaker 2;13:07;13:11;"まさに、燃料を投下するって言ったりするじゃないですか。"
00093_Bmic;Speaker 2;13:13;13:14;"延長させるために。"
00093_Bmic;Speaker 2;13:14;13:17;"まさにそういう言葉って、そういう象徴してると思います。"
00093_Bmic;Speaker 1;13:18;13:18;"そうですね。"
00093_Bmic;Speaker 1;13:21;13:24;"なんかその偉い人に動員されちゃうとかもあるんですけど、"
00093_Bmic;Speaker 1;13:24;13:27;"やっぱり人々自らそういうところに飛び込んでいっちゃうとか、"
00093_Bmic;Speaker 1;13:29;13:32;"さっきの企業の中で機嫌良くとか"
00093_Bmic;Speaker 1;13:35;13:37;"しんどくなったら自分で自分の機嫌を取るとか"
00093_Bmic;Speaker 1;13:38;13:41;"そのための商品とかいっぱいあるので"
00093_Bmic;Speaker 1;13:45;13:46;"なんて言うんでしょう"
00093_Bmic;Speaker 1;13:46;13:50;"イルイズの感情商品エモディティという概念があるんですけど"
00093_Bmic;Speaker 1;13:51;13:52;"それはなんかこう"
00093_Bmic;Speaker 1;13:53;13:57;"もはや現代人の感情正規とかが"
00093_Bmic;Speaker 1;13:57;14:02;"経済的なものと離れてはありえないんじゃないかみたいなことを言っていて"
00093_Bmic;Speaker 1;14:02;14:09;"消費を介してもたらされるいろいろな感情っていうのが世の中にあふれすぎていて"
00093_Bmic;Speaker 1;14:09;14:15;"消費を返さない感情正規とかあるんでしょうかみたいなことなんですけど"
00093_Bmic;Speaker 1;14:16;14:19;"本当にだからなんていうのかな"
00093_Bmic;Speaker 1;14:20;14:27;"その資本主義の外部に本当の感情とか本物の感情を想定できるのかっていうこと自体を"
00093_Bmic;Speaker 1;14:27;14:29;"思わないといけないかもしれないねっていうところまで"
00093_Bmic;Speaker 1;14:30;14:32;"事態は進んでいるかもしれませんっていう"
00093_Bmic;Speaker 2;14:32;14:34;"そのパーソナル恋愛とかね"
00093_Bmic;Speaker 2;14:34;14:35;"家庭の中でもそうですね"
00093_Bmic;Speaker 1;14:36;14:38;"はい、そうなんです"
00093_Bmic;Speaker 1;14:42;14:44;"だから本物の感情"
00093_Bmic;Speaker 1;14:44;14:46;"偽物の感情っていうのを"
00093_Bmic;Speaker 1;14:49;14:52;"区別をどうやってするのかっていう"
00093_Bmic;Speaker 1;14:52;14:53;"それは無理なの"
00093_Bmic;Speaker 1;14:55;14:57;"本当に今までの"
00093_Bmic;Speaker 2;14:57;15:02;"感情コントロール感情管理の話になってきますよね"
00093_Bmic;Speaker 1;15:03;15:04;"どうなのかな"
00093_Bmic;Speaker 1;15:06;15:07;"なんて言ったらいいんだろう"
00093_Bmic;Speaker 1;15:09;15:12;"自分の本当の感情を知りたいとか"
00093_Bmic;Speaker 1;15:13;15:15;"コントロールされない感情っていうか"
00093_Bmic;Speaker 1;15:15;15:17;"仕事でめっちゃ感情管理したから"
00093_Bmic;Speaker 1;15:17;15:19;"普通の自分に戻りたいとか"
00093_Bmic;Speaker 1;15:19;15:21;"普通に思うと思うんですけど一般的には"
00093_Bmic;Speaker 1;15:23;15:26;"でもその時にセラピーを受けるとか"
00093_Bmic;Speaker 1;15:27;15:29;"本を読むとかすると思うんですけど"
00093_Bmic;Speaker 1;15:29;15:34;"それもある種の消費の行動なわけですよねってなっていて"
00093_Bmic;Speaker 1;15:36;15:38;"自己規定アイデンティティを持つとか"
00093_Bmic;Speaker 1;15:39;15:43;"自分という人間がどんな人間かとか考えること自体も"
00093_Bmic;Speaker 1;15:43;15:45;"消費と結びついていて"
00093_Bmic;Speaker 1;15:46;15:50;"消費する本のあり方とか"
00093_Bmic;Speaker 1;15:51;15:53;"カウンセリングの考え方とか"
00093_Bmic;Speaker 1;15:53;15:54;"そういうのってある種"
00093_Bmic;Speaker 1;15:55;15:57;"その社会の道徳規範を反映してるじゃないですか"
00093_Bmic;Speaker 1;15:58;15:59;"文化的なものとかを"
00093_Bmic;Speaker 1;16:00;16:02;"そういう文化的なレパートリーが"
00093_Bmic;Speaker 1;16:03;16:04;"ある種商品化されていて"
00093_Bmic;Speaker 1;16:04;16:05;"それを読んでとか"
00093_Bmic;Speaker 1;16:05;16:07;"それのセミナーを受けて"
00093_Bmic;Speaker 1;16:07;16:11;"自分らしく生きる生き方考えましたとかになっている人が"
00093_Bmic;Speaker 1;16:12;16:13;"あまりにもたくさんいるので"
00093_Bmic;Speaker 1;16:15;16:18;"すごい資本主義的なものと"
00093_Bmic;Speaker 1;16:18;16:28;"私の在り方っていうのがもう分かちがたく結びついてしまっているんじゃないかっていうことを言ってて"
00093_Bmic;Speaker 1;16:28;16:32;"文化とかも本当も消費と結びついていて"
00093_Bmic;Speaker 1;16:32;16:37;"それ以外のものと考えられるかっていう感じです"
00093_Bmic;Speaker 1;16:38;16:41;"感情ってどうなんでしょう"
00093_Bmic;Speaker 2;16:41;16:44;"これは農家学とかも関係すると思うんですけど"
00093_Bmic;Speaker 2;16:45;16:48;"何か刺激があって出てくるものですかね"
00093_Bmic;Speaker 2;16:48;16:53;"それとも自分に向く感情とか"
00093_Bmic;Speaker 2;16:53;16:58;"自分だけを見つめて出てくる感情ってあるんですかね"
00093_Bmic;Speaker 1;16:58;17:00;"どうなんでしょうね"
00093_Bmic;Speaker 1;17:02;17:06;"社会学は社会の中で感情を感じているって"
00093_Bmic;Speaker 1;17:06;17:11;"まず基本的にそういう感じ方を想定していると思うんですね"
00093_Bmic;Speaker 1;17:12;17:15;"社会と感情というふうに言ったりしますので"
00093_Bmic;Speaker 1;17:16;17:19;"刺激反応図式とかっていうよりは"
00093_Bmic;Speaker 1;17:19;17:23;"人との間のやりとりの中で考えるとか"
00093_Bmic;Speaker 1;17:23;17:27;"あるいは文化規範的なものの"
00093_Bmic;Speaker 1;17:27;17:28;"感情規則っていうのがあるんですけど"
00093_Bmic;Speaker 1;17:29;17:32;"それに基づいて感情表出してるとか"
00093_Bmic;Speaker 1;17:32;17:34;"お葬式では悲しまないといけないとか"
00093_Bmic;Speaker 1;17:34;17:36;"結婚式では喜ばないといけないとか"
00093_Bmic;Speaker 1;17:36;17:39;"いろんな仲間のうちの感情規則"
00093_Bmic;Speaker 1;17:39;17:42;"いろいろあるのに合わせて表出してる"
00093_Bmic;Speaker 1;17:42;17:44;"みたいな考え方をするので"
00093_Bmic;Speaker 1;17:46;17:50;"感情労働とかだと職場とか専門職の倫理に照らして"
00093_Bmic;Speaker 1;17:50;17:55;"こういうふうに感情表出するしないで決まってくるんですけど"
00093_Bmic;Speaker 2;17:55;17:59;"そう考えると先ほど感情が管理されてつらい"
00093_Bmic;Speaker 2;18:02;18:04;"よく日本でバカにされるのは"
00093_Bmic;Speaker 2;18:04;18:10;"北朝鮮で例えば狩猟様が死にました"
00093_Bmic;Speaker 2;18:10;18:12;"泣き女っていうのが出てくると"
00093_Bmic;Speaker 2;18:14;18:16;"朝鮮半島の文化でそういうのがあるんですけど"
00093_Bmic;Speaker 2;18:17;18:19;"公式なので悲しいふりをしなきゃいけないので"
00093_Bmic;Speaker 2;18:19;18:21;"わざと泣いてみせる"
00093_Bmic;Speaker 2;18:21;18:26;"彼は感情というよりも役割演じているわけじゃないですか"
00093_Bmic;Speaker 2;18:26;18:29;"その感情そのものなので"
00093_Bmic;Speaker 2;18:31;18:32;"感情はこうじゃなきゃいけないじゃなくて"
00093_Bmic;Speaker 2;18:32;18:37;"この瞬間でこの場面ではこういう感情を出すものなんだという"
00093_Bmic;Speaker 2;18:37;18:42;"ファンクションという感情というふうに"
00093_Bmic;Speaker 1;18:43;18:44;"かもしれません"
00093_Bmic;Speaker 2;18:45;18:50;"怒るべきところで怒って悲しむべきところで悲しんで"
00093_Bmic;Speaker 2;18:50;18:54;"そういうふうに社会を作っていくんだというふうにみんな捉えたら"
00093_Bmic;Speaker 2;18:54;18:58;"もしかしたらもう少し逆に逆説的にみんな楽になるかな"
00093_Bmic;Speaker 1;18:58;18:58;"なるほど"
00093_Bmic;Speaker 1;18:59;19:02;"なんかその感情規則に従って感情を感じるときに"
00093_Bmic;Speaker 1;19:03;19:04;"人は何をしているかって言ったら"
00093_Bmic;Speaker 1;19:05;19:06;"なんかその感情作業をしている"
00093_Bmic;Speaker 1;19:07;19:10;"でその感情作業には表層演技と真相演技があるんだって"
00093_Bmic;Speaker 1;19:10;19:12;"ホクシルドが言っていて"
00093_Bmic;Speaker 1;19:12;19:19;"それはなんかその北施図の手前にアービン・ゴフマンという社会学者がいるんですけど"
