Filename;Speaker;Start Timestamp;End Timestamp;Transcript
00093_Bmic;Speaker 2;38:48;38:50;"人の関係はフラットなんですよね"
00093_Bmic;Speaker 1;38:50;38:51;"そうですね"
00093_Bmic;Speaker 2;38:53;38:55;"だから同じ人間"
00093_Bmic;Speaker 2;38:57;38:58;"どこの人か"
00093_Bmic;Speaker 2;38:59;39:00;"どこの支援さんか"
00093_Bmic;Speaker 2;39:01;39:02;"これくらいないかは分からないけど"
00093_Bmic;Speaker 2;39:03;39:04;"人は人でしょっていう"
00093_Bmic;Speaker 2;39:05;39:07;"目線があると"
00093_Bmic;Speaker 2;39:07;39:13;"安心して相手とコミュニケートして"
00093_Bmic;Speaker 1;39:13;39:15;"つながれるのかもしれないという"
00093_Bmic;Speaker 1;39:17;39:18;"なるほど"
00093_Bmic;Speaker 3;39:31;39:33;"大阪の話なので"
00093_Bmic;Speaker 1;39:33;39:36;"大阪の話"
00093_Bmic;Speaker 1;39:36;39:42;"大阪…何でしょうね、私がやっぱりなんかあんまり大阪的なものを…"
00093_Bmic;Speaker 1;39:44;39:45;"あれなのかもしれません。"
00093_Bmic;Speaker 1;39:46;39:55;"当然っていうか、そんなに飴ちゃん配らないので…"
00093_Bmic;Speaker 1;39:57;40:00;"そうですね。私の周りにも飴ちゃん配るタイプがいなくて、"
00093_Bmic;Speaker 1;40:01;40:04;"あんまり大阪的なものじゃないかもしれません"
00093_Bmic;Speaker 1;40:04;40:07;"自分の成り立っているものが"
00093_Bmic;Speaker 2;40:09;40:13;"日本で何がやってみるか"
00093_Bmic;Speaker 2;40:13;40:15;"みんな無関心なんですよ"
00093_Bmic;Speaker 2;40:15;40:16;"他人に対して"
00093_Bmic;Speaker 2;40:19;40:20;"そこら辺ね"
00093_Bmic;Speaker 2;40:21;40:22;"のたれじんでても"
00093_Bmic;Speaker 2;40:23;40:24;"もう気にしないだろう"
00093_Bmic;Speaker 1;40:24;40:26;"っていう感じがするんですよ"
00093_Bmic;Speaker 2;40:26;40:28;"外国だと普段は"
00093_Bmic;Speaker 2;40:29;40:30;"介入してこないんですけど"
00093_Bmic;Speaker 2;40:31;40:35;"困っていったら必ず何か助けてくれるだろうという安心感"
00093_Bmic;Speaker 2;40:36;40:38;"それね、大阪にはある"
00093_Bmic;Speaker 2;40:38;40:41;"それはみんなウザいからそうなのかもしれないけど"
00093_Bmic;Speaker 2;40:42;40:43;"人に関係を持つ"
00093_Bmic;Speaker 2;40:44;40:46;"バイネタを踏み込んでくるんですけど"
00093_Bmic;Speaker 2;40:47;40:50;"そっちの方が安心してくらせる社会だな"
00093_Bmic;Speaker 1;40:52;40:52;"なるほど"
00093_Bmic;Speaker 1;40:55;40:57;"なんか東京はそれはないですか?"
00093_Bmic;Speaker 2;40:57;41:01;"ないですね。だからどんどん眠くなっている。"
00093_Bmic;Speaker 1;41:01;41:04;"一部ね、下町とかそういうのも、"
00093_Bmic;Speaker 2;41:05;41:07;"時間がもなくなるんですけど、"
00093_Bmic;Speaker 2;41:09;41:11;"かろうじてね、大阪はやっぱりあります。"
00093_Bmic;Speaker 1;41:12;41:17;"なんかでも、大阪は大阪で、なんていうんやろ、なんかその…"
00093_Bmic;Speaker 1;41:18;41:20;"だってでも、人身事故とかだと、"
00093_Bmic;Speaker 1;41:21;41:24;"悪態ついてますよ、迷惑かけてみたいな。"
00093_Bmic;Speaker 2;41:24;41:25;"迷惑かけて"
00093_Bmic;Speaker 1;41:25;41:27;"そう迷惑かけて"
00093_Bmic;Speaker 1;41:27;41:31;"なんか人が死ぬ時まで人に迷惑かけるなみたいなことを"
00093_Bmic;Speaker 1;41:31;41:34;"普通にイライラして言ってる人とか"
00093_Bmic;Speaker 1;41:35;41:37;"駅員さんに突っかかってるとか"
00093_Bmic;Speaker 1;41:37;41:40;"カスハラみたいなことになってるので"
00093_Bmic;Speaker 1;41:40;41:43;"わさかそんなあったかいというか"
00093_Bmic;Speaker 1;41:44;41:47;"なんか割と冷たいところが冷たいっていう"
00093_Bmic;Speaker 2;41:48;41:51;"でもそんなこと言うなよって言う人いるんだけど"
00093_Bmic;Speaker 2;41:51;41:57;"そんな悪態については、人が人なんだから、そんな失礼なこと言うことじゃないじゃないかって誰かが言います。"
00093_Bmic;Speaker 1;41:57;42:00;"言いますかね。どうだろう。"
00093_Bmic;Speaker 1;42:03;42:05;"やっぱ私、ディープ大阪じゃないんだと思います。"
00093_Bmic;Speaker 2;42:05;42:07;"なるほど。大阪もいろいろ。"
00093_Bmic;Speaker 1;42:07;42:07;"そうですね。"
00093_Bmic;Speaker 1;42:10;42:12;"なんか、シーンってしてる感じのイメージですね。"
00093_Bmic;Speaker 2;42:14;42:16;"時計悪態につく人すらいない。"
00093_Bmic;Speaker 1;42:16;42:18;"いない。淡々と。"
00093_Bmic;Speaker 2;42:19;42:24;"みんな、みんな、みんな、なんか、こんなとこで死にやがってっていう風に"
00093_Bmic;Speaker 2;42:24;42:25;"思ってるけど言わない"
00093_Bmic;Speaker 2;42:26;42:26;"うん"
00093_Bmic;Speaker 2;42:30;42:32;"そっちの方が不健全だってやっぱりどちらかという"
00093_Bmic;Speaker 2;42:34;42:36;"何考えてるか分かんないですね"
00093_Bmic;Speaker 2;42:37;42:39;"口に聞きないっていうのはやっぱり人間の方もないます"
00093_Bmic;Speaker 1;42:39;42:40;"ええええええ"
00093_Bmic;Speaker 1;42:48;42:49;"ええええ"
00093_Bmic;Speaker 1;42:51;42:52;"そうですね"
00093_Bmic;Speaker 1;42:55;42:57;"むしろディープ大阪の人に会うと"
00093_Bmic;Speaker 1;42:58;42:59;"自分が構えちゃうかもしれません"
00093_Bmic;Speaker 1;43:00;43:02;"どうしようってなっちゃうかもしれない"
00093_Bmic;Speaker 2;43:15;43:16;"ウェルビング"
00093_Bmic;Speaker 2;43:18;43:19;"ちょっとまでいないんですか"
00093_Bmic;Speaker 1;43:19;43:20;"いってますね"
00093_Bmic;Speaker 1;43:20;43:23;"今本当にウェルビングどうにかしないといけませんよ"
00093_Bmic;Speaker 1;43:23;43:24;"っていう話を"
00093_Bmic;Speaker 1;43:25;43:27;"ちょっとまた別のところでしてましたけど"
00093_Bmic;Speaker 1;43:31;43:32;"なんか"
00093_Bmic;Speaker 1;43:32;43:34;"何かができないとか"
00093_Bmic;Speaker 1;43:36;43:38;"いろんな人生の苦難とか"
00093_Bmic;Speaker 1;43:39;43:41;"全部漂白されちゃう感じがすごくて"
00093_Bmic;Speaker 1;43:42;43:43;"本当に"
00093_Bmic;Speaker 1;43:44;43:47;"社会全体を良くするというより"
00093_Bmic;Speaker 1;43:48;43:52;"個々人の主観的幸福を最大化するみたいなことなので"
00093_Bmic;Speaker 1;43:55;43:58;"そこについて来れないとか乗って来れない人のことは"
00093_Bmic;Speaker 1;43:58;44:00;"もう完全に置いてきぼりで"
00093_Bmic;Speaker 1;44:02;44:06;"「ザギバー」っていう僕の好きなディストピア小説がありますね"
00093_Bmic;Speaker 2;44:06;44:18;"これって、薬を飲んで毎日楽しく、かかりくならないように行きましょうっていう街が出てくるんですよ"
00093_Bmic;Speaker 1;44:20;44:23;"何ですか?私それ読みたいです"
00093_Bmic;Speaker 2;44:24;44:26;"映画にもなってるんですけど"
00093_Bmic;Speaker 2;44:27;44:29;"そういう人工的な街があって"
00093_Bmic;Speaker 2;44:31;44:35;"そもそも欠陥を抱えた人間っていうのは"
00093_Bmic;Speaker 2;44:35;44:37;"生まないような国民で"
00093_Bmic;Speaker 2;44:38;44:41;"お父さんお母さん絵に描いたような"
00093_Bmic;Speaker 2;44:42;44:43;"家族がいて"
00093_Bmic;Speaker 2;44:43;44:45;"子供がある時"
00093_Bmic;Speaker 2;44:46;44:47;"なんかおかしいなって気がつくんですよ"
00093_Bmic;Speaker 2;44:48;44:48;"その息子が"
00093_Bmic;Speaker 2;44:49;44:51;"街の外に出ちゃいけないんだけど"
00093_Bmic;Speaker 2;44:52;44:54;"街の外に出て"
00093_Bmic;Speaker 2;44:59;45:02;"賢者みたいな老人がいるんですけど"
00093_Bmic;Speaker 2;45:02;45:03;"彼と出会って"
00093_Bmic;Speaker 2;45:04;45:08;"その外に出てくる勇気をするのがあるという小説なんですけど"
00093_Bmic;Speaker 2;45:10;45:12;"この方法に行くと本当に実装期があるんですけど"
00093_Bmic;Speaker 1;45:13;45:15;"もうすでに結構なってますね"
00093_Bmic;Speaker 1;45:15;45:19;"本当にいつもハッピーじゃないといけないし"
00093_Bmic;Speaker 1;45:21;45:25;"なんかその本当にウェルビングをどうにかしないといけないと思ってます"
00093_Bmic;Speaker 1;45:25;45:26;"最近はちょっと"
00093_Bmic;Speaker 3;45:27;45:30;"それって個人主義みたいなのに結びついていて"
00093_Bmic;Speaker 3;45:31;45:34;"今日ちょっとポピュリズムの話があんまり出なかったんですけど"
00093_Bmic;Speaker 3;45:36;45:40;"そういうどんどんとポピュリズムって何か紙一重というかが思ってみたいな気がするので"
00093_Bmic;Speaker 3;45:41;45:43;"そこに話が行き着くんですかね"
00093_Bmic;Speaker 3;45:43;45:47;"経済側からそっちに行っちゃうとポピュリズムが導入するというか"
00093_Bmic;Speaker 3;45:48;45:49;"どうでしょう"
00093_Bmic;Speaker 3;45:50;45:56;"怒りだり個人の幸せを追求することこそだぜみたいな話が"
00093_Bmic;Speaker 3;45:56;45:58;"ポピュリズムにむしろなっていくときは"
00093_Bmic;Speaker 2;45:59;46:07;"人間が感情的になるときっていくつか定式があると思うんですけど"
00093_Bmic;Speaker 2;46:07;46:10;"こんなはずじゃなかったっていうのが"
00093_Bmic;Speaker 2;46:10;46:19;"人々の怒りを誘い出す一つの文脈とか状況だったりするんですよね"
00093_Bmic;Speaker 2;46:20;46:22;"この国でもある種怒りが"
00093_Bmic;Speaker 2;46:23;46:25;"憎悪が政治を駆動させるような"
00093_Bmic;Speaker 2;46:27;46:29;"こんなはずじゃなかったっていう"
00093_Bmic;Speaker 2;46:29;46:31;"はしごを外されているとか"
00093_Bmic;Speaker 2;46:31;46:34;"相対的剥奪というのが"
00093_Bmic;Speaker 2;46:34;46:36;"どの国でもやっぱり強くなっていて"
00093_Bmic;Speaker 2;46:37;46:39;"それは今までの社会のある方とか"
00093_Bmic;Speaker 2;46:39;46:41;"制度がどんどん古くなっているということですし"
00093_Bmic;Speaker 2;46:41;46:44;"制度とか仕組みの中で人々を食わせられる"
00093_Bmic;Speaker 2;46:45;46:47;"あるいは希望を持たせられなくなっている"
00093_Bmic;Speaker 2;46:47;46:51;"ということの状況を説明するんですけど"
00093_Bmic;Speaker 2;46:51;46:55;"なので、光が全面に出てきているかな"
00093_Bmic;Speaker 2;46:56;46:57;"という感じがしますけどね"
00093_Bmic;Speaker 2;47:03;47:07;"だから普通にこうやって来なさいって"
00093_Bmic;Speaker 2;47:07;47:10;"汗水だらして真面目に働いてきたのに"
00093_Bmic;Speaker 2;47:10;47:13;"約束されたものが手に入らない"
00093_Bmic;Speaker 3;47:13;47:16;"それはみんな起こるよねっていうこと"
00093_Bmic;Speaker 2;47:44;47:45;"はい"
00093_Bmic;Speaker 2;47:46;47:49;"今までの社会科学もそうなんですけど"
00093_Bmic;Speaker 2;47:50;47:51;"今までのこう"
00093_Bmic;Speaker 2;47:52;47:54;"今までいろいろ蓄積があって"
00093_Bmic;Speaker 2;47:54;47:58;"こういう現象とかこういうあり方を分類してみたり"
00093_Bmic;Speaker 2;47:58;48:01;"体系立てていくつつけて"
00093_Bmic;Speaker 2;48:01;48:03;"理論として作ってきたんですけど"
00093_Bmic;Speaker 2;48:04;48:06;"それが当てはまらなくて"
00093_Bmic;Speaker 2;48:06;48:07;"当てはまらないので"
00093_Bmic;Speaker 2;48:08;48:11;"社会心理学とかそういうものじゃないと"
00093_Bmic;Speaker 2;48:12;48:15;"説明がつかないような現象がたくさん出てきている"
00093_Bmic;Speaker 1;48:18;48:19;"確かに"
00093_Bmic;Speaker 1;48:21;48:25;"なんか説明自体もミクロになっちゃうというか"
00093_Bmic;Speaker 1;48:25;48:26;"なんて言うんでしょうね"
00093_Bmic;Speaker 1;48:26;48:31;"全体的な社会の説明というのが"
00093_Bmic;Speaker 1;48:31;48:31;"難しくなって"
00093_Bmic;Speaker 1;48:31;48:32;"そうですね"
00093_Bmic;Speaker 2;48:50;48:52;"そうですね"
00093_Bmic;Speaker 3;49:30;49:30;"はい。"
00093_Bmic;Speaker 3;49:35;49:45;"ブレかぜのもあるんですね"
00093_Bmic;Speaker 3;50:03;50:05;"放送は4月に入ってからになるので"
00093_Bmic;Speaker 3;50:06;50:06;"また"
00093_Bmic;Speaker 3;50:07;50:08;"後日"
00093_Bmic;Speaker 3;50:08;50:09;"後日"
00093_Bmic;Speaker 3;50:10;50:10;"後日"
00093_Bmic;Speaker 3;50:12;50:12;"後日"
00093_Bmic;Speaker 2;50:21;50:21;"後日"
00093_Bmic;Speaker 3;51:02;51:04;"あの人は一応社会信じるのかなって"
00093_Bmic;Speaker 3;51:05;51:08;"確かに今最後の方にチラッと出たけど"
00093_Bmic;Speaker 3;51:10;51:10;"まあ"
00093_Bmic;Speaker 3;51:12;51:16;"いってみれば考察とか解釈に近い話ではあるんだけど"
00093_Bmic;Speaker 3;51:17;51:19;"楽しい世代はいいよねっていうか"
00093_Bmic;Speaker 3;51:19;51:20;"事実よりは"
00093_Bmic;Speaker 3;51:22;51:22;"とんでも"
00093_Bmic;Speaker 3;51:23;51:23;"ありがとうございます"
00093_Bmic;Speaker 3;51:27;51:29;"でもなんかまあ"
00093_Bmic;Speaker 3;51:30;51:37;"ああいう反リベラル的な言説の需要が 彼のあれが受けるのが困ってるなと思う"
00093_Bmic;Speaker 3;51:43;51:44;"話したくなるんだね"
00093_Bmic;Speaker 3;51:45;51:47;"いい話面白い話"
00093_Bmic;Speaker 3;51:47;51:48;"そうなんですね"
00093_Bmic;Speaker 3;51:50;51:56;"反リベラルの面白ネタ本みたいな感じが"
00093_Bmic;Speaker 3;52:03;52:05;"大学生の本とかね"
00093_Bmic;Speaker 3;52:06;52:26;"今こうらしいよみたいな話がすごい思ってます"