"Speaker Name","Start Time","End Time","Text"
"D1","00;00;04;04","00;00;10;56","さんの記事読んでコーヒーを。"
"D1","00;00;11;01","00;00;20;02","やめたんですけど。だったような気がするんですけど、やっぱり嗜好品みたいなものにちょっと興味があるわけ。"
"大坪1","00;00;20;02","00;00;28;28","なんですよね。"
"大坪1","00;00;28;33","00;00;36;00","トマトとゴーヤとかってのを考えて。"
"大坪1","00;00;36;05","00;00;56;52","コーヒーの調査もちょっとやってたので、その繋がりで日本で。沖縄行ったことがなかったので。そうなんですか。これだけの頃ですね。コロナで海外行けないの？日本で何かできないかなというときに、沖縄なら後期。"
"しんめい1","00;00;56;52","00;00;58;53","に入ってどっち。"
"大坪1","00;00;58;53","00;01;11;33","かこっちから出た方が多分大丈夫。"
"しんめい1","00;01;11;38","00;01;12;00","はいはい。"
"D1","00;01;12;06","00;01;31;34","なるほど。一方で嗜好品ってともかくコーヒーとかになるのも結構困窮したりと趣味のものだから、価格は結構いい値段じゃないですか。その辺は。"
"大坪1","00;01;31;39","00;02;00;57","どうでも安安いものありますよね。GOOGLE翻訳で嗜好品って英語に変換するとラグジュアリーグッズとかって贅沢になっちゃうんですよね。なんですけど、贅沢品でもいい。タバコだって昔は趣味吸ってお酒も安いものもあるから。私はイメージとしてそんなに高級品っていうイメージじゃないんですが、ただ高級なものもありますよね。"
"大坪1","00;02;01;01","00;02;37;39","ワインとかだって1本いくらとかそういうのもあるし。でも安いのもあるので、いろいろそれぞれの懐具合に合わせて楽しめるといいなって思うんですが。"
"大坪1","00;02;37;44","00;02;44;40","階段出口は出る。"
"大坪1","00;02;44;44","00;02;50;18","持ち合わせが面倒くさいとこですからね。"
"大坪1","00;02;50;23","00;02;54;39","すごい変わってますよね。"
"大坪1","00;02;54;44","00;02;58;08","もう違う別物ですよね。"
"しんめい1","00;02;58;12","00;03;00;52","っていうのが違う。"
"大坪1","00;03;00;56","00;03;02;05","そうです。"
"D1","00;03;02;10","00;03;05;54","全然ピンとこないです。"
"大坪1","00;03;05;59","00;03;09;37","なんせ愚痴なんて何物だ？って感じですしね。"
"しんめい1","00;03;09;42","00;03;14;57","そうですね。ありました。"
"大坪1","00;03;15;02","00;03;29;38","私でも小田急線に住んでいるので。そうなんです。なのでなんとなくは変わって使わせてるなというのは何か気配を感じ。"
"大坪1","00;03;29;43","00;03;43;50","ていればすぐ。"
"D1","00;03;43;55","00;03;44;24","ああ。"
"大坪1","00;03;44;29","00;03;47;28","そうなんですか。"
"大坪1","00;03;47;33","00;03;48;50","どうぞ。"
"しんめい1","00;03;48;55","00;03;50;44","先生も。"
"大坪1","00;03;50;49","00;03;52;02","そうです。"
"しんめい1","00;03;52;07","00;04;01;39","し、ますますつけちゃいます。通り1年です。"
"しんめい1","00;04;01;44","00;04;10;06","ロッカーも何か？あっそうですか。これぐらいの荷物だったらつけながらとかでいいですかね？"
"大坪1","00;04;10;11","00;04;11;50","昨日からいらしてたんです。"
"しんめい1","00;04;11;59","00;04;12;28","今日。"
"大坪1","00;04;12;33","00;04;15;08","今日傘があるので。"
"しんめい1","00;04;15;13","00;04;16;20","今日の夜。"
"大坪1","00;04;16;25","00;04;20;57","ちょっと降りますよね。そうそうそう。"
"しんめい1","00;04;21;02","00;04;28;17","すいません。お待たせしました。とんでもないです。"
"D1","00;04;28;22","00;04;38;37","はいはいはい。"
"大坪1","00;04;38;42","00;04;40;59","ます。これは。"
"しんめい1","00;04;41;04","00;04;45;06","使って。"
"大坪1","00;04;45;11","00;04;50;38","そうですね。今日は雨で。"
"しんめい1","00;04;50;42","00;04;53;57","っていうのが。"
"大坪1","00;04;54;01","00;04;55;19","結構しっとり降りまし。"
"しんめい1","00;04;55;19","00;04;56;26","たと。"
"大坪1","00;04;56;31","00;05;03;36","びしょびしょになる雨です。ちょっと。"
"しんめい1","00;05;03;41","00;05;18;48","少ないですけど。質問する。"
"D1","00;05;18;53","00;05;27;47","現場にお任せします。"
"D1","00;05;27;52","00;05;30;37","分から。"
"D1","00;05;30;42","00;05;39;34","は変わった様子とか。"
"D1","00;05;39;39","00;05;47;57","ありがとう。"
"しんめい1","00;05;48;02","00;05;54;56","なかなか出て。"
"大坪1","00;05;55;01","00;06;03;49","今もう2015年から内戦してるので全然生きてないんですよ。最後に行ったのが2013年なので。"
"しんめい1","00;06;03;54","00;06;05;41","もう。"
"大坪1","00;06;05;45","00;06;15;47","なのでイエメンの有名な話は大体そういう昔の話になっちゃうんだそうなんです。"
"しんめい1","00;06;15;51","00;06;21;31","今のフィールドとしては引き続きイエメンという形になっている。"
"大坪1","00;06;21;35","00;06;24;22","今、最近は韓国とか沖縄で調査をした。"
"しんめい1","00;06;24;22","00;06;31;08","結果、沖縄のコーヒーの中のコーヒー。"
"不明","00;06;31;13","00;06;31;48","ちょっと待って。"
"しんめい1","00;06;31;48","00;06;47;45","ください。"
"D1","00;06;47;50","00;06;49;04","今付けますよ。"
"しんめい1","00;06;49;09","00;06;53;38","ということです。"
"しんめい1","00;06;53;43","00;07;06;46","はいはい。"
"しんめい1","00;07;06;51","00;07;11;28","先生はご出身はどちらです。"
"大坪1","00;07;11;33","00;07;21;23","千葉都民ですよね。両親が千葉出身というわけではなく、たまたま父が東京勤務だったので、マイホームを買った時は千葉だっ。"
"しんめい1","00;07;21;23","00;07;22;10","たと。"
"大坪1","00;07;22;15","00;07;24;28","いうだけの千葉都民です。"
"しんめい1","00;07;24;33","00;07;26;13","房総の方というよりは。"
"大坪1","00;07;26;18","00;07;32;55","もうベッドタウンの一つですね。"
"大坪1","00;07;33;00","00;07;35;03","あそこ良さと大阪出身。"
"しんめい1","00;07;35;03","00;07;47;26","私は大阪で。東京に住んでいた時はよくレンタカーを借りて千葉に。"
"大坪1","00;07;47;31","00;07;51;25","とこですよね。千葉でね。"
"しんめい1","00;07;51;30","00;07;58;56","僕の地元が和歌山と千葉の南の方とか。"
"D1","00;07;59;01","00;07;59;30","館山。"
"しんめい1","00;07;59;30","00;08;05;56","とかじゃないですか。テーマと曲作りとか雰囲気、わりとなんとなく近い感じが。"
"大坪1","00;08;06;01","00;08;08;06","夏休みに泳ぎに行くところです。"
"しんめい1","00;08;08;06","00;08;10;31","かそうですかって。"
"大坪1","00;08;10;36","00;08;13;20","房総の荒波で。"
"しんめい1","00;08;13;25","00;08;21;12","夕日が結構よく見えて、すごい運転しながら見えたりするんで。"
"しんめい1","00;08;21;16","00;08;22;37","ですね、はい。"
"大坪1","00;08;22;42","00;08;25;34","私はお祖母先生って呼ばれちゃうんでしょうか？"
"しんめい1","00;08;25;38","00;08;27;08","3日、3日、30日。"
"大坪1","00;08;27;15","00;08;29;40","後にいいですよね。すいません。"
"しんめい1","00;08;29;45","00;08;33;07","33。"
"しんめい1","00;08;33;12","00;08;35;00","人ついつい。"
"大坪1","00;08;35;05","00;08;42;19","とりあえず先生。"
"しんめい1","00;08;42;24","00;08;47;29","はいはい。でですね。はい、もう回っています。"
"大坪1","00;08;47;32","00;08;47;49","はい、あり。"
"しんめい1","00;08;47;49","00;08;50;04","ます。はい。"
"大坪1","00;08;50;18","00;08;58;55","編集でどうにかしてください。編集で何か清水さんが1回目じゃなくて3回目という話を聞いたので、23回目。"
"しんめい1","00;08;59;00","00;09;10;56","プラットとしては、前に納富先生、東大の納富上先生でギリシャ哲学されている先生と。"
"大坪1","00;09;11;01","00;09;13;05","話を聞いたので、もう私は全てを。"
"しんめい1","00;09;13;05","00;09;14;56","任せます。先生。"
"大坪1","00;09;15;00","00;09;20;53","エスコートしてもらっ。"
"大坪1","00;09;20;58","00;09;21;12","はい。"
"D1","00;09;21;14","00;09;23;13","そこまで。"
"大坪1","00;09;23;18","00;09;29;04","はいはい。じゃあ適当にじゃあいい。"
"D1","00;09;29;09","00;09;30;10","桜が咲いています。"
"大坪1","00;09;30;10","00;09;31;20","桜が咲いてますね。"
"しんめい1","00;09;31;20","00;09;33;39","ああです。そうですね、これ桜なんですよね。"
"大坪1","00;09;33;41","00;09;35;17","ですよね。"
"しんめい1","00;09;35;21","00;09;38;22","桜。"
"大坪1","00;09;38;27","00;09;40;24","神明さん。下北沢お久しぶりですか。"
"しんめい1","00;09;40;36","00;09;56;01","下北沢は久しぶりですね。本当に大学在学中ぐらいなんで。10何年ぶりですけど。何かちゃんとは分かってないんですけど、雰囲気だいぶ変わった気がするんですけど、気のせいですかね。"
"大坪1","00;09;56;06","00;10;01;59","こっちはあんまりこっちじゃない方ですけれど、結構変わりましたよね。"
"しんめい1","00;10;02;04","00;10;14;09","何かすごい開発して、いい感じに子育てしやすい街になってるみたいなことを噂で聞いたんですけど。か。"
"大坪1","00;10;14;14","00;10;16;40","こんな綺麗な。"
"しんめい1","00;10;16;45","00;10;30;07","綺麗なものを吹かれながら。ラジオなのに確たること全然言えないんですけど、何か。新そうです。新しいカフェがあって。"
"しんめい1","00;10;30;12","00;10;56;10","多分下北沢も何口って言うんでしょう。東口とかの方ですかね。が古着とかちょっとカルチャーみたいな雰囲気のところで、こっち側の南西が落ち着いている感じなんですかね。すごい子供が。"
"しんめい1","00;10;56;15","00;11;06;15","草を触って遊んでいたりしますね。"
"しんめい1","00;11;06;19","00;11;09;43","お父さんは下北沢いつぶりですか？"
"大坪1","00;11;09;55","00;11;12;35","私、小田急線沿線に住んでるので。"
"しんめい1","00;11;12;35","00;11;14;40","ああ、そうなんですね。"
"大坪1","00;11;14;45","00;11;25;05","使わないでもないんですよね。学生の頃はね。よくプラプラ歩いたりしましたけれども、さすがに最近は目的地に行っておしまいっていう感じではあります。"
"しんめい1","00;11;25;05","00;11;25;49","が。"
"大坪1","00;11;25;54","00;11;29;24","なんとなくは変わっていく感じはしてまし。"
"しんめい1","00;11;29;24","00;11;31;57","た。"
"しんめい1","00;11;32;02","00;11;56;01","何か僕が行った時と渋谷もすごい変わったしね。新宿も行く度に東口と西口行き来できなくなったみたいに、ちゃんと街も変わっていくんだなってすごい思います。"
"しんめい1","00;11;56;06","00;12;01;13","学生時代はどんな学生だったんですか？"
"大坪1","00;12;01;18","00;12;03;42","どんな学生？昔の話。"
"しんめい1","00;12;03;42","00;12;06;28","です。"
"大坪1","00;12;06;32","00;12;09;45","どんな学生、真面目な学生だったとか？"
"しんめい1","00;12;09;50","00;12;11;45","そうですね。真面目だった。"
"大坪1","00;12;11;52","00;12;20;40","頃は授業は出ないのがデフォルトみたいな時代だっ。"
"大坪1","00;12;20;45","00;12;30;53","ラジオで喋ってな。体育は出席したけれども、一般教養は私はよく昼寝をしてましたね。"
"しんめい1","00;12;30;58","00;12;31;32","そうですか。"
"大坪1","00;12;31;32","00;12;38;03","昼寝をして、次の語学の予習をしてっていう時間に充てていたので。"
"大坪1","00;12;38;08","00;12;45;49","みんな学生でしたよね。今時の学生はみんなちゃんと起きて授業を取ってる。真面目だなと思います。"
"しんめい1","00;12;45;53","00;12;46;44","今。そうなんですか？"
"大坪1","00;12;46;53","00;12;52;35","そうですね、はい。真面目な子が多いです。"
"しんめい1","00;12;52;40","00;12;55;55","僕。"
"しんめい1","00;12;55;59","00;13;07;04","どれぐらい？もう20年近く前になっちゃいますけど、大学入学してやっぱりあんまり授業行けなかったです。"
"大坪1","00;13;07;09","00;13;07;58","出てます。"
"しんめい1","00;13;08;03","00;13;20;35","語学は。そうですね、何か語学は。でないとやっぱり単位が取れないので、フランス語をやってたんですけど、何か何ですかね。"
"しんめい1","00;13;20;40","00;13;26;45","何にも覚えてないですね。何かすごく難しかったっていうことしか覚えてないです。"
"大坪1","00;13;26;50","00;13;39;22","古い話みたいなりますので。私は第2外国語、中国語だったので、ああ、そうなんですか。フランス語とかドイツ語履修者たちが動詞の変化を覚えてる頃に、ひたすら姿勢の練習を。"
"しんめい1","00;13;39;27","00;13;43;56","していました。"
"しんめい1","00;13;44;01","00;13;45;02","やつですね。"
"大坪1","00;13;45;07","00;13;50;51","今でも私が覚えてます。"
"しんめい1","00;13;50;56","00;14;00;38","大坪さんの頃、中国語はやったりしたんですか？何かトレンドありますよね。多分ね、流行りの第2外国語は。"
"大坪1","00;14;00;43","00;14;21;18","どうですかね。でも私のクラスの人達はやっぱり中国に興味があるとか、将来そちらで絡んだ仕事をしたいとか、フランス語、ドイツ語が難しいということを知ってるから。"
"しんめい1","00;14;21;23","00;14;36;07","何かこう、結構講演が続いてますね。応援というか、散歩。"
"しんめい1","00;14;36;12","00;14;41;09","この広場みたいな感じで遊歩道。"
"大坪1","00;14;41;14","00;14;46;00","ここを始めてです。"
"大坪1","00;14;46;05","00;14;47;10","あっという間に行っちゃいそうなんです。"
"しんめい1","00;14;47;10","00;14;52;57","けどですね、辿り着いて何往復することによって。"
"大坪1","00;14;53;02","00;14;55;00","もう半分ぐらいまで来ちゃったんですね。"
"しんめい1","00;14;55;04","00;14;59;13","あ、そうなんですか。"
"大坪1","00;14;59;17","00;15;01;21","戻ります。ここでも知らなかった。"
"しんめい1","00;15;01;22","00;15;09;11","そうですね、ちょっと多分あれですね、ディティールに注目して色々言っていかないと持たないですね。"
"大坪1","00;15;09;15","00;15;13;53","黒か白雪ぐらいでしか分かんない。"
"しんめい1","00;15;13;58","00;15;27;11","で、こういうこう商業施設というよりは、もう何か何もない広場みたいな感じの所、いっぱい作るようになったんですね。"
"大坪1","00;15;27;16","00;15;30;58","ここを昔何だったんですか。"
"しんめい1","00;15;31;03","00;15;34;34","何かあったんですかね。何か。"
"大坪1","00;15;34;38","00;15;37;28","小田急線。"
"しんめい1","00;15;37;33","00;15;42;32","の線路だったところなんですか。"
"大坪1","00;15;42;37","00;15;45;20","ずっと何か広場になっているんです。後で見て。"
"しんめい1","00;15;45;20","00;15;52;40","ください。"
"しんめい1","00;15;52;45","00;16;07;01","今度はさんに聞くの変ですけど。何か下北チョイスは何か理由があったんですか。"
"D1","00;16;07;06","00;16;10;10","みんなが好きなもの。"
"D1","00;16;10;15","00;16;16;33","レコードとかそういう溢れている街だから。"
"しんめい1","00;16;16;38","00;16;19;49","ワードとしては嗜好品とか。"
"大坪1","00;16;19;54","00;16;42;07","そういう時代ばっかりですよね。行くと。昔もっと飲み屋さんとかあったのに、10年ぐらい前に、それこそコーヒーの研究会を駒場でやってて、その後懇親会という名の飲み会っていうのはその機関があるんで、飲み屋で3時間ぐらいまで。そんな頃の前だった。"
"しんめい1","00;16;42;07","00;16;43;19","んで。"
"大坪1","00;16;43;24","00;16;54;11","そういう時代だったんで、その時には飲み屋さんがたくさんあったなって記憶があるんですけど、最近なんか古着屋ばっかりで。"
"しんめい1","00;16;54;16","00;17;12;41","心生の時に路上飲みみたいなのを下北でやってたか分かんないですけどね。1杯やってたみたいで。ああいう路上飲みとか、文化人類学者の方だったら何かこう注目したりしないのか。"
"大坪1","00;17;12;41","00;17;14;37","なとか思うと、もう過去の話になる。"
"しんめい1","00;17;14;37","00;17;28;53","ので、もうね、一瞬だけだった。"
"しんめい1","00;17;28;58","00;17;32;18","大坪さんは。"
"しんめい1","00;17;32;23","00;17;38;05","嗜好品全般に。"
"しんめい1","00;17;38;10","00;17;47;44","ご研究というか、興味関心の対象があるんですか？それとももっとカートとかコーヒーとか絞られたものですか？"
"大坪1","00;17;47;49","00;18;05;27","最初は結局、イエメンのカートの調査を始めて、魚とは何かっていうと、嗜好品で一番説明がしやすいので、そこから入ってたので、嗜好品の全体のことも考えてますけれども。"
"大坪1","00;18;05;32","00;18;10;56","自分でやってるイエメンのカードだとか、最近初めて沖縄のコーヒーだとか。"
"しんめい1","00;18;11;01","00;18;12;15","そういうもの。"
"大坪1","00;18;12;15","00;18;16;14","に興味が。"
"しんめい1","00;18;16;19","00;18;22;03","沖縄のコーヒーはきっかけがあってですか、沖縄はクローナ。"
"大坪1","00;18;22;04","00;18;48;11","で、海外で調査もできず、国内でも調査もできないような時に、どうしよう、どうしようと困って。その頃の前にインスタグラムを始めて、イエメンの昔の写真をずっとアップしてたんですよ。っていうのかな。で、それでたまたま沖縄でコーヒーを作っている情報が手に入ったので。"
"大坪1","00;18;48;16","00;19;09;45","でも海外で調査が難しいんだったら、国内で調査ができるかなっていうことで、まずその時は沖縄行ったことがなかったので、じゃあ沖縄でコーヒー調査してみようって形で始めました。イエメンでもコーヒーのことはちょっと調査してたので、それで話が繋がるかなという感じです。"
"しんめい1","00;19;09;49","00;19;16;29","話は繋がったんですか。あんまり続かないて。"
"大坪1","00;19;16;34","00;19;24;53","繋げなくていいかな。"
"しんめい1","00;19;24;57","00;19;39;14","僕も色々イエメンのカード全然知らなかったのでなんとなくリサーチしてみたんですけど、やっぱ何ですか、葉っぱを。"
"しんめい1","00;19;39;19","00;19;41;40","ちょっと加工された葉っぱですか。"
"大坪1","00;19;41;44","00;19;44;23","ほとんど生の葉っぱですね。"
"しんめい1","00;19;44;28","00;19;45;06","生の。"
"大坪1","00;19;45;13","00;19;47;46","ホタテの葉っぱを口に入れるだけな。"
"しんめい1","00;19;47;46","00;19;48;39","ので。"
"大坪1","00;19;48;43","00;19;53;08","加工はしない。"
"しんめい1","00;19;53;13","00;19;58;46","加工をせずに葉っぱをガムみたいに噛んでいくみたいな。"
"大坪1","00;19;58;46","00;20;16;09","ことがあって。樹液っていうんですか、それは飲み込むんだけれども、カスが左にほっぺたに溜めていくんですね。だからほっぺたが膨らむんですよ。変な病気がイエメンで流行ってるんじゃないかっていうくらいで、みんな膨らまし。"
"しんめい1","00;20;16;12","00;20;17;27","て。"
"大坪1","00;20;17;32","00;20;23;41","どんどん膨らまして、今日はこれでおしまいって時に、ペットカートを捨てておしまいになる。"
"しんめい1","00;20;23;46","00;20;31;05","その1個の葉で葉っぱ1個の葉っぱでどんぐらい持つものなんですが、5分とか。"
"大坪1","00;20;31;10","00;20;34;16","ほっぺが膨らむくらい。"
"大坪1","00;20;34;20","00;20;39;10","どんどん4時間くらいずっと。"
"しんめい1","00;20;39;15","00;20;43;37","次々こう、葉っぱがボロボロになったら、新しいのを投入して。"
"大坪1","00;20;43;41","00;20;45;42","カスは飲み込まないんですよ。はいはい。"
"しんめい1","00;20;45;47","00;20;49;30","はい。スッと入っていくとかじゃなくて。"
"大坪1","00;20;49;43","00;21;04;29","どんどんお金貯めていくから出て、ほっぺたに貯めてエチオピアに行くとカード食べちゃったりするんで、飲み込めちゃうんですよ。その辺は何か色々違いはあるんですね。有名な人は絶対食べないですね。飲み込ま。"
"しんめい1","00;21;04;33","00;21;12;02","しかももういにしえの時からイエメンの方はそれをやってるんですか。"
"大坪1","00;21;12;06","00;21;44;40","いつかがて終わったかっていうのがよく分かってないんですけれども、原さんはエチオピアで何100年か前にあって、おそらく贅沢品なので、王様とか学者とかがやっていたもの。それが人々がもうやるようになったのは、多分イエメンの首都のその辺だと1930年、70年代くらいからと言われてるんで、そんなに伝統的な嗜好品というわけではない。"
"大坪1","00;21;44;45","00;21;51;59","カートに関係する儀礼だとか儀式だとかっていうのもほとんどない。"
"大坪1","00;21;52;04","00;21;55;45","あちこち見。"
"しんめい1","00;21;55;50","00;21;58;32","ちょっとエリアが変わってきましたね。"
"大坪1","00;21;58;32","00;21;59;46","さっきの南口。"
"しんめい1","00;21;59;46","00;22;03;22","です。南口。"
"大坪1","00;22;03;27","00;22;08;28","びっくりされると思います。本当にその通りなんですよ。"
"しんめい1","00;22;08;33","00;22;11;35","そうなんですか。"
"大坪1","00;22;11;40","00;22;20;51","誰がそんなに着るの？って思うんですけど。"
"しんめい1","00;22;20;56","00;22;24;51","服も広義の嗜好品として見ることはできるんですか？"
"大坪1","00;22;24;56","00;22;26;02","見てもいいと思いますよ。"
"しんめい1","00;22;26;03","00;22;27;05","いいですか。"
"大坪1","00;22;27;10","00;22;44;42","嗜好品ってだけでもすごい引いちゃうんですよ。携帯あって嗜好品だって音楽なんです。"
"しんめい1","00;22;44;47","00;22;50;41","古着屋とかがあるエリアがこっちこっちこっちこっちだと。"
"しんめい1","00;22;50;46","00;22;54;57","違うエリア。"
"しんめい1","00;22;55;02","00;23;06;46","こっちが東口って新しいんですね。じゃあその古着屋ばっかりですから、ちょっと行ってみていいですか。"
"大坪1","00;23;06;51","00;23;18;10","下北に来るのは大体ユニクロに来るくらいだってそうなので、さっきユニクロって名前喋って大丈夫ですか？って確認したら、ゆっくりくらいはいいですよって言われて。"
"しんめい1","00;23;18;14","00;23;24;04","ああ、そうなんですか、いいんですね。ラジオだといいんですかね。"
"しんめい1","00;23;24;08","00;23;31;19","街の風景として語るみたいな感じだったらいいんですかね。"
"大坪1","00;23;31;24","00;23;36;46","だっても飲み屋ありませんでしたか？"
"しんめい1","00;23;36;51","00;23;39;53","昔が飲み屋が。"
"大坪1","00;23;39;58","00;23;42;38","何かあった記憶があるん。"
"しんめい1","00;23;42;38","00;23;44;07","ですけど。"
"大坪1","00;23;44;11","00;23;49;22","空き家ばっかりになってくる。"
"しんめい1","00;23;49;27","00;23;54;04","とか。"
"しんめい1","00;23;54;08","00;23;57;36","確かにこれも古着屋の隣、古着屋です。"
"大坪1","00;23;57;41","00;23;58;33","そしてまた古着。"
