Speaker Name,イン点,アウト点,文字起こし,色選択
D,00:21:16:06,00:21:28:22,西洋から見たらっていう話で。難民の話。 が、やっぱり。,Violet
D,00:21:28:26,00:21:31:01,役に立たない。東洋哲学的。,Violet
しんめい,00:21:31:01,00:21:36:02,役に立たない。哲学的に。,Rose
D,00:21:36:07,00:21:48:10,役に立たないという哲学。 の言葉とか辺。 なんでしょうね。,Violet
D,00:21:48:15,00:21:56:45,今日の話を聞いていると。,Violet
しんめい,00:21:56:49,00:22:01:40,役に立たないが。,Rose
D,00:22:01:45,00:22:06:02,こういう機能から導こうとしている感じが。,Violet
しんめい,00:22:06:07,00:22:09:02,ちょっと早い発想。,Rose
D,00:22:09:07,00:22:14:25,こういう機能から導こうとしている。こういう哲学的。,Violet
D,00:22:14:30,00:22:19:03,今この時には、この話をどう？,Violet
D,00:22:19:08,00:22:19:40,かみしめよう。,Violet
しんめい,00:22:19:40,00:22:22:26,計算的にはこの話をどう。,Rose
大坪,00:22:22:31,00:22:24:28,かみしめようとして。,Lavender
しんめい,00:22:24:33,00:22:27:40,どうやって質問したらいいんだろうか。その。,Rose
大坪,00:22:27:45,00:22:42:36,新3すみません。私はずっとカープの話ばっかりしてるんですけど、皆さんどう思いますか？このグダグダなお喋りばっかりしている一見無駄と思われる人付き合いのやり方です。,Lavender
しんめい,00:22:42:41,00:22:44:33,ですね。,Rose
D,00:22:44:37,00:22:52:33,そうですね。,Violet
大坪,00:22:52:38,00:23:03:21,か、コーヒーって。でも私達の哲学って無駄だらけじゃないか。 それこそ。,Lavender
しんめい,00:23:03:26,00:23:11:10,これで例えば僕からもう語りだしてもいい感じですか？はい。,Rose
しんめい,00:23:11:15,00:23:18:20,すごい。僕はその嗜好品とかは。,Rose
しんめい,00:23:18:25,00:23:48:18,嗜好品というよりは、そういう嗜好性っていうんですか。仏教でいうと渇愛っていう言葉があるんですけど、鶴は渇くですかね。渇く愛で。この渇愛っていう言葉は、仏教哲学においてはもうめちゃくちゃ重要な言葉で、これが苦しみの原因だっていうふうにざっくり言うとお釈迦さんとかは言っているものです。,Rose
しんめい,00:23:48:23,00:24:23:37,こうこう、このこのこの世界っていうのは一切皆苦だと、全て悪なんだけれども、その原因っていうのがこの渇愛だっていう。 言い方をしてて。で、渇愛ってものを目したら、こう、すごくざっくりいうと楽になるよっていう話、もっというと解脱するよみたいな話があるんですけど、その辺ちょっとややこしいので置いておくと、その渇愛って例えば何かっていうふうに、私の理解でいうと。,Rose
しんめい,00:24:23:42,00:24:45:39,そうですね、例えばこう、ちょっと嫌なことがありましたっていう時に、お酒を飲んで忘れましょうっていうふうになったとしますと、これ例え話です。で、その時は嫌なことだったり現実って言われるものを忘れることができるんで、ちょっと開放感があって気持ちが楽になると。,Rose
しんめい,00:24:45:43,00:25:17:34,ただ、最初はいいんだけれども、それをずっと常習的にやっていくと、そのアルコール自体に依存していて、もともと忘れようと思っていた現実よりも辛い、そのしんどさ、苦しみっていうものが襲ってくるよねっていう、こういった構造っていうんですかね、何かあるのかなっていうふうに思ってて。 で、普通に生きてると。,Rose
しんめい,00:25:17:39,00:25:43:19,苦なわけですよね。これすごい仏教だと根源的なレベルでいうんで、何かちょっと想像しにくい部分があるんですけど、一人お坊さんから聞いた話だと、例えば我々まばたきしますよね。まばたきを全くしないとめちゃくちゃしんどいわけじゃないですか。だから、そのしんどさよりも、まばたきをするっていう、もうちょっとマシな服を選んで、こう、まばたきをすることによって生命が維持されている。,Rose
しんめい,00:25:43:24,00:26:10:23,だから、そのしんどさよりも、まばたきをするっていう、もうちょっとマシな苦を選んで、まばたきをすることによって生命が維持されている。ずっと何もせずに、飲み物も飲まずに、食べ物も食べずに生きてると、ものすごく苦しみが大きくなるから、ちょっと面倒くさいけれども、飲み物を飲んで、食べ物を食べて、そうやって生命は維持されていくみたいな、そういうレベルの話があって。 でも普通に生きてるだけでも、ちょっとこう、面倒くさいというか、しんどいというか、思い通りにならないことがすごくたくさんある中で、で。,Rose
しんめい,00:26:10:28,00:26:29:48,そういった1の苦しみ、ちょっと面倒くさいなとか、嫌だなとか、もうしんどいなっていうものを隠すために、1を何かこう0にしようと思ってやることが、10の苦しみを作ったり、100の苦しみを作ったりする。それは苦しいよねみたいな話を。,Rose
しんめい,00:26:29:53,00:26:57:18,仏教では一面においては説いているのかなっていうふうに理解していて。で、思考って何かすごくそこに関わってくるところで。で、結局何か現実みたいなものって何かやってられない時があって、それが何かあるのかなっていうふうに思うんですよね。,Rose
しんめい,00:26:57:18,00:27:28:17,今、日本も現時点ではそんなシビアな戦争に戦闘とかに何か巻き込まれているわけではないですし。でもイエメンって本当に、例えばイエメンだったら内戦状態にあって、もうままならない。のっぴきならない、もしかしたら身内が死ぬかもしれない、死んだかもしれないっていうような、そういう厳しい現実がある時に、そこから何か一瞬でも逃れられるっていうもの。 それがカートだとそこまで副作用強くないのかもしれないですけれども、それが例えばアルコールだったり、もっとこう。,Rose
しんめい,00:27:28:22,00:27:42:13,それが海外だとそこまで副作用強くないのかもしれないですけれども、それが例えばアルコールだったり、もっとこう。本当にドラッグみたいなもので、その現実を忘れようとしたらより大きな苦しみが来るかもしれないみたいな、そういうループの中に人間はいるんだよみたいなことを。,Rose
しんめい,00:27:42:18,00:27:46:28,私の理解では仏教とかは言っているのかなっていうふうに思っていて。,Rose
大坪,00:27:46:33,00:27:54:11,何事も程々が良いって話に繋がるんですが、結局それはでも中道がいいのかなって思います。,Lavender
しんめい,00:27:54:15,00:27:57:21,けど、もうそういうこう。,Rose
大坪,00:27:57:26,00:27:58:20,ちゃダメだよ。,Lavender
しんめい,00:27:58:25,00:28:12:15,そうですね、中道もそういう行動もほどほどっていう意味でもないんですけど、でも生活場面で言うなら、ある意味そのほどほどっていうものを進めることにもなり得るのかなとは思います。何かだから結局。,Rose
大坪,00:28:12:15,00:28:13:24,品。,Lavender
しんめい,00:28:13:28,00:28:43:42,嗜好品。 だから別にダメだと言っているわけではなくて、どこかそうやって現実というものに指向性のあるもので折り合いをつけながらやってらんない現実っていうのをちょこちょこ見て見ぬふりをして、そうやって生きていくと、もうちょっと話続けるんですけど、仏教の場合だと、嗜好品っていうよりは、その中に妄想みたいなのがある意味それに当たるのかなと思っていて。,Rose
しんめい,00:28:43:46,00:29:02:40,もう仏教でいう妄想ってめちゃくちゃ根本的な概念ではあるんですけど、例えば僕はこう、何て言うんですかね、神明ですみたいな、何か作家名とか、あるいは名字が神明なんで神明ですという名前でやってるんですけど、これも広い意味では妄想なんですよね。,Rose
しんめい,00:29:02:45,00:29:08:17,何かこう、そう思い込んでいるだけっていうか。,Rose
しんめい,00:29:08:21,00:29:25:30,この不確かな世界で、いつ死ぬか分からない。いつ病気になるか分からないから、今交通事故が起きて、僕も死んでしまうかもしれないっていう中で、何か自分は。 神という名前で本を書いていてみたいな。,Rose
しんめい,00:29:25:35,00:29:54:13,この不確かな世界で、いつ死ぬかわからない、いつ病気になるかわかんない、何か今こうと交通事故が起きて、僕も死んでしまうかもしれないっていう不確かな中で、何か自分はこう神明という名前で本を書いていてみたいな妄想ストーリー。それがみんなが共有していたとしても、ただの想像にしか過ぎなくて、そういったものがこの不確かな、次何が起こるかわからない世界で、何か一時的な確かさとか、この世界は多分今後も続いていくんだとか、自分というのはまだ生きて,Rose
しんめい,00:29:54:18,00:30:29:42,いられるんだとか、その仮初の妄想による安心感みたいなものを持って生きていると。それとこう何となく折り合いをつけながら、所詮は妄想なんだけども、こう、嗜好品みたいな感じで、こうふと虚しさが襲ってきた時に、将来のこと考えるとか妄想することによって、こう折り合いつけていくみたいなことをやってるなみたいな話をですね、ちょっと長くなったんですけど、大坪さんの話を聞きながらずっと思ってました。,Rose
しんめい,00:30:29:47,00:30:32:42,どうですかね。,Rose
しんめい,00:30:32:47,00:30:54:38,どうですかね、この何か。 僕の中ではカートと妄想を同じレベルで並べていいのかわかんないんですけど、広い意味ではその、こう仏教とか東洋哲学における渇愛の話とかにこう繋がるのかなと思って。,Rose
大坪,00:30:54:43,00:30:56:58,これまで散々カートの話をしておいて、何。,Lavender
しんめい,00:30:56:58,00:30:57:53,カートの。,Rose
大坪,00:30:57:57,00:31:02:17,話をして。 もカートばっかり簡単にとかって思われるのも心外なん。,Lavender
しんめい,00:31:02:17,00:31:03:45,はい。,Rose
大坪,00:31:03:50,00:31:13:17,これまで散々カートの話をしておいてなんなんですけど、イメージはカートばかり観てるのかって思われるのも心配なんですよね。噛まない人もいるし、噛みたくないとかって言う人もいるので、カートばっかり感じるって思われるのは心外なんですが、でもカートぐらい観たっていいじゃんというのはあるんですが。,Lavender
しんめい,00:31:13:17,00:31:14:21,というのが。,Rose
大坪,00:31:14:26,00:31:19:47,あるんですが。,Lavender
大坪,00:31:19:52,00:31:24:48,難しいですよ。,Lavender
大坪,00:31:24:53,00:31:49:17,本当にカートの話ばっかりしてると、本当にカートイメージカートばっかり観てるのかって話になっちゃうんですけど、昔、私が大学院生の頃かな、当時イエメンで唯一の英字新聞の編集長の田舎がちょっとサナアから車で56時間行ったところにあるおしゃれな靴で田舎に行こうってずーっとくっついてて。,Lavender
大坪,00:31:49:22,00:32:08:51,で、その編集長をおもちゃも英語もできるし、フランス語とかもできたのかな。留学経験もあるし。で、カートなんかヤギの餌だとかって言う人なんですよ、なんですけれども、何言って何をするかっていうと、午後村人を集めて、みんなカート噛ませて、自分は噛まないで全部口を切って死ぬわけで、だから自分はそのヤギの餌だとか言いながらも、ちゃんと人を集めて話を聞くには家族が必要な父親だってことは分かってる人なんだなと思いながら私は見物して,Lavender
しんめい,00:32:08:56,00:32:09:00,だ。,Rose
大坪,00:32:09:02,00:32:26:56,いました。エピソードだらけだと話が繋がらないんですけど。,Lavender
しんめい,00:32:27:01,00:32:35:50,とても良い話。なんか変人かとも客観で出るのは心外だって言いながら、この話は結構やっぱり観ているんだ。,Rose
大坪,00:32:35:55,00:32:40:54,でも何もなしで話をするってとっても大変なんですよ。,Lavender
しんめい,00:32:40:59,00:32:41:27,そうですね。,Rose
大坪,00:32:41:38,00:32:51:29,それから、私の誰でも何もなしで話をするってとっても大変なんですよね。だって、お茶とかもなく話をするのって、面接とか警察の取り調べくらいしかないよね。大学の授業で一方的に喋ってるって、それもちょっと不思議な状況であったりするんですけど、あんまり飲み物とか食べ物がないと、何かしながらじゃないと話にしにくいんで、歩きながら話をするとかってことになるし。,Lavender
大坪,00:32:51:33,00:32:55:06,はい。,Lavender
しんめい,00:32:55:06,00:32:55:41,はい。なるほど。,Rose
大坪,00:32:55:41,00:33:22:26,だから、だから二人でいるってのも難しいから、恋人同士はデートするんであって、どっか行こうってことになるんですね。だからやっぱり何かしないと話はできないんだなっていうのは、私が最近考えていることなんですけれども、学生に話をしても、学生はやっぱり話す時間なんて山ほどあるわけですよね。,Lavender
大坪,00:33:22:31,00:33:42:25,改めてお茶しようとか、食事しようとか飲まないとかって言って友達を誘うことは、そういう危機感は社会人になってからだと思う。大学生はよく分かんないんだろうなと思いながら学生って話をしたりもするんですけれども、大人になっちゃうとそんなこと当たり前になっちゃうんですけど。,Lavender
しんめい,00:33:42:29,00:33:50:15,対面で椅子に座って向き合って喋るよりも、今まさに。,Rose
大坪,00:33:50:20,00:33:51:24,この場所。,Lavender
しんめい,00:33:51:27,00:34:18:20,何かで対面で椅子に座ってこう向き合って喋るよりも、今まさにこう寝て隣同士でこう喋っている方がか、それは何かアレですよね。何か第三者として空気が入るみたいな感じというか、景色があるとか、カートもやっぱカートやるっていう目的があるとか、何か二人とか人と人で何かこう、カートはしんどいですね。,Rose
大坪,00:34:18:20,00:34:54:45,向かい合うのはしんどいです。 しんどいですね。 私、車の免許持ってないんですよ。なので沖縄って調査をするのはとても大変で、一番最初をどうしようか、タクシーで1日借り切ってやろうかと思ったんですが、結局例えばコーヒー作ってる人に話を聞いて、畑見せてくださいっていう時になると、結局その人にホテルまで迎えに来てもらって、助手席に乗っていくのが一番簡単なわけですね。,Lavender
大坪,00:34:54:45,00:35:11:31,すごい図々しいんですけれども、ただその畑まで行って10分とか20分とかかかったりするんで、行くまでに自己紹介も全部できちゃうんです。何でなんですか。何でカードなんですか？何時に来たんですかって話も全部できちゃうし。いつ頃からコーヒー始めたんですか？ まず始めたんですが、それが全部済んじゃって。しかも運転しながらだからそんなに気まずくならないし、景色の話をしたりですね。畑空いちゃって、もうほとんど聞くことがなかったです。,Lavender
大坪,00:35:11:36,00:35:16:58,たり。 は出来過ぎちゃって、もうほとんど聞くことがなかった。,Lavender
大坪,00:35:17:03,00:35:22:27,車っていいんだなって思って。本当に優しいんです。沖縄の皆さん、ありがとうございますを。,Lavender
しんめい,00:35:22:27,00:35:40:17,今聞いてくださってるかもしんないですけど。 確か車で僕よく運転するんですけど、助手席の人と喋る時って、ちょっとこう焚き火囲んでいるぐらいの感じの何かテンションで喋ってる感じがしますね。,Rose
大坪,00:35:40:22,00:35:41:36,なかなかいいです。,Lavender
しんめい,00:35:41:41,00:35:46:50,なかなかいいです。 何か喋ることがメインじゃないっていう気楽さっていうんですか。,Rose
大坪,00:35:46:50,00:35:50:15,沈黙になっても別に気に。,Lavender
しんめい,00:35:50:20,00:35:54:53,何なんかこう、喋ることがメインじゃないっていう気楽さっていうんですかね。そんなんでも別に気にならないっていう。,Rose
しんめい,00:35:54:58,00:36:29:57,だから本当はね、どうなんでしょう。カートとかもカートでもちょっとお茶しようとか、でもやっぱり関係性が先にあって、で、何かやることは実際は何でもいいって言うか、でも何か便利だから、そこにカートが選ばれたりとか、そんな感じなのかなっていう、その何かで、こう節々から伝わってくる、カート自体はどうでもいいみたいな感じって、結構それ自体面白いなというか。 うん。,Rose
しんめい,00:36:30:02,00:36:41:42,つながりみたいなものが関係性っていうんですかね。やっぱり先にやるって言い方していい。 んでしょうか。,Rose
大坪,00:36:41:47,00:36:48:55,ありがとうございますと何か。,Lavender
D,00:36:49:00,00:36:55:57,はドライブみたいな。,Violet
大坪,00:36:56:02,00:37:07:42,そうなんですよ。ワンちゃんを過ぎたりする。,Lavender
D,00:37:07:46,00:37:20:28,この後、この番組笑っ。 てくださいという、そういう。,Violet
D,00:37:20:33,00:37:21:29,はい。,Violet
大坪,00:37:21:34,00:37:29:12,紹介そうなんです。本を買いました。すいませんって言ってましたけども、読んでます。読んでますか？その話を先にしようかなと思ってすみません。受付で読んでおかないと上で買いますと。,Lavender
しんめい,00:37:29:12,00:37:33:09,すみません。ありがとうございます。,Rose
大坪,00:37:33:09,00:37:36:15,すみません。何かお気遣い頂いてありがとうございますを見て買いました。惚れてます。,Lavender
しんめい,00:37:36:15,00:37:38:09,と書かれてます。,Rose
D,00:37:38:13,00:38:05:00,その関係性をですね。この中で。 なきゃいけないことに気がついた男性っていうのが主人公の朝のインタビューというお話が最近、去年話題になった小説がまさにそれで、普段できないことをするというところがスタート地点だったりするんですけど、その話、雑談の風みたいな話って改めて展開できるのかというか。,Violet
D,00:38:05:05,00:38:15:57,がスタートするんですけど、今日に至ってはその話雑談の価値みたいな話って改めて全体的にどう学べるか。,Violet
D,00:38:16:02,00:38:23:47,いいものだという言い方もなかなか難しいんですけど。,Violet
D,00:38:23:52,00:38:25:46,雑談して。,Violet
大坪,00:38:25:51,00:38:27:12,も全部ありがとうございますって。,Lavender
しんめい,00:38:27:12,00:38:28:53,感じで好き。,Rose
大坪,00:38:28:58,00:38:47:13,中で、いやもう全部ありがとうございますという感じですけど、でもイエメンで私もあんまりおしゃべりな話をずっとしてましたけれども、あんまり言葉もできないかと聞いているんですね。それで怒られたことがあって、お前何で自分のこと話さないんだって。すごい言われたんですよ。,Lavender
大坪,00:38:47:20,00:39:07:26,喋っなきゃダメだって怒られて。私が喋ったってみんな興味ないんじゃないかなと思ってたんですけれども、すごい怒られたことがあって。そういうことをちゃんと私のこと見てる、見てる、観察してる人がいるんだなって思ったことがあったりもしたので、雑談しなきゃいけないっていう時は一生懸命頑張ってしゃべろうと思ってきてます。 口から滔々と喋るのはそんな得意なことではありません。,Lavender
しんめい,00:39:07:31,00:39:14:25,何でも雑談でこうこう。,Rose
しんめい,00:39:14:30,00:39:51:12,東洋哲学とかで割とアルアルのテーマなんですけど、こう、なんでもないものが大事だとか言って、何でもないものっていうものを意識した瞬間に、何でもないものじゃなくなるっていう。 典型的な話があるんですけどから、そうですね、何か雑談してくださいっていうの、今回のラジオのテーマとかも、その先生批判じゃないんですけど、矛盾をはらんでいるというか。雑談してくださいって結構雑談。今の雑談じゃなかったら雑談しなきゃとか思う瞬間があったりとかするっていうね。,Rose
しんめい,00:39:51:16,00:40:21:33,INTHEメガチャーチとかの話も、何か雑談ができないっていう悩みでね、めちゃくちゃ気持ちわかるんですけど、自分雑談できないんだって思っちゃうと、すごいドツボにはまる気がするというかね。なんか雑談っていう本当に何気ないもうものですら、何かそれができるできないみたいな軸で回収されちゃって、雑談できないことが悪いみたいな感じで、余計に体に力が入ってまたできなくなるみたいな、そういうループにはまるとか、すごくありそうだなって。,Rose
しんめい,00:40:21:38,00:40:38:39,それができるできないみたいな軸で回収されちゃって、雑談できないことが悪いみたいな感じで、余計に体に力が入って。,Rose
大坪,00:40:38:41,00:40:39:21,またできなく。,Lavender
しんめい,00:40:39:21,00:40:59:28,またできなく。 なっちゃった、できなくなる。 みたいな。 そういうループにはまるとか、そういう。 だから多分カードとかもやっぱりちょっと精神作用があるので、そういう何かしなきゃっていう脳みその機能を弱めてくれるからなんですかね。,Rose
大坪,00:40:59:33,00:41:01:10,そうなんですかね。,Lavender
しんめい,00:41:01:14,00:41:05:39,どうなんですかね。 何かどうでもよくなる。,Rose
しんめい,00:41:05:44,00:41:11:19,何かどうでもよくなるっていうか。今本題なんだっけ？とかっても別に考えなくて良くなるみたいな感じなんですかね。,Rose
大坪,00:41:11:23,00:41:19:47,そんなに強くないと思うんですけど。成分的にはネット上で話をしていいんですか？,Lavender
しんめい,00:41:19:47,00:41:20:55,そうですね、そこで。,Rose
大坪,00:41:21:06,00:41:24:55,そうですね。 患者話をするのはやばいので、ちょっとそこはいろいろ遠回しにしてるんですけど。,Lavender
しんめい,00:41:25:00,00:41:26:10,聞くところによると。,Rose
大坪,00:41:26:15,00:41:29:39,聞くところによると。 聞くところによると。,Lavender
大坪,00:41:29:44,00:41:44:33,日本人は普段からカフェイン摂取カフェは置いといてすいません。日本人は割と普段からお酒飲んでるのでとかでもそんなに聞かないっていうのは聞きますと酔っ払っちゃうような感覚まではならないと。私もそうなので、私が見てる限り、有名な人が酔っぱらっちゃってぐでんぐでんになってるようなところを見たことがないので。,Lavender
大坪,00:41:44:38,00:41:47:56,酔っ払っちゃうような感覚まではなら。,Lavender
しんめい,00:41:48:01,00:41:49:25,でもお酒ほど強くないみたいで。,Rose
