"Speaker Name","Start Time","End Time","Text"
"しんめい1","00;48;20;56","00;48;34;40","っていう感じですね。古着とかも古着ってちょっと上級者のイメージがあって、僕も同じで、私もそうですね。"
"しんめい1","00;48;34;45","00;49;13;44","やっぱ実際年齢もあると思うんですけど、こうやっぱ新品でぱりっとしてシワあんまない服とかってやっぱちょっと時代遅れでも様にはなるんですよね。でも何か古着ってやっぱりどうしてもクタッとしてるし、汚れ付いたりしてるのもあるし、あと今これが流行って、各デザイナーが今のトレンドを押さえて、今年はこれですっていう風に出してきてるものじゃないから、本当に自分の目利きだけで決めなきゃいけないから、なんかちょっと僕にはまだ早いなと。"
"しんめい1","00;49;13;45","00;49;23;23","下北ざわには古着屋さんたくさんありますけど、ちょっと自分には何か早いなとか思う。"
"大坪1","00;49;23;28","00;49;30;20","結構年をいってるので、昔の流行がまた戻ってきたなっていうか、分かっている。"
"しんめい1","00;49;30;25","00;49;33;09","ので。"
"大坪1","00;49;33;14","00;49;41;38","ずっと着てないスーツがまた着れないかなって狙ってたりもするんですけれども、そういうことにはならないと思うんですね。"
"しんめい1","00;49;41;43","00;50;04;03","今でもね。本当に。タックインていうんですか、シャツをズボンの中に入れたりとか、あと何かフレアーっていうんですかね、ズボンの裾が広く末広がりに広くなっていく形のものとか、やっぱりこう流行が1巡してるんでしょうか。"
"大坪1","00;50;04;06","00;50;05;27","今日入ってこようかと思ったんです。"
"しんめい1","00;50;05;27","00;50;05;58","けど、ああそうなん。"
"大坪1","00;50;05;58","00;50;08;38","ですか。さすがにジーパンはどうかなと思って。"
"しんめい1","00;50;08;43","00;50;09;24","たんですか。"
"大坪1","00;50;09;37","00;50;19;05","私のジーパンをずっとずっと置いておいたら、最近ちょっと履けるかなと思って入ってるのがあるんですが、今回はちょっとどうかなと思ってやめます。"
"しんめい1","00;50;19;18","00;50;22;33","それは入ってきて欲しかったですね。"
"大坪1","00;50;22;37","00;50;24;46","それこそ本当の古着です。"
"しんめい1","00;50;24;51","00;50;27;48","もうもうヴィンテージっていうか。"
"大坪1","00;50;27;53","00;50;31;37","10年10年ぐらい以上が一番です。"
"しんめい1","00;50;31;42","00;51;02;19","でもそれが格好いいですよね。何かインスタグラムとかでSNSとかで動画流れてきて、ファッションスナップが今何かちょっとこうショート動画みたいな感じで流れてくるんですけど、その街行く人に今着ている服ってどこで買ったやつですか？って聞いたら、結構若い女の子とかがこれお母さんが使ってたとか、おばあちゃん使ってたやつとか言って、めっちゃ格好良く着こなせる。"
"しんめい1","00;51;02;24","00;51;07;03","ね。多分そういうのが今格好いいんだろうなって思いながら見てますよね。"
"大坪1","00;51;07;08","00;51;10;26","着こなすっていうのが大切なんですよね。"
"しんめい1","00;51;10;31","00;51;25;08","着こなし大事らしいですね。それからなんかのYOUTUBEで勉強して、あの、何かいい服を買ってきたらオシャレなんだと思ったんですけど、何か同じぐらい、どの服を買うかよりも着こなしが大事だみたいな。"
"大坪1","00;51;25;08","00;51;36;39","ことを、時々INSTAGRAMなんかでこっちがまるでこっちが着こなすよっていうのが流れてきね。何がどう違うのかよく分から。どっちも素敵じゃないとか思っ。"
"しんめい1","00;51;36;43","00;51;55;17","ています。でも多分ね、差別化っていうか、その差分っていうんですか？っていうものを付けていく文化現象なんですよね。あれも。"
"しんめい1","00;51;55;21","00;52;12;44","学校制服とかでも崩して言うんですか。それで自分のステータスを示すというか、階層を示すみたいなところと繋がったり。"
"しんめい1","00;52;12;48","00;52;18;50","イエメンはいいですか？人間はイスラム、イスラム社会なんですよね。"
"大坪1","00;52;18;50","00;52;19;24","イスラム教徒。"
"しんめい1","00;52;19;26","00;52;26;56","ですね。だからイスラム教徒だと服装は決まってる感じですかね。これが一応フォーマルであるという、その。"
"大坪1","00;52;27;01","00;52;42;26","国によって違うんですけど、イエメンも地域によっていろいろ違う。男性は白いワンピースみたいにもあれば、巻きスカートを履いている。"
"しんめい1","00;52;42;30","00;52;42;47","ような。"
"大坪1","00;52;42;52","00;52;52;32","ところもあるし、普段はスーツで会社に行くけれども、週末はそういうワンピースみたいな女性は大体真っ黒けになってる。"
"しんめい1","00;52;52;36","00;52;53;05","そうなんですが。"
"大坪1","00;52;53;05","00;53;00;23","外に出る時、真っ黒の服を着て。"
"大坪1","00;53;00;28","00;53;09;34","すみません。"
"しんめい1","00;53;09;39","00;53;17;06","下のものが。"
"不明","00;53;17;11","00;53;29;31","ない人が多い。"
"D1","00;53;29;36","00;53;35;00","街のつくり方で。"
"D1","00;53;35;05","00;53;40;07","そこも結構狙って。こういう。"
"大坪1","00;53;40;12","00;53;59;29","このことはぶらぶらこの遊歩道をブラブラする場所であって。それついでにちょっと横っちょを曲がってお店覗こうかなっていうような場所ではないんですよね。ここの遊歩道は線路なので。"
"大坪1","00;53;59;34","00;54;06;18","歩く歩くとこですよね。無駄に歩きますよね。"
"大坪1","00;54;06;23","00;54;12;32","インターネットができています。"
"D1","00;54;12;37","00;54;14;07","頑張ってます。"
"大坪1","00;54;14;12","00;54;35;05","早稲田の学生の頃から飲み会とかですか？って言いましたけれども、なんでそんな駅から離れた店を選ぶんだって私は思っちゃう方で、駅前に飲み屋があるんだからそこでいいじゃんと思うんだけど、ずっと離れたところの方の店がいいのよって言われると、近くでいいじゃんって思っちゃう人間でした。"
"大坪1","00;54;35;06","00;54;40;11","私。"
"大坪1","00;54;40;16","00;55;00;32","そういう風に言うと、無駄をしてきたのか。いや、でも自分で歩くのは好きなんですよね。飲み屋だって近くていいじゃんって思うんですけど。いろいろフォローしてますけど。"
"大坪1","00;55;00;36","00;55;04;08","無駄ですかね。なるほどなるほど。そういうところを。"
"しんめい1","00;55;04;08","00;55;08;47","いろいろ聞いてみたいなって気がします。はい。"
"しんめい1","00;55;08;52","00;55;12;45","確かにそのままですよ。でも。"
"大坪1","00;55;12;50","00;55;28;47","その人にとって無駄じゃないんですよ。タバコを吸う人だってお金に火をつけてるなって思ったら、タバコは吸えないわけですから、無駄じゃないんだよね。他人から見ると無駄かもしれないけれど。"
"しんめい1","00;55;28;52","00;55;39;14","何かお話を伺ってると、この大坪さんは何か無駄か無駄じゃないかみたいな、何かこう、軸が一つ。"
"大坪1","00;55;39;19","00;55;47;34","なくて、そのカートの話を日本ですると、嗜好品だよって言うと、割と通じるんじゃないかな。嗜好品で英語にないので。"
"しんめい1","00;55;47;48","00;55;48;46","ああそうなんですか。"
"大坪1","00;55;48;51","00;56;06;49","ドイツ語から翻訳された言葉は他の言語にないんですよ、その言葉が。なので日本語では通じやすいんだけども、英語だともう通じなくなっちゃうんで、英語にするとラグジュアリー物って贅沢品になっちゃったりするんです。GOOGLE翻訳を使うと大体そうなっちゃうんですか？"
"大坪1","00;56;06;54","00;56;40;19","全然違うんだよなと思うんですけども、もう一つの概念が英語にはないので、あんまり国際的に研究できず、やっぱり英語の文献なんか読んでいると、やっぱりカートドラッグのニュアンスがすごい強いんですね。イメージをもう一度カートを上で働かないと家計にも良くないし、子供の面倒も見ないし、経済にも良くないと言うような批判を物凄いされる。"
"しんめい1","00;56;40;24","00;56;40;37","んだ。"
"大坪1","00;56;40;42","00;57;03;35","けれども、別にそのくらいかとか年間だっていいじゃん。で、我々が酒飲んでるし、大体1はけしからんって言ってる外国人も大体酒飲みながらそういうことを批判するので、イスラム教徒なのでほぼお酒飲めないような状況なので、カートくらい簡単にいいじゃんっていうのがあるので、多分そこで私はものすごい頑張っている部分があるんだと思います。"
"大坪1","00;57;03;40","00;57;11;16","無駄じゃないと言うか、カートぐらいいいじゃんってんですが。"
"しんめい1","00;57;11;20","00;57;21;38","何か大坪さんは個人としては無駄なことはあんまり好きじゃなかったりするんですかね。"
"大坪1","00;57;21;43","00;57;46;12","この企画で色々考えたんですけれども、私がやってることは無駄だとは思ってないのかなと思って。YOUTUBEをぼーっと見るのも別に気分転換だからいっかっていうことで、ものすごいこれが無駄な時間だったんだってもちろん思う時ありますけども、ダラダラ過ごすのもしょうがないよねって感じで。"
"大坪1","00;57;46;17","00;57;48;41","私は無駄がない人間だと思ってます。"
"しんめい1","00;57;48;41","00;57;48;59","みたいな。"
"大坪1","00;57;49;04","00;57;56;11","何でもやりながらこれは無駄だなって思うようなことありますか？"
"しんめい1","00;57;56;16","00;58;08;14","20代の頃はすごく思ってた気がしますね。今全く思わないですけど。今無駄がないと思っていますけど、20代の頃はやっぱり。"
"しんめい1","00;58;08;19","00;58;31;59","何でしょうね、会社勤めをしてて、IT企業に入って、で、土日とかをこう楽しいでもなく、何か自分の力が上がるようなわけでもないような、無為な使い方をした時に、無駄だったなって。こうちょっと自分を責めたりとかっていうことは。"
"しんめい1","00;58;32;03","00;58;45;04","あった気がしますね。今はもうずっと寝てるんですけどね。全く無駄だと思ってますね。"
"大坪1","00;58;45;09","00;59;09;41","逆に。でも若い頃はダラダラしなかったけど、家に行くとやっぱりそんなにね、自分の思い、自分が思う通り物事は動かないし、浮かんでクチャクチャお喋りするのと付き合わなきゃいけないし、結構ダラダラというか、時間を潰すのが出来るようになったかなと思うんですが、最近は結局スマホをいじって終わっちゃうっていう。"
"大坪1","00;59;09;46","00;59;22;15","なんとなくSNSを見て、なんとなく時間が潰れちゃうなって。だから逆にそういうぼーっとする時間は減ってきたかな。"
"しんめい1","00;59;22;19","00;59;37;43","大坪さんって大学の先生ですよね。何か。それで結構今のお話を聞いていると、ずっとからずっとずっとスマホいじってる人みたいな、一瞬聞こえたんですけど、バリバリお仕事されてますよね。"
"大坪1","00;59;37;44","00;59;38;18","いじってます。"
"しんめい1","00;59;38;18","00;59;39;57","よ。いやいや、先生ですか。"
"大坪1","00;59;40;02","00;59;54;29","なんでこんなすごい引いてる時間たっちゃうんだよって。若い頃スマホがなくて良かったなって思います。今の若い人偉いなと思います笑。"
"しんめい1","00;59;54;34","00;59;59;31","若い頃はその代わりに何されてたんですか？なんでスマホの代わりに。"
