Speaker Name,イン点,アウト点,文字起こし,色選択
大坪,00:00:05:48,00:00:11:56,なんでしょう。音楽聞いて、本読んで、漫画読んで。,Lavender
しんめい,00:00:12:01,00:00:14:27,んですかね。音楽はどんな音楽聴きたいか。,Rose
大坪,00:00:14:32,00:00:15:15,そんな話し。,Lavender
しんめい,00:00:15:15,00:00:27:34,音楽はどんな音楽を聞かれたんですか？ そんな話も。,Rose
D,00:00:27:39,00:00:30:09,イエメンの人たちはこんな話をしている。,Violet
大坪,00:00:30:14,00:00:50:00,イエメンの人たちはこんな話をしてる。 ああそうだそうだ。それがですね、奥寺さんから話をされてからずっと記憶をたどっているんですけれども、本当に大した話はしてないんですね。記憶に残ってないんですよ、あれですけども、本当に同じようなメンバーで会うので、昨日の話の続きを普通に始めるわけですね。,Lavender
大坪,00:00:50:04,00:01:23:19,あるいはテレビを見ながら、ニュースを聞きながら、ドラマを見ながら何かやるので、何の話をしたかって全然覚えてなくて。外国人がいると、例えば日本の仏教ってどういう宗教なのとかっていうのを聞かれたりとか、そこから発展して神学っぽい話になったりもしますけれども、普段からそんなガチで真面目な議論をバリバリするわけではなくて、何かだらだらと話して、何となく沈黙が来てコソコソと話したり、みんなで話したねっていうことがあるので、全然ネタとして広まらないんです。,Lavender
大坪,00:01:23:19,00:01:25:46,みんなで話言うことが全然ネタとして広まらないんです。,Lavender
しんめい,00:01:25:51,00:01:48:07,すいません。 でも結構雑談って色々あるじゃないですか。例えば本当に昭和のサラリーマンの飲み会とかあって、愚痴大会みたいな感じになってたりとか、もうちょっとこう、例えば井戸端会議みたいな、昔からだったら多分もうちょっと当たり障りのない話とか噂話とか、何。,Rose
大坪,00:01:48:11,00:01:51:51,で。 て。,Lavender
しんめい,00:01:51:51,00:01:52:47,ね。,Rose
大坪,00:01:52:52,00:02:04:40,だと、男性と女性って分かれてカードを買うんですね。女性陣の中で。私のアラビア語の問題かもしれませんが、姑とか夫の悪口はほとんど喋ってなかった気がするんです。,Lavender
大坪,00:02:04:44,00:02:23:40,人の悪口を言ってる時はあるんですけれども、うちの姑がとか家の外とか、そういう悪口を延々と愚痴るってことはあんまりなかったかなって思うんですよね。第1話嫁姑問題がないのかっていうとまたそれは別なんですけれども、こっちが聞いてなかったかなって。,Lavender
大坪,00:02:23:44,00:02:32:16,それおそらく毎日おしゃべりすることでガス抜きができてるんじゃないかなと私は思うんですけれども。1日30時間お喋りするんですよ。日本じゃ考えられないでしょ。,Lavender
大坪,00:02:32:21,00:02:38:24,1日30時間お喋りするんですよ。日本じゃ考えられないでしょう。,Lavender
しんめい,00:02:38:29,00:02:39:45,日本じゃ考えられない。,Rose
大坪,00:02:39:50,00:02:41:26,僕。,Lavender
しんめい,00:02:41:31,00:03:14:14,毎日します。 僕多分そういうのを、少なくとも子供の頃はすごい嫌だった。 よくよくわかるのわかるな。 気持ちは毎日なんですけど、毎年うちの実家に親戚が集まってきて、で、毎年全く同じ話を。 昔あそこに木があってそうみたいな。でも何かその木がなかったみたいな。僕らの話を全く同じ話を毎年する。わかる？ちょっと嫌で嫌で仕方なかった。,Rose
大坪,00:03:14:18,00:03:17:13,それが毎日行ってる感じですよね。,Lavender
しんめい,00:03:17:18,00:03:18:01,やっぱそうなんです。,Rose
大坪,00:03:18:12,00:03:47:03,何かよく分からなかったです。だからそれが毎日行われてる感じですよね。だからそのお話をしてお喋りをして、毎日お喋りして、社交する時間が34時間あるっていうと、すごい綺麗事なんですけれども、親戚づきあいもものすごいたくさんあるし、従兄弟とかはとこなんて束になって付き合わなきゃいけないことがあるので、人間関係っていうか、親戚づきあいはものすごい大変で。 その中でまたお喋りしていくっていうんで、それは多分羨ましいなでは済まない世界だと思いますね。,Lavender
しんめい,00:03:47:07,00:04:19:39,"だから多分そうか。想像ですけど、こうこう、国の制度とか社会システム、もうちょっとゆるめのものとか、そういったものがバチっとあれば、そんなにこう、親戚とか血縁だったり、1,000円の集団で助け合うっていう必要が多分なくなってきて、そういう日々の雑談とか関係を強化するみたいな必要が薄らいでいくのかなっていうふうに思って。",Rose
しんめい,00:04:19:52,00:04:30:38,なんかイエメンとかの場合だと、そこら辺がやっぱりどういう集団なんですかね、血縁集団で助け合う。,Rose
大坪,00:04:30:42,00:04:49:38,すごい平たく言うと社会福祉なんかほとんどないし、国には頼れないから自分たちでやんなきゃいけないっていうのはありますよね。言ってしまえば。そう言うと面白くないんで、あんまり言いたくないんですけど。だから親戚づきあいが大切だっていうのが何か面白くないなと思うんですけれども。,Lavender
しんめい,00:04:49:43,00:05:00:34,必要ないなと思うんですが。 何かある種のリアリティーというか、例えばカートで毎日3時間話してて、多分僕あんまり耐えられないタイプなんですけど、同じ話をするのか。,Rose
大坪,00:05:00:39,00:05:09:16,しかも人がまたお客さんが来ると、おんなじ話をまた延々とする場が3、4回おんなじこと状況です。,Lavender
しんめい,00:05:09:21,00:05:34:08,それをちょっとしんどいなと思って、もう参加しないみたいなことを。なんか割とみんな面倒くさいと思ってるのか、もう何か意外とそうでもなくてなのか、面倒くさいと思ってるけど、その何かカートの会から抜け出したらちょっと孤立しちゃうみたいなプレッシャーとか。,Rose
大坪,00:05:34:13,00:05:41:58,それは私がイエメン最後に行ったのが2013年なので最新の話じゃないんですが。,Lavender
大坪,00:05:42:03,00:06:06:44,割とそのやっぱりカードを買うのは時間も金の無駄になるから嫌だって言って、自分は勉強したいとか仕事をするんだって言う人はいるので、それはOKなんですね。ただ、カードの研究が始まったのは1970年代くらいから人類学者が調査を進めてるんですけれども、その頃の研究を読むと割と昭和の酒じゃないけれども、絶対飲まなきゃいけない、買わなきゃいけないというルールがあったような感じがしますね。,Lavender
大坪,00:06:06:48,00:06:09:43,何もかもなきゃいけないか。,Lavender
しんめい,00:06:09:50,00:06:10:34,ああ。,Rose
大坪,00:06:10:38,00:06:29:34,だから、その後、ちょっと緩くて買わないっていう選択肢も増えてきた。あとは一人で買うのが好きだって言う人もいますんで。あとは店番しながら一人でずっと観てるとかはちょっと自由にはなってきてるかなと思いますけど。でも形としては昭和とか平成の酒の付き合いに近いですかね。,Lavender
大坪,00:06:29:39,00:06:54:35,で、女性の方は割と構わないで紅茶とか飲んでおしゃべり、付き合うっていう人は結構いるんですけども、男性の方だと割とみんな観てるで構わない。人は別に弾いてるわけじゃないんだけれども、やっぱり噛まないと入りにくいのかなという気がするので、男性の方がやっぱり噛まないと付き合いが悪くなる感じはしてました。,Lavender
しんめい,00:06:54:35,00:06:55:11,いう気がする。,Rose
大坪,00:06:55:11,00:07:02:48,構わない人は恥じてるわけじゃない。噛まないと入りにくいか。 付き合いが悪い。,Lavender
しんめい,00:07:02:53,00:07:07:17,まさにビールとか飲み会における。,Rose
大坪,00:07:07:22,00:07:08:29,の酒が飲めないのか。,Lavender
しんめい,00:07:08:37,00:07:11:57,まさにビールとか飲み会における酒飲めないのかという。,Rose
大坪,00:07:12:02,00:07:25:04,俺の酒が飲めないのか認めないのか。だからそれがいいとは思わないですけどね。私よ、個人的に。でも人付き合いってそういう無駄がないと続かないんだよなっていうのがあります。,Lavender
しんめい,00:07:25:09,00:08:15:42,結局、親戚が毎年集まるっていうのがある。僕は多分10歳ぐらいまでは続いたと思うんですけど、やっぱりね、こう時代も相まって多分変わりますよね。やっていて、もうほとんど何か親戚が毎年集まるみたいなことなくなって。 僕今37歳なんですけど、母親が当時では珍しくて、40歳の時に僕を産んでるんで、もう78とかのいわゆる団塊の世代で、母親が去年ちょっと倒れまして。で、その時に結局今いろんな介護保険とかいろんな制度は当然使うんですけど。,Rose
しんめい,00:08:15:47,00:08:39:49,やっぱり親戚とかが割と毎日のように病院とか来てくれたりしてて、何かああいう変な目線ではあるんですけど、ああいう風に親戚の集まりやってたのって、例えば今本当に倒れたりした時に、こういう形で繋がりが何か出てくるんだなと思ったりすると、すごい変なメッセージなんですけど、やっぱりこう。,Rose
しんめい,00:08:39:49,00:08:46:33,そうですね。すごい変な目線なんですけど、やっぱりこう。,Rose
しんめい,00:08:46:38,00:09:00:41,年齢重ねてこう体も弱くなっていってなっていった時に、最後こう繋がれるのは、そういう昔本当にいても毎年全く同じ話をした中の人なんだな。,Rose
大坪,00:09:00:55,00:09:04:17,それはお母さん方の方ですか、お父さん方の方ですか。,Lavender
しんめい,00:09:04:22,00:09:06:41,そうですね、両方。,Rose
大坪,00:09:06:46,00:09:15:01,で。 両方ですね。 じゃあ、お母さん方は嫁として入った方じゃなくて、自分の方の親戚で。でも、でも面。,Lavender
しんめい,00:09:15:06,00:09:38:15,お面そうですね、メインは。でも父方かもしれないですね。母も本当に毎年そこで会ってた人たちで、やっぱりこう助け合ってっていう。,Rose
しんめい,00:09:38:19,00:09:46:24,やっぱりこうそれで大事なんだなっていうのも、何かこう変な話なんですけど。,Rose
しんめい,00:09:46:29,00:09:51:31,これからそういう。,Rose
しんめい,00:09:51:36,00:10:21:55,今の話って無駄か無駄じゃないみたいなところで考えた時に、ちっちゃい頃の僕は毎年集まって同じ話をするのはもう本当に言ってしまえば無駄だなっていうふうに感じたんですけど、本当に無駄ではないっていう、もうめちゃくちゃ物凄く現実的な、例えば利益にも繋がってるわけで、それは時間を超えた利益ですけど、だから関係なのかどうかって。,Rose
しんめい,00:10:21:59,00:10:40:21,だから無駄かどうかってすごい。どの時点でどんな目線で考えるかによっても当然どんどん変わってくるし。 今、下北沢の街もちょっと。,Rose
しんめい,00:10:40:25,00:10:54:54,緑を植えても利益にはそんな繋がりづらいと思うんですけど、何らかね、多分、鉄道会社の方でも長期的には利益に繋がるだろうという。ところでやっぱり。,Rose
しんめい,00:10:54:59,00:10:56:05,ところでやっぱり。,Rose
大坪,00:10:56:09,00:11:03:15,利益に繋がるだろうって考えてる時点で無駄じゃないよなって思っちゃうんですけど。,Lavender
しんめい,00:11:03:20,00:11:45:21,けど。無駄かどうかっていう軸で考えることはそれなりに乏しいことだとは思うんですけど、でも単純に無駄だって言ってる目線が時間軸をちょっと変えると無駄ですらない、というか、何かそういう何か面白さはあるのかなと。カートの話も多分近視眼的に国全体で無駄で生産的じゃないことをしてるっていう風に評価することも可能だと思うんですけど、それをもちろんそれ自体の豊かさっていうのがある前提で、何か何10年かした後に、いや結局こっちの,Rose
しんめい,00:11:45:26,00:11:56:04,もちろんそれ自体の豊かさっていうのがある前提で、何か何10年かした後に結局こっちの方が合理的ですらあったじゃんっていう評価になり得ることももしかしたらあるのかなと。,Rose
しんめい,00:11:56:09,00:12:00:21,ですかね。,Rose
大坪,00:12:00:26,00:12:01:28,綺麗にお蕎麦屋。,Lavender
しんめい,00:12:01:28,00:12:04:07,二人であっ、それですごい綺麗に収まったんだな。,Rose
大坪,00:12:04:07,00:12:08:37,お二人の話。で、謎にめっちゃまとめようとしたりして。変な話すいません。若者はそうなんですか。,Lavender
しんめい,00:12:08:42,00:12:14:38,でも、でも最近の若者は買うと買わなくなってきてるんですよ。,Rose
D,00:12:14:43,00:12:24:23,はい。さっきちょっと出ましたけど、ラグジュアリーと訳される。,Violet
D,00:12:24:28,00:12:28:31,英語が面白かったとか。,Violet
D,00:12:28:36,00:12:33:09,そういうグローバリゼーションじゃないですか。そういう話。,Violet
D,00:12:33:14,00:12:36:17,グローバリゼーションじゃないですけど、何かそういう話になるのかなっていう。,Violet
大坪,00:12:36:22,00:12:36:50,広げましょ。,Lavender
しんめい,00:12:36:50,00:12:41:45,そっち広げましょうか。,Rose
D,00:12:41:50,00:12:47:17,という言葉。,Violet
D,00:12:47:22,00:12:52:04,アメリカのことなのかなっていう話と。,Violet
D,00:12:52:09,00:12:57:14,を文化人類学的ですよね。アメリカの英語の。哲学的な。,Violet
D,00:12:57:19,00:13:02:12,感じはその言葉について何か。,Violet
大坪,00:13:02:17,00:13:36:44,って今何だっけ？今一瞬思い出してるんだっけな。だから文化人類学でも嗜好品の研究っていうのはなくはないんですが、結局インターナショナルにならないんですよね。すごい人って言葉がないので。なので話をしたくて、ビールの研究だとかコーヒーの研究っていうのはいろんな学問でされてますけれども、じゃあビールを飲んでる人たちはコーヒーを飲まなかったかと。,Lavender
大坪,00:13:36:49,00:14:01:17,そういう研究は全然ないんですよ。なので嗜好品の研究ってなかなか国際的にならないんですが、ちょっと待ってて、話をどこに持っていこうと思ったかと思ってたんだけど。なので、すいません、自文化人類でも嗜好品であんまり研究は盛んかっていうと、日本ではできているけれども、国際的にうまく展開できてないんですっていう話でいいのかな。,Lavender
大坪,00:14:01:22,00:14:20:28,アルコールとカフェインを一緒に議論するって、イスラム圏ではもちろん無理ですし、なかなか。だからカードが理解されずに薬物になっちゃってるって。欧米諸国だとカードはもう薬物違法薬物になっちゃうので。,Lavender
しんめい,00:14:20:33,00:14:21:47,ニュアンスとして違法。,Rose
大坪,00:14:21:52,00:14:22:37,本当にそうです。,Lavender
しんめい,00:14:22:42,00:14:23:48,本当にそうなんですね。,Rose
大坪,00:14:23:53,00:14:28:28,本当に違法です。本当に日本の日本なんです。なので。,Lavender
しんめい,00:14:28:33,00:14:31:10,日本でカードはできない。,Rose
大坪,00:14:31:15,00:14:40:08,日本でカードは。 最近調べてないのでちょっと分かんないんですが、多分ないんじゃないかと。自身は多分カード自体は禁止じゃないと思います。すいません。,Lavender
しんめい,00:14:40:13,00:14:44:49,じゃない。 ほぼ輸入されてない。,Rose
大坪,00:14:44:54,00:15:09:44,じゃあ欧米で薬物になっちゃうようなものを、じゃあイエメンとか1億円とか東アフリカの人達がやってるのやっぱり人達なのかっていうと、結局欧米諸国でカードが禁止されたっていうのは、1980年代とか90年代にソマリアの東アフリカのソマリアの内戦が激化して、欧米に逃げていって、その時にカードも一緒に空輸されてたんですね。,Lavender
大坪,00:15:09:57,00:15:30:22,それで広まった。で、例えばイギリスのロンドンにしましょう。街にその炎症がやってきて、難民申請して、で、英語もよくわかんないし、仕事もしないで難民申請してるか、仕事もできないし、何も昼間からぶらぶらしていて、カードばっかりでけしからんっていう、その辺からカードが禁止されてるんですね。,Lavender
大坪,00:15:30:27,00:15:34:39,だから難民移民問題を。,Lavender
大坪,00:15:34:44,00:15:53:16,スケープゴートにしてるっていうのが、多分カードのせいにしているっていう部分はあるんで、私はそう理解してるんですが、カードに含まれているナントカっていう成分が危ないって説がされるんですが、それよりも何も難民移民問題と絡めて禁止されたという経緯が。,Lavender
大坪,00:15:53:21,00:16:14:19,なんでそんなに名前が葉っぱなので危ないものじゃないと私は理解してるんですけど。それでその成分を抽出すると、その危ないドラッグにはなっちゃうんですけど。ただ、世界的に見るとやっぱりカードは薬物扱いされつつあるのかなって気はしてまして、欧米にヨーロッパにいる時にちょっとインタビューしたことあるんですけども、カードが禁止になってからカード上なくなったカードがなくてもそんなに困らないっていうか、カードがないからイエメン人のアイデンティティが保てないとか、そんな話じゃないわけですよね。,Lavender
大坪,00:16:14:23,00:16:27:36,ヨーロッパに。,Lavender
しんめい,00:16:27:36,00:16:28:07,か。,Rose
大坪,00:16:28:12,00:16:31:57,困らない。カードがないからとかそんな話じゃないわけ。,Lavender
しんめい,00:16:31:57,00:16:33:19,です。,Rose
大坪,00:16:33:23,00:16:56:50,たかが嗜好品ですから。色々話を聞いてると、やっぱりドイツなんかだと生活が忙しいわけですよね。平日は仕事しなくちゃいけないし。で、週末は子供をイスラムの学校に行かせたり、家族の時間を作らなきゃいけないっていうことで、毎日3時間カードなんか感じない、生活のリズムとも関わってくるのかなっていうことがありますし。,Lavender
大坪,00:16:56:50,00:17:32:15,で、韓国での調査もしてるんですけども、若い人たちはカードをイエメンで楽しめずに国を出てるんですね。内戦でとりあえず国を出て、マレーシアあたりで経営してて、マレーシアだと合法的に滞在できないんですね。アラブレストランで皿洗いするくらいしか仕事がないので、じゃあどうしようかっていうことで韓国までやってきたっていう人たちが500人ぐらいいるんですけれども、そういう彼らの若い世代になると、カードはお父さんが好きなものだと言って、あんまりに最近の若い人達はカードを買わないん,Lavender
しんめい,00:17:32:15,00:17:33:51,が。,Rose
大坪,00:17:33:56,00:17:44:26,だなってあるので、時代は変わってきてるんですね。,Lavender
大坪,00:17:44:31,00:17:48:16,年配の方にものすごい受ける。,Lavender
しんめい,00:17:48:21,00:17:49:16,そうですね。,Rose
大坪,00:17:49:20,00:18:21:43,あと、年配の方にカードの話をすると、ものすごい受けるんですけどね。いろんなどこそこのカードが美味しいとかっていう調査は散々したので、そういう話をすると、ほんとにイエメンで調査をしてきたっていうことになるわけですね。なんで？だって韓国なのになんで日本人が調査に来てるんだっていうことが、それで彼らにとってわかりやすいんですね。 これはイエメンで調査を指摘してきましたって、カードでこういうのがありますよってことを話すとすごい理解されやすいってのがありましたけど。,Lavender
しんめい,00:18:21:48,00:18:32:51,でもすごい、そういう国境の言い方というか、韓国に話が行くんですね。 そこで、それこれ。,Rose
大坪,00:18:32:55,00:18:48:04,日本にも何人か来てるんですけれども、何せ難民認定されてる人もいるんですけれども、そちらはちょっと個人情報の関係でアクセスできず、韓国の方が私はうまくアクセスできました。,Lavender
しんめい,00:18:48:09,00:18:54:06,今、これはね、もう最近は行かれてないと思うんで。,Rose
しんめい,00:18:54:10,00:19:14:37,今、これはね、もう最近は行かれてないと思うんで。ただの、それこそ雑談みたいな話題ですけど、今ね、イランが戦争状態になっていて、で、イエメンも関係するエリアにはあると思うんですけど、そこで例えばカートを嗜みながら、そういう話はしそうな感じなんですか？,Rose
大坪,00:19:14:37,00:19:18:08,ですかねと思い。,Lavender
大坪,00:19:18:13,00:19:40:58,知ってると思いますよね。雑談ばっかりしてるってさっき言っちゃいましたけれども、それのフォローになるのかな。私がいた頃って、そんなにインターネットが発達していなかった時代だったんですけれども、例えばイエメンで国会議員の選挙があったりすると、翌日、新聞は全てスタンドで売られてるもので、配達されないものなんですけど、新聞を買いに行くともう売り切れちゃってるんですよ。,Lavender
しんめい,00:19:41:00,00:19:41:58,ものなんですけど。,Rose
大坪,00:19:42:02,00:19:59:37,みんなみんなが買うんですよね。それでみんなが情報を仕入れて、おそらくカードを感じながらまた情報を共有するってことで、そういう情報交換の場でもあったんだろうなっていうのはあります。,Lavender
しんめい,00:19:59:42,00:20:15:53,そういう意味では、もしかしたらネットとかSNSとかで代替される機能、結構海外の場でも担われてて、何かネットの普及とかでみんなあんまりカートやんなくなったみたいなこともあり得るんですかね。,Rose
大坪,00:20:16:02,00:20:23:05,あるんですかね。ただ、顔とか見ながらスマホをいじってるんじゃないかなと思うんですけどね。,Lavender
しんめい,00:20:23:10,00:20:44:30,やっぱそこはだから何らかの。アッパーなのなのかどうなのか分からないですけど。 どちらかというとやっぱそういった。 身体に効く奴って言うんですかっていうものは大事っていうことなんですかね。,Rose
大坪,00:20:44:35,00:20:58:45,1は経営の成分が入っているんですが、それを求めてやってるっていうよりも、人と会う口実ですよね。カード噛まないって言ってずっとお喋りするということなので、そんなに強くないんじゃないかなと思ってます。成分的に酒も入っ大丈夫か？,Lavender
大坪,00:20:58:49,00:21:09:14,ない。 すごくないかなと。,Lavender
D,00:21:09:17,00:21:12:45,やっぱり。,Violet
D,00:21:12:50,00:21:16:01,みたいな。,Violet
