"Speaker Name","Start Time","End Time","Text"
"しんめい1","00;23;58;38","00;24;07;17","そのその横の古着屋さん連続ですね。多分この辺って安くないですよね。"
"大坪1","00;24;07;20","00;24;10;37","違わが少ないですよね。"
"しんめい1","00;24;10;41","00;24;27;37","それでも成立するぐらいには古着屋が並んでいるんですね。"
"大坪1","00;24;27;42","00;24;30;02","また、古着屋。"
"しんめい1","00;24;30;07","00;24;43;20","また古着屋、古着屋、このここの一つ交差交差点というか、路地に入るまでに5軒ありましたね。もっと下、すごい。"
"大坪1","00;24;43;25","00;24;48;37","反対側と、いや。"
"D1","00;24;48;41","00;24;51;36","電柱を探す。"
"大坪1","00;24;51;41","00;24;54;08","ちょっと。"
"大坪1","00;24;54;12","00;24;56;18","でもどうなるか。"
"しんめい1","00;24;56;22","00;25;04;05","何か埋まってますか？"
"大坪1","00;25;04;10","00;25;09;39","ありますあるかもしれませ。"
"しんめい1","00;25;09;44","00;25;20;15","何か？確かに新しい感じの古着屋さんがいくつかあるように見えますが。"
"しんめい1","00;25;20;20","00;25;37;37","やっぱりみんな今古着の価格帯でないと買いづらい感じなんですかね。か。洋服の価格ってすごい高騰してるんですよね。この間、僕もさすがに。"
"しんめい1","00;25;37;42","00;25;41;27","ちゃんとした服買わなきゃと思って革靴買ったんですけど。"
"大坪1","00;25;41;36","00;25;42;10","革靴です。"
"しんめい1","00;25;42;10","00;25;54;26","か。革靴がやっぱすごい値段が高くなっているらしくて。その物流の話から何か僕もいろいろややこしい話をいっぱい聞いたんですけど、とにかく。"
"しんめい1","00;25;54;31","00;26;08;19","少なくとも嗜好性の高いラグジュアリーブランドの服とかはどんどん高騰してて。"
"しんめい1","00;26;08;24","00;26;28;06","古着は古着だとどうなんでしょう。さすがにちょっと安いんですよね。"
"しんめい1","00;26;28;11","00;26;42;27","大坪さんは嗜好品でいうと、ご自身が。好きでやってる私にとっての嗜好品って何ですか。"
"大坪1","00;26;42;32","00;26;48;34","自分の身近なのは日本茶なんですよ。"
"しんめい1","00;26;48;39","00;26;50;43","日本酒なんですか？"
"大坪1","00;26;50;48","00;26;52;08","コーヒーは。"
"しんめい1","00;26;52;13","00;26;52;45","自分で。"
"大坪1","00;26;52;45","00;27;03;50","入れると美味しくないんですね。これがコーヒーはもので、一番のものは日本じゃ。"
"しんめい1","00;27;03;54","00;27;09;26","日本茶も色々お好みのものがあるんですかね。"
"大坪1","00;27;09;31","00;27;11;25","スーパーで買った戦争です。"
"しんめい1","00;27;11;26","00;27;16;14","ああ、そうですか。"
"大坪1","00;27;16;19","00;27;32;18","あんまり私は味覚はそんな敏感じゃないので。研究しているので分かってそうな顔をするんですけれども、全ておいしゅうございますって言って飲んでます。"
"しんめい1","00;27;32;23","00;27;37;27","お一人で飲むんですか？どんな味のものですか？"
"大坪1","00;27;37;32","00;27;41;19","教えて。一回でもいい家で水替わりになります。"
"しんめい1","00;27;41;24","00;27;50;46","そうなんですね。じゃあもですね、温かい煎茶をわりとガブガブガブガブ。"
"しんめい1","00;27;50;50","00;27;55;33","それは研究される時のちょっとガソリンみたいな感じに。"
"大坪1","00;27;55;38","00;27;57;33","なっていた。全然関係ないです。"
"しんめい1","00;27;57;40","00;27;58;25","ああ、そうなんですか。"
"大坪1","00;27;58;29","00;28;01;53","何か。"
"大坪1","00;28;01;58","00;28;18;15","頭使わなくちゃとかって言う時は、近所のコーヒー屋さん行ってコーヒーの音がしますけど、日本茶はエネルギーにならないです。"
"大坪1","00;28;18;20","00;28;23;33","あとはチョコレートを食べるとかですかね。"
"しんめい1","00;28;23;38","00;28;32;15","結構。でもお茶がぶがぶ飲まれて、コーヒーもたまにだと割とカフェインは摂取量多い方。"
"大坪1","00;28;32;19","00;28;37;29","結構とってると思います。"
"しんめい1","00;28;37;34","00;28;39;08","眠れなくならないんですか？"
"大坪1","00;28;39;13","00;28;40;47","それは全然平気ですね。"
"しんめい1","00;28;40;50","00;28;41;41","平気ですか？"
"大坪1","00;28;41;46","00;29;01;18","コーヒーは大学生の頃は夜飲むと眠れなくなっちゃったりすることがあったりします。最近そんなに夜コーヒー飲んだりしないので。"
"大坪1","00;29;01;22","00;29;05;15","清水さんは何か好きな飲み物はありますか？"
"しんめい1","00;29;05;20","00;29;20;52","飲み物はお酒とかもほとんど飲まないんで、コーヒーも寝れなくなっちゃうんであんまり飲めず。お茶はほうじ茶好きですね。ほうじ茶が好きです。"
"大坪1","00;29;20;57","00;29;22;45","最近流行ってますよね。"
"しんめい1","00;29;22;50","00;29;42;17","あ、でも確かペットボトル飲料とか。でもほうじ茶って昔あんまりなかった気がするんですけど、コンビニのプライベートブランドとかでもあったりとかするし。あとほうじ茶の飲みすぎて飽きて、今玄米茶にでき。"
"しんめい1","00;29;42;22","00;29;53;16","ちゃったから、もうちょっとカフェイン少な目の優しいめのやつが好みになってきました。"
"しんめい1","00;29;53;20","00;30;20;12","頭でもチョコレートを。そうですね、昔から食べてますね。何か昔何かこう、20代、20代の時とか、何かヤンキー怖がって、彼らは何でタバコ吸うんだろうなって、何かすごい真面目に不思議に思ってた時があった時に、自分にとってはチョコレートと一緒なのか？"
"しんめい1","00;30;20;19","00;30;26;51","て思った時に、何か正しいかわからないですけど、腑に落ちた感覚があって。"
"大坪1","00;30;26;56","00;30;27;58","昔の不良。"
"しんめい1","00;30;27;59","00;30;29;39","って。"
"大坪1","00;30;29;43","00;30;37;46","お酒飲んでパーマしたりとかって、結局大人の真似事をしていたんじゃないかなと思う。"
"しんめい1","00;30;37;51","00;30;44;16","大人の真似事。"
"しんめい1","00;30;44;21","00;30;51;53","すいません、ごめんなさい。"
"大坪1","00;30;51;58","00;30;57;18","お酒もに関しても理解しない。お茶も。"
"大坪1","00;30;57;23","00;31;04;47","苦いものは大人の味。"
"しんめい1","00;31;04;51","00;31;18;40","大坪さんの学生時代、中学校とか高校時代って不良とかいたんですかね。バリバリ不良ってNHKのラジオで言っていい言葉なんですかね。大丈夫ですか？です。"
"大坪1","00;31;18;41","00;31;25;20","です。いましたました。私の中学校にはいなかったですけど。"
"大坪1","00;31;25;25","00;31;28;47","中学校に。"
"大坪1","00;31;28;52","00;31;32;36","入ったような下です。"
"しんめい1","00;31;32;44","00;31;33;24","すごいです。何か。"
"大坪1","00;31;33;34","00;31;34;09","すごいです。"
"しんめい1","00;31;34;12","00;31;43;01","露店、マーケット、露店のマーケットですね。古着の女上がるんだろうなっていうのが。"
"大坪1","00;31;43;06","00;31;45;26","何かの広場っていう名前がありますよね。"
"しんめい1","00;31;45;31","00;31;48;35","あ、そうなんですね。"
"しんめい1","00;31;48;40","00;32;06;27","覚えすごいシルバーのアクセサリーがいっぱいと。どれくらいですかね。結構下北沢の東口の一角が全部。"
"大坪1","00;32;06;32","00;32;07;14","黄色。"
"しんめい1","00;32;07;19","00;32;15;40","マーケットになってますね。"
"しんめい1","00;32;15;44","00;32;23;55","イエメンのカートのみんな葉っぱを食べてるところって屋外で食べてるんですか？"
"大坪1","00;32;23;55","00;32;26;11","大体誰かの家で噛むことが多いですね。"
"しんめい1","00;32;26;16","00;32;27;06","おうちなんですね。"
"大坪1","00;32;27;15","00;32;29;20","そうなんです。"
"しんめい1","00;32;29;25","00;32;32;57","じゃあこれ外って感じじゃないんですね。今いる？みたいな。"
"大坪1","00;32;33;02","00;32;48;57","たまに週末ちょっと郊外に行って、外で何かっていうことはなくないわけじゃないです。"
"しんめい1","00;32;49;02","00;32;49;40","何かちょっと見。"
"大坪1","00;32;49;40","00;32;50;02","ましたが。"
"しんめい1","00;32;50;02","00;32;53;09","白い服ふく。"
"大坪1","00;32;53;14","00;32;54;14","ふく。"
"しんめい1","00;32;54;19","00;32;58;03","ふく壽ふく壽ってひたすら書いてるんですかね。"
"大坪1","00;32;58;04","00;32;59;49","これはふくふくふく、これ。"
"しんめい1","00;32;59;50","00;33;04;37","は羽織ですね。何か。"
"しんめい1","00;33;04;41","00;33;09;19","すごいです。これでいくらぐらいなんだろう。7,000円か。"
"大坪1","00;33;09;24","00;33;10;37","安いのか高いの。"
"しんめい1","00;33;10;37","00;33;16;38","か、ちょっとあれですね、必要なぐらいふくらって書いたんですね。"
"大坪1","00;33;16;42","00;33;25;33","地方の気分が分かんない。"
"しんめい1","00;33;25;38","00;33;30;16","ふくはお好きだったりしますか？いや。"
"大坪1","00;33;30;21","00;33;41;39","どうなんですかね。広い意味で会うのが。"
"大坪1","00;33;41;44","00;33;52;16","昔はスーツを着ていればどうにか収まった格好がてましたけど、スーツを着なくなって。"
"大坪1","00;33;52;20","00;34;01;13","パンプスを履かなくなって、スニーカーで。今日はちょっとね。ブーツですか。スニーカーで歩くようになって楽になりましたね。"
"しんめい1","00;34;01;26","00;34;08;05","ああ、そうですか。"
"しんめい1","00;34;08;10","00;34;12;57","何か最近僕も。"
"しんめい1","00;34;13;02","00;34;27;15","本を出してから人前で何か出ることがちょっと増えたんで、全く服に気を使わなかったんですけど、スタイリストさんとかにも全部選んでもらって。"
"大坪1","00;34;27;19","00;34;29;47","やっぱりスーツじゃない時もあるんですけど。"
"しんめい1","00;34;29;52","00;34;50;23","僕の場合は何か組織に属しているとかではないので、どっちかっていうとスーツスタイルじゃない方が、メディアさん的にも多分僕がいいのかなっていう立ち位置のことが多いんですけど。"
"大坪1","00;34;50;28","00;34;52;27","何かアクションに目覚めましたか？"
"しんめい1","00;34;52;32","00;35;00;04","あー、でもとにかくスタイリストさんが選んでこれがいいですっていう服が。"
"しんめい1","00;35;00;09","00;35;28;41","信じられないぐらい高いんですよ。嘘でしょ？っていうような金額が。本当に何て言うんですかね、シャツシャツみたいなものでも45万とかやっぱり1個しますし。で、今はちょっと慣れたんですけど、何でそんなに高いのかが分からなくて、その認知のギャップを埋めるためにYOUTUBEとかでこう色々勉強するんですよ。"
"しんめい1","00;35;28;41","00;35;32;49","なんでこんな高いのかみたいなこと、何が言い落とされているのかみたいな。"
"大坪1","00;35;32;54","00;35;38;11","そういう選んでくれた服っていうのは自分で買い取ったりもするので。"
"しんめい1","00;35;38;16","00;35;53;12","そうやってももう一回買う感じですね。もう服屋さんに行って、もう選んでもらって全部買ってもらうみたいな感じのことを。"
"大坪1","00;35;53;17","00;36;00;04","先にありませんとすると。"
"しんめい1","00;36;00;09","00;36;01;43","大丈夫、大丈夫ですか？"
"大坪1","00;36;01;45","00;36;02;11","大丈夫です。"
"しんめい1","00;36;02;11","00;36;04;43","か？買い取るから。今日スニーカーじゃない。"
"大坪1","00;36;04;43","00;36;09;01","から大丈夫です。このくらいは普段は1万くらい。"
"しんめい1","00;36;09;06","00;36;25;28","ああ、そうですか。じゃあもう余裕で。でもその服は色々高い。買い物した後にこう色々調べるってことをやって、ちょっとずつ。"
"しんめい1","00;36;25;32","00;36;35;04","何が世の中で起きているのか、なんでこう、服っていうものはこんな値段が付くのかとか、自分なりに結果的には探求することによって。"
"大坪1","00;36;35;13","00;36;36;47","そこで探求するんですね。"
"しんめい1","00;36;36;47","00;37;10;51","そうですね。何か納得いかないからすぐ使いますか？でも何かやっぱりね、こう当然トレンドみたいなものがあって、何かこの10年ぐらいは割とカジュアルなカジュアルな服のブームだったと。今、割と転換点でそうなんですかみたいです。何かちょっとフォーマルに回帰していくっていう転換点にあるというふうに。"
"大坪1","00;37;10;55","00;37;12;56","新聞さんからファッションの話を聞くなっ。"
"しんめい1","00;37;12;56","00;37;32;41","て、僕もわかるんですよ。YOUTUBERの人の又聞きなんですけど。なので多分スタイリストさんが選んでくれるのもシャツとかどっちかっていうとスニーカースニーカーしたものよりはローファーみたいな革靴の中でも比較的。"
"大坪1","00;37;32;46","00;37;34;36","スニーカーローファーでしたら。"
"しんめい1","00;37;34;41","00;37;36;26","そうですよ。それが。"
"大坪1","00;37;36;31","00;37;39;32","あったらスニーカーでいいじゃんと思うんです。"
"しんめい1","00;37;39;32","00;37;40;05","が。"
"大坪1","00;37;40;10","00;37;41;52","そうじゃないの。"
"しんめい1","00;37;41;56","00;38;02;02","多分今ね、フォーマル階級の中ででもフォーマルになり過ぎるとちょっと変だからいきなり過ぎるので、ローファーの中でもさらにちょっとスニーカー半分ぐらい要素を持っているものになっていると。"
"しんめい1","00;38;02;07","00;38;07;25","ちょっとそうですね、春の陽気ですね。"
"大坪1","00;38;07;29","00;38;11;46","いや、でも良かったですね。2月よりも2月だったらもっと寒かった。"
"しんめい1","00;38;11;46","00;38;28;24","ですし、何かね、雨天決行したら結構僕はそこでお茶を買ってきます。何ですか、これも一旦高温を続けても、それでも何か割と何か終わって入る本題みたいなものがあれば入っていった。"
"大坪1","00;38;28;24","00;38;33;30","方がいいのか、何したらいいのかと。僕ってどこから記憶。"
"D1","00;38;33;30","00;38;34;22","があれ。"
"大坪1","00;38;34;27","00;38;37;25","でもなんかすみません。私のことばっかり質問した。さすがお上手。"
"しんめい1","00;38;37;40","00;38;39;23","で。"
"大坪1","00;38;39;27","00;38;43;59","元々元々本哲学は好きだったんですよ。"
"しんめい1","00;38;44;04","00;38;44;43","好き。"
"大坪1","00;38;44;48","00;38;51;27","高校の時に勉強した倫理とか。"
"大坪1","00;38;51;32","00;38;58;43","そういうのがなく、突然何か西洋哲学行ったんです。"
"しんめい1","00;38;58;47","00;39;30;40","今思えばですけど、高校時代の倫理の授業とかは興味持って聞いてたと思いますね。そんな真面目な学生じゃなかったですけど、何か社に構えてても興味は隠しきれないみたいな感じだったと思います。大学に入って、それこそ授業にも行かずに家で本を読んでいる時に。"
"しんめい1","00;39;30;45","00;39;49;31","そうですね。何かよくちくま新書とかの西洋哲学の哲学者の名前が付いている入門の本とか手に取って。で、結局何も分からないんですけど、分かったら当時は格好いいと思ってて。"
"大坪1","00;39;49;36","00;39;51;27","でもその前から興味があったんです。"
"しんめい1","00;39;51;34","00;39;56;55","興味あったと思いますね。"
"しんめい1","00;39;57;00","00;40;00;36","ただ、やっぱり。"
"しんめい1","00;40;00;41","00;40;38;06","当時だと2007年、8年とかそれぐらいで、やっぱり新書とかに出てくる流行りの哲学者って言うと、やっぱフランス現代思想とかになってくるんですけど、構造で物を考える人たち、そういうのは何かどうですかね、結構刺激的って言うか、急に世の中のことをみんなよりも分かった気分になれるというか、そういうところがあるんで、めっちゃわんちゃんがいます。"
"しんめい1","00;40;38;11","00;40;46;18","一声して挨拶をし。"
"しんめい1","00;40;46;23","00;40;56;42","そうですね。電話で僕はどっちかっていうと。ありがとうございます。改めました。母のことを気遣っていただいたりします。"
"大坪1","00;40;56;54","00;41;00;09","なんでも実は最近はなんか飲ん。"
"しんめい1","00;41;00;09","00;41;02;06","でるんですか？ちょっとじゃあ交換します。"
"大坪1","00;41;02;10","00;41;08;40","大丈夫です。河川敷は良くないかなとちょっと自分で人体実験してみます。"
"しんめい1","00;41;08;41","00;41;09;54","朝から。"
"大坪1","00;41;09;59","00;41;10;42","何か変わるか。"
"しんめい1","00;41;10;42","00;41;14;36","な。"
"大坪1","00;41;14;41","00;41;21;50","いただきます。ありがとうございます。"
"しんめい1","00;41;21;55","00;42;04;43","結構今、東洋哲学をテーマにした本を書いたっていうだけの素人ではあるんですけど、こう、その辺の領域の哲学者の方とかとお話しする機会があって。で、聞くのが割と文化人類学が哲学の中でも割と最先端な感じになってるっていう風によくなですか、凄く哲学も文化人類学も両方めちゃくちゃ広い話なんで、本当に1口に語れない話だと思うんですけど、何か。"
"しんめい1","00;42;04;48","00;42;17;17","西洋哲学、もうこう、それこそフランス現代思想も最近まで生きてたような方々がやってた哲学って。"
"しんめい1","00;42;17;22","00;43;00;19","ちょっと仏教とか東洋哲学の言ってることに近づいてきてるっていう風に言う。こう言われることがままあって、で、そうかもねみたいな、ちょっとロマンのある話として、何か西洋東洋哲学は西洋哲学を先取りしてたんだみたいなことをね、ちょっとロマンを持って語られることが多かったんですけど、最近いよいよ実際に哲学の世界で東洋哲学と西洋哲学って何がこう一緒で何が違うんだろうとかっていうことを真剣に考える方々が出ていらして、その時に。"
"しんめい1","00;43;00;24","00;43;04;06","文化人類学とか。"
"しんめい1","00;43;04;11","00;43;11;50","の知見がまずこうこう参考にされるというか。"
"大坪1","00;43;11;55","00;43;19;23","異文化研究とかそういうとこなんですかね。西洋的な感じじゃない、打ち出してきたっていうのが。"
"しんめい1","00;43;19;28","00;43;42;52","何ですか、ちょっと僕もちょっと半端な知識で具体名出しちゃうと、それこそいいのか悪いのか分かんないんですけど、何かスピーシーズ人類学みたいなところで、これ僕の理解に基づいて言うんですけど、人間だけじゃなくて。他の種スピーシーズなんで、どうでしょう。"
"しんめい1","00;43;42;54","00;44;25;47","例えばゴリラから見たとか、猿から見たとか、植物とか植物とか、そこから彼らにも彼らの世界があって。で、要は人間中心じゃないところでいろんな目線があって、世界っていうものは何か、人間はなんとなくこう、世界は一つ何かこう、地球にいろんな国があって、その中で例えば私は日本に住んでいてみたいな大きな一つの世界っていうものがあるものだと思って生きてたりしがちなんだけども、実際は。"
"しんめい1","00;44;25;51","00;44;32;06","猿とかから見た世界っていうものも。"
"しんめい1","00;44;32;11","00;45;04;03","同時にあるというか。で、もう別々の世界から別々の見方があるっていうのが、昔仏教の哲学でいう意識って言われるような、それぞれ一つ一つの心が一人外宇宙みたいな言い方して、だから要は世界が一つじゃないみたいな考え方っていうものが、そこと接続したりとかっていうところで、哲学の中で。"
"しんめい1","00;45;04;08","00;45;41;02","本当に思考を巡らせて、どんどん展開させて考えていくっていうよりは、文化人類学みたいに実際のフィールドに入って、人間の社会でもそうですし、あとはもしかしたら動物の世界とか、そういったものからの視点っていうものを生のものとしてこう取り上げてくるっていうのが、結局哲学から見た時に最先端になってるみたいな、そんなことってずっとずっと喋ってたんです。"
"D1","00;45;41;07","00;45;43;39","どうでしたか。"
"しんめい1","00;45;43;43","00;45;46;40","ですかね。"
"D1","00;45;46;45","00;45;53;27","一応そういうところと。"
"しんめい1","00;45;53;31","00;45;57;02","個性。"
"しんめい1","00;45;57;07","00;46;00;13","って、僕も個性を出そうとして失敗してるので。"
"大坪1","00;46;00;18","00;46;01;03","そうなんですか。"
"しんめい1","00;46;01;03","00;46;05;32","何も言えないですが、どうですかね。"
"D1","00;46;05;37","00;46;15;04","でもこれでは物足りないと。値段で言ったらユニクロと変わらないような競争じゃなくて選べる。"
"大坪1","00;46;15;08","00;46;20;09","最近の学生は貧しいからユニクロは高級品だ、自由だ。"
"しんめい1","00;46;20;09","00;46;20;51","って。"
"大坪1","00;46;20;55","00;46;24;19","説があります。"
"大坪1","00;46;24;24","00;46;28;40","が、どういうふうに思われてる？"
"大坪1","00;46;28;45","00;46;35;37","みたいです。高いものを求めてるので、安いものを。"
"しんめい1","00;46;35;42","00;46;51;16","服はやっぱり自分っていう存在にものすごい影響を与えて関わるものだなっていう気はしてて。やっぱりアイデンティティーとすごい密着した存在だなとはよく思っても、何か。"
"しんめい1","00;46;51;21","00;47;09;05","エッセイなんですけど、東洋哲学をテーマにしたもので、書くのに大体34年かけたのがあって。だから僕は多分本当に何の専門家でもないので、普通の人が3、4年も東洋哲学のことばっかり考えてたみたいな感じなんですよね。"
"大坪1","00;47;09;10","00;47;11;23","そんなには考えないです。そうそう。"
"しんめい1","00;47;11;28","00;47;41;26","でもそうするとちょっと自分の中で変になってくるというか。東洋哲学の本書いた人みたいな扱いも公私ともにされるようになると、何かすごく窮屈な感じになってきて、そんな別に東洋哲学の人とかじゃないですみたいな感じになった時に、何かそのスタイリストさんに服を選んでもらったのが自分の中ですごく楽しい体験で。"
"しんめい1","00;47;41;31","00;47;54;21","何か全然違う自分にその瞬間になれる感覚っていうものがあって。で、本当にね、何か東洋哲学って何か全部は幻だみたいな、何か。"
"しんめい1","00;47;54;26","00;48;20;56","そんな感じの世界だから、こう、そこからファッションに興味持つって何かめちゃくちゃ何かやっちゃいけないことをしてるような、一見矛盾するような感じがするんですけど、やっぱ反対のことをやるのは大事だなと思って。なので服にせっかく興味持つきっかけやったし、いろいろ考えてみようかみたいなことは思ってて。"
