,02:21:16:21,02:22:11:17,吉田,難しいですね。 だから男性だから、女性だから、マイノリティだから、あるいは労働者だからっていう、その何だからっていう、やっぱりある程度の予見と偏見に基づいてるわけですよね。 それを一回一回やっぱり括弧に入れてないと。 各個人の平等な存在。 同じ権利を持った存在っていうのをちょっと考えにくいというのは確か。 もちろん、属性による山本さんの言葉が、権力の配分の不均衡っていうのは当然ながらあるんだけれども、その属性だけに基づいて、その民主主義の構成員であることを決めるということの一方のマイナスもあるんじゃないかとは思いますね。 と思います。,,
,02:22:11:19,02:23:46:22,D,,,ありがとうございます。 また、後半もあっという間に過ぎまして、そろそろ次のテーマに行こうかなと思うんですが、今の話を聞いていると、こう残りやすい人に投票するという、当然そういう意味で開かれてきているというか、民主化されて、それこそ民主化というような意味が持てますけれども、政治が民主化されてきたのかなという気もする一方で、何かその。 今が政治のエンタメ化でもあり。 ポピュリズムみたいな話もあるんですけど、一方でちょっと経済の話に話をスライドさせることは、その場所が世界初の先物取引市場があった堂島でもありですね。 何かそれこそ今、資本主義と民主主義って、双子のようにアメリカなりヨーロッパの民主国家ではない話ですけど、資本主義の話でもう無視できないというか。 民主主義を語る上で無視できない、というか、何かこの辺どうですかね。 もう完全に飲み込まれていたという状況なのか、どういう関係なのかという、これをまだあえて山本さんから聞いてみようかなと思うんですが、いかがでしょうか。
Lavender,02:23:47:00,02:25:58:23,山本,,と、欲望の資本主義の。 資本主義と民主主義が相性よく見えるっていうのは、まあその通りなんでしょうけどね。 歴史振り返ると。 別に社会主義国だって民主主義だって言うわけだから、それの関係がどうなってるのかっていうのも話題にはなるかなっていうふうに思いますね。 現代において、その資本主義と民主主義、資本主義が民主主義を飲み込み始めているっていうのは、確かに当てはまる部分がいくつかあるっていうふうに思います。 現代において資本主義と民主主義、資本主義が民主主義を飲み込み始めているというのは。 どういうことかっていうと、その私らの投票行為っていうのが、消費者としての行為に限りなく似て見えてしまうっていうところですよね。 それは別に悪いことなのかっていうと全然悪いことではなくて。 だから。 どう言ったらいいんでしょうね。 資本主義に飲み込まれることが飲み込まれてるっていうことが一体どういう点で問題なのかっていうのを洗い出す必要があって。 もちろんどうしたらいいんでしょうかね。 選挙の結果まで賭けの対象にするとかね。 そういうのは倫理的に云々ということは可能かもしれないけど、むしろその資本主義を支えていく自由の理念っていうものは、投票行動であったり、私たちの日々の政治参加にとっても大切なものですから、飲み込まれてるっていうよりは、やっぱり常に緊張関係を持ってて、今の私たちの行動っていうのを縛ってるというか、規定してるというふうに理解しますけどね。 GMどうでしょう。 うん。 まず口火を切ったぐらいのもんですが。,
Lavender,02:25:59:01,02:28:13:02,吉田,久々とさっきの貴族制、あるいはブルジョア階級社会の名残が議会制民主主義だというふうに言いましたけど、そもそも論で言っちゃうと、ではなぜ例えばブルジョワは王権を制限したかったのかっていうと、商業の自由、それから私的財産の所有権、これを守るためにそもそも民主化って始まったんですよね。 だからそういった意味では、実は民主化と資本主義って最初からある種緊張関係をはらんでいる部分もあるし、ある種、資本主義が民主化を促進させたっていう部分があると思うんです。 ちょっと前にプーチンに結果的に暗殺された何万の言っていましてね、民主活動家で彼で、僕すごく不思議だったのが、彼は殺されるってことを知ってて、ロシアに帰国するわけですよ。 ドイツで暗殺され、戦争になってね、治療してロシアに戻るんですね。 僕、それがすごく不思議だった。 なんでこの人はそんなことできるんだろうというね。 彼の自伝を読んだんですけど、面白かった。 彼が自由っていうものを最初に知ったのって、ペレストロイカがあって、アメリカから作文広島の話じゃないんですけど、ガムが入ってきた。 で、ソ連製のすごい粗雑なガムに比べてすごくおいしかった。 これが自由な味だっていうふうに言うんですよ。 で、で、それを守りたいと思って、自分は民主化、民主化、民主化の活動家になったって言いんですけど、やっぱり資本主義がやっぱり内在させてる人間を解放する。 先ほど言った属性とか階級からっていう部分と、故に金を持ってる奴の方が偉いっていう、あるいは権力を持っちゃうで、それは民主的な権力ではなくて、政治的な権力じゃなくて、やっぱり経済による権力ですよね。 そういった意味では常に民主主義と資本主義って緊張関係の部分もあるし、一方で共犯してる部分もあるし、それゆえにいつも資本主義を考える時は民主主義の問題を考えなきゃいけないし、民主主義の問題を考える場合は資本主義の問題も考えなきゃいけないという意味では、 こうある種双子みたいなものなんだろうなというふうには歴史を見て。,,
Lavender,02:28:13:02,02:28:51:01,大津留,,,そこで一生懸命働いてるんだけれども、でもやっぱり資本主義の中で、いわゆる日本でいうと負け組のような形で、自分で自分のことを支えきれない人がいる時に、社会がそれにどう対応していくのかっていう、そういう隙間が必要ですよね。 だから政治が100%資本主義に重なるのではなくて、そういう社会保障の枠をどこかから絞り出しながら、トータルな政治をやっていかなければいけない。 そうというか、どこまで守られていくのかなっていう。
Lavender,02:28:51:03,02:30:06:00,吉田,立憲主義的民主主義というよりも、これは立憲主義、法の支配ということだと思うんですけど。 つまり一人1票あります。 あるいは表現の自由が保障されています。 報道の自由が保障され、知る権利が保障されてますって、それって属性とか金持ちとか貧乏に関係なく与えられている権利ですよね。 それがやっぱり民主的な社会のある種のベース、土台を結果的に作っていくっていう風になるんですよ。 正直、あまりにも住みすぎると、それは経済力が、資産が、政治権力と癒着を今のトランプ政権みたいにそういうことになってしまうので、そうではなくて、我々にはお金はないかもしれないけど、声を上げることができる、あるいは公共の場で集会をして、反対の声を上げることができる。 それはやっぱり憲法で保障されてるから、そういうことができるわけですよね。 そういった、やっぱり立憲主義が本来的に資本創造とか、そう考えと民主主義と資本主義じゃなくて、立憲主義と資本主義っていうものが対立鋭く対立するのかもしれない。,,
,02:30:06:02,02:30:16:21,大津留,,,の中でもアメリカもそうですけども、巨大なお金を持ってる人達が政治に1票以上の影響力を及ぼすことができるようになってくると、なかなか力のないものっていうのが誰にどうケアをされていくのか、日本も含めて心配なところかなと思います。
,02:30:16:23,02:30:17:08,吉田,そういうことですよね。,,
,02:30:17:08,02:30:30:18,大津留,,,ことができるようになってくると、なかなか力がないものっていうのが、誰にどうケアをされていくの？日本学みたいな心配なの？
Lavender,02:30:30:20,02:31:51:20,吉田,先程の新自由主義からの転換みたいな話と関係するんですけども、例えばやっぱりリーマンショックがあって、991%みたいなオキュパイウォールストリート運動もあって、それでやはりガーッとここにきて資本主義を抑制しなきゃいけないっていう方向に逆に振り子が触れたわけです。 それが今の国家資本主義的な、つまり国が前面に出て、それは高橋政権も言ってますけれども、いろんな投資を、これをやっていかなきゃいけない。 アメリカ、アメリカでこのままだ、中国に収奪されるわけにはいかないって言って、国境の壁を高くする。 ヨーロッパはヨーロッパで今アメリカに完全にAIとかそういうので出遅れてるので、EUとして投資をしていこうというふうになった。 日本は日本でこのままだと衰退をしていくので、国が民間じゃなくて企業でなくて、国が主導して、率先していろんな産業セクターに投資をして、国家資本主義の時代に今なってきてるんですよね。 で、それがやっぱりあまりにもその、だから何事もニュートラルじゃないので、良い悪い面と悪い面があるとは思うんですけれども、そういう反資本主義というものに対して国家が今再び強い国家って言うのが顔を覗かしている局面に入ってきてるんじゃないかと思います。,,
Caribbean,02:31:51:22,02:33:22:20,山本,,他方で、有権者とか市民の視点から見ると、やっぱりほら、ニーサどんどんやりなさいよとかね。 あなた方は皆さんご自分で資産運用するんですよ。 無年金にならなくて当然ですよとまで言わんばかりの状況で、要は選挙で選ぶにしたって、公共の場所で議論するにしたって、要はそれって結局どういう点が美味しいの？ って。 要はちゃんと僕らが生きてる間に利益ちゃんと返ってくるのって、そういう投資家マインドとまでは言いませんけれども、非常に短期的な利益を、あるいは利益の幻想を与えてくれる人たちに、どうしたって飛びつかざるを得ないような状況っていうのがあるんだろうっていうふうに思いますね。 その辺を、これはだから、制度やシステムというよりは、政治家たちの人格とかのレベル、あるいはメディア表現のレベルですけど、そういったところを非常にうまくつかんだ言葉を今の政治家さんたち、やっぱりプロやなと思いますけど、うまく選んで使っておられるっていうところがあって、それに飛びつくのか、飛びつくっていう表現がいいかわかんないけどね。 でも、そこに期待せざるを得ないところに追い込まれてるっていうふうには思いますね。 それもやっぱり資本主義の一つの結果、現代資本主義の一つの結果なんじゃないかっていうふうに思ってますけどね。 精神的には。,
Caribbean,02:33:22:22,02:33:39:00,吉田,政策を見て投票しようってよく言うじゃないですか。 おそわれるじゃないですか。 あれが教えるじゃないですか。 それって実は僕は民主主義的じゃなくて、資本主義的だと思うんですよ。 つまり、メニューがあって、どれが最適か自分にとって選ぼうねっていう考え方ですよね。,,
Caribbean,02:33:39:05,02:33:40:08,山本,,いい消費者になりましょう。,
Caribbean,02:33:40:10,02:34:29:17,吉田,そういう感じですよ。 賢い消費者になりましょうと。 実は全く同じロジックで、だからこそそういう言説が流布すると思うんですけど、僕はそれは反対で、やっぱり信じる力と、むしろ、あるいはこれを実現したいんだという思いがあって初めて政策っていうのが出てくるので、そういう。 さっきの教育の話とも関係するんですけど、こういう社会に生きたいんだっていう、自分が自分の力だけでは物事は変えられないので、仲間を見つけてこういう社会を実現していけるんだっていうことを、子供の頃からそういう欲望を持っていいんだよっていうことを教えられてるかどうか。 日本であんまりそういう機会ってないんじゃないかと思うんですね。 そこに例えばアメリカと比べたらすごい違いがあると思うんですよね。 そこところはアメリカと比べたらすごい違いがあると。,,
Caribbean,02:34:29:17,02:35:12:11,大津留,,,変なところ。 そういう価値に入り込むと歪んでいる。 偏向教育であるとかそういうことを言われたくないので、教科のレベルより先に行こうとしないで、その子供たちがお互いの価値観を言い合って喧嘩するような状況になってもいいはずなのに、学校で喧嘩をするなんていうことはやっ。 っていうので、こう枠にはめて。 何を怖がってるのか、誰を怖がってるのか、逆に誰がより良い教育って何なのかっていうことを出していくということができているのかっていうのが。
,02:35:12:12,02:35:17:19,吉田,てる。変更しないで生きていけるってなんで思えるのかすごく。,,
,02:35:17:21,02:36:19:14,山本,,本当にそれが教育なりそうね。 若い子に向けてはそういう風になってますよね。 若い頃はほんとにほんとにいい意味じゃ本当にいい子なんだけど、本当にポジティブなことしか何と言っていいのかな。 批判のし方をあまり上手じゃない僕、僕に言わせると上手じゃない。 うん。 だからいい子、いい子は言えるけど、うん、それってこれ足らんし、これはどうなの？とかっていうと、何かネガティブなこと言ってる人に見えちゃうんだよね。 でもそれって実はそれこそ討論や議論には絶対必要なことだから、それをね。 だから議論をエンタメ化して見せる。 見せてきたら朝まで生テレビみたいなのが悪いんだと私は思うけど、やっぱりその。 場合によっては傷ついたりもしますよね、議論してるとね。 それをどう見せて、どう教えていくのかっていうのは、あるいは自分がどう実践していくのかっていうのは難しいところでね。 場合によって傷ついたりもしますよ、それはね。,
Gray,02:36:19:16,02:37:06:19,吉田,批判っていうと、なんとなく学生が引いちゃうところがあるので、僕は相対化っていうんですよね。 正面から見ると黒に見えるかもしれないけど、裏から見たら白かもしれないでしょう。 それを相対化する力ってんでしょう。 で、相対化するというのは、批判的に物事を見るってことでしょう。 批判的にものを見たら裏から見て、上から見ても下から見て見よう、それがある種教養でしょっていうふうに教えますよね。 そうじゃないと、つまり今の瞬間最大風速的に今だけ、ここだけの価値尺度に囚われちゃう。 それに取られると人間不信になる。 不自由になるばかりか、卑屈になってくるでしょう。 今この尺度しかなくて、そこに乗るか剃るかしか選択肢しかないと自分で尺度を作れる。 そうすると、人間って自由になるんだという方がいいじゃんっていうふうに言ってるんですけどね。 言ってるんですけどね。,,
,02:37:06:21,02:37:23:06,山本,,で自由になるようなものだというふうに日本なんですね。 ほんとそうですよね。 だからこう、自分の中に複数の複数の声を持つとか、複数の視線を持つっていうことを多分やっていると思うんですね。 若い子もね、持っているとは思うんだよ。 それの表し方がわからへんという感じというふうに思うんですけどね。,
,02:37:23:08,02:37:28:16,大津留,,,批判というと否定になって、その先に何か一緒に作るっていうところに。 自分を振り返りながら、批判は視点になってなかったかと。
,02:37:28:16,02:37:34:10,不明,,,っていうところにつないでいけない。
,02:37:36:19,02:37:37:15,山本,,なので振り返りながらです。,
,02:37:37:17,02:37:43:21,大津留,,,視点になってなかったんです。
,02:37:43:23,02:39:11:21,D,,,ありがとうございますも後半も結構いい感じの時間まで来てるんですが、ちょっと最後もまた歴史の話をグリグリと。 歴史の話もゆっくりと広がる中から、そういうものなんだと思っていただいているのが、ちょうど公会堂もそうですけれども、大阪商工会議所とか証券取引所も東京より先にあってですね、要は資本主義、日本の資本主義が大阪から始まってるみたいな言い方をしようと思えばできるということがあり、なんかこう来たから商人みたいな話を民主主義との立憲主義との対立軸がある という話もありましたけど。 何か大阪ならではの対立させない知恵みたいなのがあるのかなと思うんだが、そうなのかよくわかりません。 お答えしたんですけど、どうですか？これも大阪商人の研究とかがもし先行して、もし思い当たることがあれば聞いてみたい。 この後、福沢諭吉の話も全然今の段階で広まってるんですけど、何かそういう。 ちょっと歴史を振り返ってみてもいいから、もうないでしょうか。
Tan,02:39:11:23,02:40:32:06,山本,,いや、それね、水を差すようであれやけど、その神話やと思ってんのよね。 僕は。 それって確かにそういう例もあったし、それを大事な伝統として抱き続けてる人たちを全然邪魔するつもりはないから、その水をかけるつもりもないないんですけど、別にいろんな地域であるよ、そういう強い精神強い商人たちが金っていうパワーを持ってるわけだから、それで自分たちの自治権を伸ばしていくってことは、いろんな地域であるはずなんだけど、大阪は近代以降、大大阪の時代も力、特にマスメディア持っ てたから、言論の影響力が強かったから、大阪がそれで勝ち残っていったというか、その大阪イコール反骨精神で自由な商人文化っていう言論がいっぱいあったっていうことなんだっていうふうに私は理解してるんですよね。 だからその大阪のみならず、日本のいろんな都市部で、商人たちがフィランソロピー的にメディアを持ったり、クラブをつくったりやっていたっていうのはあるんだっていうふうに思いますね。 だから、そこで大阪らしさを出すなら全然邪魔をしないんだけど、別に出さ出すとこうケンミンショー的になるかなという感じはしますね。 違いますね。 確かに。,
Tan,02:40:32:06,02:40:33:05,D,,,はしますね。
Tan,02:40:33:07,02:40:49:19,吉田,でも商業と資本主義って違いません。 やっぱり。 で、とりわけ東京とか、あるいは他の札幌とか仙台と比べると、大阪って資本主義じゃなくてやっぱ飽きないなって感じがするのはなぜなんでしょう。,,
Tan,02:40:49:19,02:42:45:07,山本,,それはですね、あれですよ、私の先程の話に戻るんですけど、戦後のメディア文化が作ったものだというふうに私は思ってるんですよね。 つまり、その商人の合理性を何と言ったんやろう、人間と人間同士の付き合い、損して得とれみたいな商人の規範みたいなものっていうのが、やっぱりこう、特に私が関心を持って調べたのは、花とか箱とかの、どう言ったらいいんでしょうね。 タイトルが出てこないなと。 どてらい奴とか、そうそうそうそうそうそうそうそう。 あなたもいや、あなたも美千代さんが出てたあれなネタなぞとかっていうので、割と刷り込まれてるところがあるんじゃないかっていうふうに思いますね。 で、それと今、吉田さんがおっしゃられたこととつなげて言うと、そうは言っても、それは確かに僕は神話だ、メディアが作った神話だと思うんだけど、その神話に向けて実際に行動した人たちの蓄積っていうのは確かにあって。 うん。 だから大阪商人ってこういう問題や、ほんなら僕も私もこういうふうに、ある意味社会の中で演じて振る舞おうって思った人たちはたくさんいるから、そういった人たちが事後的に神話をなぞって商いの街を作っていくっていうのは、そこかしこにあるっていうふうに思うんですよね。 それは船場も近いですけど、船場の第1、小さい店でやってる、未だに残ってますけど、そういうところの商人さん達にも感じますもんね。 やっぱり商いしてる人と人の付き合いやってるんやって、ただ単にそのお金のやり取りじゃないっていうね、それはだからそれは確かに伝統と言えば伝統と言えるかなって思いますね。,
Tan,02:42:45:08,02:43:00:06,吉田,逆にでもそれが大阪のある種経済的な後進性になっちゃってるわけですよね。 非効率だから。 だから大阪が実は大阪らしさを目指せば目指すほど、東京と差が開くっていう逆説にならないですか？そうする。 東京、なるほどなるほどねと。,,
Tan,02:43:00:07,02:43:05:22,山本,,いや、だから先程の話に戻りますけど、JR大阪駅前が東京化しているのかということなんだと思いますね。 むしろむしろ今誰も船場を中心地と思わないんですよね。 町も。,
Tan,02:43:06:04,02:43:07:05,吉田,でも、同じ土俵で勝負すればするほど勝てなく。,,
Tan,02:43:07:05,02:43:14:09,山本,,勝てなくなってなくなる。,
Tan,02:43:14:09,02:43:23:06,吉田,それは明らかに東京なんかに勝てるはずないわけじゃないですか。 だったらなんで違う尺度で勝負しようとしないのかなというのが不思議ですね。,,
Tan,02:43:23:06,02:43:25:02,D,,,勝負しようとしないのかなと。
,02:43:25:04,02:43:41:23,山本,,かなっていう、確かにね。 だから2番の位置を一生懸命保持しようとすると3番、4番になっちゃうっていう典型例かなという気もしますけどね。 でも一番は目指せないし、というところが現代のちっちゃく。,
,02:43:42:01,02:44:01:02,大津留,,,ちっちゃくても何か他と違うってね。 地場産業、何かね、南の方あるじゃないですか。 工学部なんかはそこ。 連携をして、そこでしか作れない何かに技術的なサポートがあって、一緒に作り上げていくっていうのが、本当にその数では勝負できないけれども、ここしかないっていうのがね、何かこう。 光って。 っていうのもありかな。
,02:44:01:04,02:44:02:23,山本,,そうですね。,
,02:44:03:01,02:44:10:12,大津留,,,本当に数では勝負できない。 から、何か。
,02:44:10:14,02:44:11:17,吉田,中小企業、高付加価値の経済を目指すんだ、イタリアはそういうので来ているところがありますけどね。 そういう道もあるんじゃないかと思いますけど。,,
,02:44:11:18,02:44:15:11,大津留,,,しかてもというのも。
